Key,English,Simplified_Chinese
PROPQUEST_DUNGEONANDPK_INC_000001,P.K,P.K
PROPQUEST_DUNGEONANDPK_INC_000002,Hunting Monsters to recover Karma,击杀怪物以减少罪恶值
PROPQUEST_DUNGEONANDPK_INC_000003,Your Karma can be redeemed. Are you ready to pay for your sins?,你的罪恶可以被赎回。 你准备好为你的罪付出代价了吗？
PROPQUEST_DUNGEONANDPK_INC_000004,Hunt $QUEST_END_KILL_COUNT$ $QUEST_END_KILL_NAME$.,击杀 $QUEST_END_KILL_COUNT$ $QUEST_END_KILL_NAME$.
PROPQUEST_DUNGEONANDPK_INC_000005,You have yet to pay for your sins…,你还没有为你的罪恶付出代价...
PROPQUEST_DUNGEONANDPK_INC_000006,Your quest has been accomplished. Your sins have been forgiven.,任务完成，你的罪恶已被赦免。
PROPQUEST_DUNGEONANDPK_INC_000007,"If you are truly unwilling to fight for forgiveness, then there is no hope for you.",不想赎罪？那你真的无可救药了
PROPQUEST_DUNGEONANDPK_INC_000019,Hunting $QUEST_END_KILL_NAME$ will recover your Karma points.,为了减少你的罪恶值，你要去击杀 $QUEST_END_KILL_NAME$ 回来。
PROPQUEST_DUNGEONANDPK_INC_000376,Get the Key to escape Kebaras Island,获取逃离卡巴拉斯的钥匙
PROPQUEST_DUNGEONANDPK_INC_000377,You can warp away from here at the Warp Zone but you need the Key. Are you ready to earn it?,有钥匙的话可以在路两边的尽头传送出岛，你准备好去获取钥匙了吗？
PROPQUEST_DUNGEONANDPK_INC_000378,I will give you the Key if you can bring me $QUEST_END_ITEM_COUNT$ Beads of Sin. You can get the beads in the empty lot beside the campsite.,拿来$QUEST_END_ITEM_COUNT$解脱水晶球，我就带你离开这。你可以在营地旁边找到它。
PROPQUEST_DUNGEONANDPK_INC_000379,How long until you are ready to leave this place?,不知道你何时可以逃脱这个阴暗之地...
PROPQUEST_DUNGEONANDPK_INC_000380,Here is the Key. Now go and never return.,钥匙给你，走吧，别再让我看到你。
PROPQUEST_DUNGEONANDPK_INC_000381,I will give you your freedom for only $QUEST_END_ITEM_COUNT$ beads. How could you pass on an offer like that?,只有拿来$QUEST_END_ITEM_COUNT$解脱水晶，我才会给你自由。
PROPQUEST_DUNGEONANDPK_INC_000382,Keep gathering your beads.,收集旁边地上的珠子（盒子
PROPQUEST_DUNGEONANDPK_INC_000390,You are welcome to stay for as long as you would like.,难道你这么喜欢这个岛屿吗?那~你就继续留下来吧!
PROPQUEST_DUNGEONANDPK_INC_000420,Entering the Dekane Mine,进入达肯矿洞
PROPQUEST_DUNGEONANDPK_INC_000421,You are really willing to enter the Dekane Mine?,你真的想进入达肯矿洞吗?
PROPQUEST_DUNGEONANDPK_INC_000422,"Then visit the Dwarpet, Rankashu, in front of the Dekane Mine.",帮我去找“小草儿”询问一下关于矿山的事情好吗？你去达肯矿洞前面就会找到他了。
PROPQUEST_DUNGEONANDPK_INC_000423,Ha ha ha. Of course not. It is far too frightening.,噗！我就知道你会这样。你觉得很恐怖吧！
PROPQUEST_DUNGEONANDPK_INC_000424,Here is the Mine Entrance Card. It is up to you to enter but I advise against it. You may die.,谢谢你啦～这是可以进入矿山的通行卡到时候.变成灵魂出来也不要埋怨我喔～
PROPQUEST_DUNGEONANDPK_INC_000425,Is it so hard to tell me what I want to know? Leave quickly.,帮我问个事情有那么难吗？真是一个无能的家伙啊！快去问一问回来好不好啊？
PROPQUEST_DUNGEONANDPK_INC_000426,Visit the Dwarpet Rankashu and get the information Cell wanted.,去找小草儿之后，帮飞儿询问消息。
PROPQUEST_DUNGEONANDPK_INC_000429,You have the Mine Entrance Card. Now to find out what everyone is so afraid of.,终于拿到可以进入达肯矿洞的道具了.为什么大家都很讨厌进入这里呢？难道有什么秘密吗？
PROPQUEST_DUNGEONANDPK_INC_000431,Keakoon in Mine (1),矿山里的奇昆族（上）
PROPQUEST_DUNGEONANDPK_INC_000432,"I am Drian son of Nevil, great chief of the original Keakoon. We were once friendly with the humans.",我是奇昆族族长蓝彼的儿子德里安.呵呵～我们奇昆族在很久以前与人类相处的很好呢～
PROPQUEST_DUNGEONANDPK_INC_000433,We helped humans develop the mine long ago but when they left some of us were locked up by a new breed of Keakoons.,当时、矿山正在开发，与人类相处的很好。可是我们现在离开了人类，过着很悲惨的生活。
PROPQUEST_DUNGEONANDPK_INC_000434,My father is old and cannot last much longer in his prison. Please help me rescue him.,而且我老爸现在年纪也不少了，可是在牢里受困，你可以救出我的爸爸吗？
PROPQUEST_DUNGEONANDPK_INC_000435,"The key to the cell where my father is being kept has three pieces. These false Keakoons are inside, keeping them hidden. Go and bring them to me.",关押我父亲的牢房的钥匙有三片，被假奇昆们藏起来了。去把它们带给我吧。
PROPQUEST_DUNGEONANDPK_INC_000436,How could you? To think I thought to count you as a friend.,你怎么能这样？我竟然还把你当朋友。
PROPQUEST_DUNGEONANDPK_INC_000437,Oh… Thank you… so much. I could never repay you fully. Thank you so much.,呜...呜...真的谢谢你啊～
PROPQUEST_DUNGEONANDPK_INC_000438,You have to gather all three pieces of the Key.,3块钥匙片长的不同，所以你要得到3块不同的钥匙块才可以，谢谢你啦～
PROPQUEST_DUNGEONANDPK_INC_000439,Hunt Keakoon and get all 3 pieces of the prison key.,猎杀奇昆后，搜集3块不同的钥匙片回来。
PROPQUEST_DUNGEONANDPK_INC_000442,You have delivered all the pieces of the key but it looks like he still has something to say.,搜集到3块钥匙了，他好像还有些话想对我说的感觉呢...
PROPQUEST_DUNGEONANDPK_INC_000444,Keakoon in Mine (2),矿山里的奇昆族（中）
PROPQUEST_DUNGEONANDPK_INC_000445,I still have a need for you. Would you help me yet again?,其实......还有一件事情想拜托你，可以帮我救出大牢里的我爸爸吗？拜托啦～
PROPQUEST_DUNGEONANDPK_INC_000446,You are a true friend. Take this key and free my father. I am not strong enough. Please.,你真是我的好朋友啊！这是大牢的钥匙，帮我就回我爸爸的话，我一定会报答你的.拜托你了。
PROPQUEST_DUNGEONANDPK_INC_000447,You show yourself to be no better than the fiends that imprisoned my father.,难道人类真的这么不可信任吗？
PROPQUEST_DUNGEONANDPK_INC_000449,My father is in a prison on the outskirts of Keakoon village. Please hurry he cannot last much longer.,我爸爸他关在奇昆村最右边的一个大牢里，快去帮我救他～
PROPQUEST_DUNGEONANDPK_INC_000450,"Rescue Nevil, father of Drian.",把大牢里的蓝彼救出来。
PROPQUEST_DUNGEONANDPK_INC_000453,You have saved Nevil. Go and talk to him.,把得安的父亲蓝彼救出来了，向蓝彼对话看看好了。
PROPQUEST_DUNGEONANDPK_INC_000455,Keakoon in Mine (3),矿山里的奇昆族（下）
PROPQUEST_DUNGEONANDPK_INC_000456,"Many thanks, friend. You have done so much for us but would you do something more?",真的是很感谢你啦～看你能够把我救出来，你一定是一个很厉害的战士。所以啊～你可以在帮我一件事情吗？
PROPQUEST_DUNGEONANDPK_INC_000457,Please defeat the Elite Keakoon Guard Leader and bring me the Chief Sign that proves I am the one true Chief of the Keakoon. Would you also please bring me the cargo my son Drian is keeping safe for me?,我有两件事情想拜托你，首先、我要证明我是奇昆族的族长，需要猎杀[精英奇昆警卫队长]帮我找回印章。第2件事情就是，请你去找我儿子，拿回我的行李。
PROPQUEST_DUNGEONANDPK_INC_000458,What kind of person are you if you refuse to help those with less power than you?,你有实力，可是不帮弱者，这哪叫做是一个勇士呢......
PROPQUEST_DUNGEONANDPK_INC_000459,Thank you. It is my great hope that Keakoon and human can thrive together once again. Take this ring as a gift.,谢谢你啦～真希望我们可以像以前一样，可以与人类好好相处，这是我送你的礼物，收下吧！看你来到这么危险的达肯矿洞...你应该很喜欢挑战冒险吧～
PROPQUEST_DUNGEONANDPK_INC_000460,"If, by any chance, you want more adventure visit Bernard in Darken. Be careful. I would hate for something to happen to you.",一说到冒险啊～也没有比这里还要棒的地方了。如果你要继续挑战冒险的话，可以去村庄找“番若迪”喔～说不定你可以抢救这个矿山。这是到下一个地区钥匙，收下吧！
PROPQUEST_DUNGEONANDPK_INC_000461,Hrmm… It might not be that dangerous for someone as strong as you.,嗯...你都可以把我从大牢里救出来了，所以对你来说应该不是一件困难的事情啦！
PROPQUEST_DUNGEONANDPK_INC_000462,Bring the seal of the chief and the package that Drian is holding back to Nevil.,将德里安身上的“族长的印章”与“行李箱”带回给蓝彼。
PROPQUEST_DUNGEONANDPK_INC_000465,"You rescued Nevil, chief of the Keakoon. You can feel the secrets around this place. Maybe you can get some information from Bernard.",一进矿山就见到奇昆族，帮他们解决问题了，以蓝彼说的来看，这个矿山好像还有很多秘密...我应该要去找番若迪问问看才对。
PROPQUEST_DUNGEONANDPK_INC_000467,Death Mine and Roaches (1),死亡的矿山与巨械毒花（上）
PROPQUEST_DUNGEONANDPK_INC_000468,Hmm… Is that the ring of Nevil around your finger?,嗯...你手上带的戒指，那个不是蓝彼的戒指吗？嗯... 你把蓝彼救出来了，对吧！
PROPQUEST_DUNGEONANDPK_INC_000469,Your strength has been proven then. Would you prove yourself further? The Roach is somehow connected to the death of people in the mine.,那你可以帮我一件事情吗？以前有很多人死在矿山里面，我想应该是跟巨械毒花有关系。
PROPQUEST_DUNGEONANDPK_INC_000470,There is a mystery to be unlocked here. Would you bring me the blood of the Roach larva?,我为了研究巨械毒花所以需要他的血液，你可以帮我搜集吗？
PROPQUEST_DUNGEONANDPK_INC_000471,Thank you. There are two kinds of Roach - Pink and Blue. Break open their eggs and hunt down the larva.,谢谢你喔！毒花有分２种，一种是粉红毒花、另一种是蓝毒花。只要找到他们的卵并打开，将卵里面的乳虫打败就可以得到它们的血液了。
PROPQUEST_DUNGEONANDPK_INC_000472,There will be no revelation without danger.,没有危险就没有启示
PROPQUEST_DUNGEONANDPK_INC_000473,"Ahh, there is much to be learned from the blood of these Roaches.",真的很谢谢你啊～现在我把关于巨械毒花的资料全部都搜集好了。
PROPQUEST_DUNGEONANDPK_INC_000474,No! No! No! Bring me more information!,不！不！不行！再探，再报！
PROPQUEST_DUNGEONANDPK_INC_000475,Bring the blood of Roaches by destroying their eggs and defeating Roach Larva.,经过奇昆地区之后，打碎粉红毒花与蓝毒花的卵，搜集它们的血液。
PROPQUEST_DUNGEONANDPK_INC_000478,Looks like he still has a need of you.,搜集“乳虫树液”拿给他之后，他好像要拜托我其他的事情呢...
PROPQUEST_DUNGEONANDPK_INC_000480,Death Mine and Roaches (2),死亡的矿山与巨械毒花(2)
PROPQUEST_DUNGEONANDPK_INC_000481,The toxicity of Roaches has poisoned many humans in the mine.,我使用你帮我搜集的“乳虫树液”来研究后，找到以前那些人在矿山里无原无辜死掉的原因了，都是因为巨械毒花的毒而引起的。
PROPQUEST_DUNGEONANDPK_INC_000482,It seems that the Roach Queens are the source of the poison.,似乎这个毒是来自于毒花女王的。
PROPQUEST_DUNGEONANDPK_INC_000483,Bring me the blood of Pink and Blue Roach Queens so that I can make a vaccine.,我要制造预防这些病菌的疫苗，你可以帮我从蓝毒花女王身上采取她的血液给我吗？
PROPQUEST_DUNGEONANDPK_INC_000484,Sprinkle this liquid on the Roach Queen egg to wake her up. Be careful.,将这种液体洒在毒花女王的蛋上以唤醒她。但请当心。
PROPQUEST_DUNGEONANDPK_INC_000485,You really will not see this through to the end?,反正你已经接手了，那麻烦你帮我做到底好吗？不然，你不觉得有一种，你去厕所之后，没擦屁股的感觉吗？
PROPQUEST_DUNGEONANDPK_INC_000486,This vaccine will save many lives. Thank you.,因为你的帮忙，我可以给死去的那些人一个交代了。只要有这个药水它们应该不会再乱来了！
PROPQUEST_DUNGEONANDPK_INC_000487,Take this weapon as a token of gratitude and this card to venture deeper into the mine.,这个武器是我送给你的，还有这张通行卡，可以进入矿山的里面。
PROPQUEST_DUNGEONANDPK_INC_000488,The Roaches appeared very suddenly in the mine. Maybe you can find out the reason by going deeper into the mine.,矿山里面突然冒出一堆巨械毒花，我觉得很诡异。我猜进到里面应该会找到原因吧！
PROPQUEST_DUNGEONANDPK_INC_000489,I am sure that you can handle the upcoming danger.,我相信你一定可以解决得。如果、你觉得很累的话，可以多找一些伙伴一起进去也不错啦！
PROPQUEST_DUNGEONANDPK_INC_000490,Gather the blood of Pinky and Blue Roach Queen.,搜集蓝毒花女王的血液。
PROPQUEST_DUNGEONANDPK_INC_000493,Something about the way Bernard talks suggessts that the Roaches were placed in the mines intentionally. Maybe you can find out.,依照番若迪所说的，这些巨械毒花应该是因为一些原因而产生的，我再进去一点看看好了，说不定可以找到我想要的答案。
PROPQUEST_DUNGEONANDPK_INC_000495,Dwarpet Kazen,矮人族“卡斩”
PROPQUEST_DUNGEONANDPK_INC_000496,What brings you here? I am sure you know of the many deaths surrounding this place.,嗯～你来这里干吗？难道你不知道以前这里死了很多人吗？这里不是人类可以进入的地方啦！滚！呵呵～我懂了你是来调查以前为什么有那么多人在这里死亡的，对吧！
PROPQUEST_DUNGEONANDPK_INC_000497,You will not be able to find out what happened here without my help. I will tell you what you want to know if you do me a favor. What do you think?,这样的话～你没有我的帮助应该是很难知道的啦！不然你帮我一件事情好了，那我就告诉你一些情报。如何啊？要帮我吗？
PROPQUEST_DUNGEONANDPK_INC_000498,Bring me 30 Cillin and I will tell you everything you need to know.,呼～好！可是我要先测试一下，你是不是有能力可以帮我。这矿库里有一个叫做矽磷的东西，你去搜集30个回来给我吧！
PROPQUEST_DUNGEONANDPK_INC_000499,"Pssh, some great hero, you cannot even bring me some simple stones.",连帮我捡个石头都那么难喔！那你还想知道矿山的秘密？好笑勒！滚回家啦你～
PROPQUEST_DUNGEONANDPK_INC_000500,Hmm… I did not think you would be back so soon. Take this money as a gift.,嗯...虽然是很简单的事情，可以你还是帮我搜集好了，好吧！从现在开始要进行重要的事情了，这是我的一点小心意，你就先收下吧！
PROPQUEST_DUNGEONANDPK_INC_000501,I said 30. Not 29 or 28. Bring me 30 Cillin.,30个啦！不是29个、也不是28个，是30个。听懂了没有！
PROPQUEST_DUNGEONANDPK_INC_000502,Gather 30 Cillin.,搜集30个矽磷
PROPQUEST_DUNGEONANDPK_INC_000507,Bring Ribenuum,搜集沛拉磷
PROPQUEST_DUNGEONANDPK_INC_000508,I am here in Dekane mining for Ribenuum. In all of Madrigal Ribenuum can only be found in the Darkon area.,我来到达肯矿洞的理由是，为了采集沛拉磷啦！沛拉磷只有在这里才可以采集到的啦！
PROPQUEST_DUNGEONANDPK_INC_000509,Ribenuum is made when a Green Trillipy eats a stone and metabolizes it.,因为啊～沛拉磷是绿色蜥蜴吃了岩石之后，而产生的一个矿石。而且蜥蜴只会在这里出现啦！
PROPQUEST_DUNGEONANDPK_INC_000510,Would you bring me some Ribenuum? A Green Tillipy is dangerous but you look equally as dangerous.,可是啊～蜥蜴很恶劣啦！可是说到恶劣又没有比人类还要恶劣的动物了啦！所以你去帮我搜集好吗？
PROPQUEST_DUNGEONANDPK_INC_000511,Green Trillipy are down the hall to the right. The room to the left is blocked.,绿色蜥蜴出没在，你进来的反方向那边的通路，再往右边进去就会看到它们了，应该是不难找啦！
PROPQUEST_DUNGEONANDPK_INC_000512,"Are you kidding me? Go on and get out of here, I may not look it but I am an old Dwarpet and I do not have time for games.",你现在是跟我开玩笑吗?你现在故意要耍我是吗?
PROPQUEST_DUNGEONANDPK_INC_000513,Ahhh...you brought the Ribenuum. But what is this? It is flawed!,嗯...你有拿30个沛拉磷回来喔～咦？可是这个沛拉磷好像不是好货喔！
PROPQUEST_DUNGEONANDPK_INC_000514,How hard is it to bring me what I asked for? 30 pieces of Ribenuum?,搜集30个沛拉磷，对你们人类来说应该是很简单的事情吧？
PROPQUEST_DUNGEONANDPK_INC_000515,Gather 30 pieces of Ribenuum from Green Trillipy,搜集30个沛拉磷回来吧！
PROPQUEST_DUNGEONANDPK_INC_000520,Refine Ribenuum,精炼沛拉磷
PROPQUEST_DUNGEONANDPK_INC_000521,The Ribenuum you brought is impure. I could take it home and refine it myself but the other Dwarpets would laugh me back to Flarine.,你拿来的这个沛拉磷的纯度不够高啦！对我们来说精炼是很简单的事情。可是拿这种烂货去村子的话，一定会被笑死才对！
PROPQUEST_DUNGEONANDPK_INC_000522,"It will have to be refined in a human village then. There is only one human I trust to do it it right. There is man named Nein, he was one of the last humans to work in these mines. Maybe the very last human.",不管怎样你还是要去村子精炼啦！在人类里可以精炼这个东西的人只有一个，他叫做“罗殷”。
PROPQUEST_DUNGEONANDPK_INC_000523,"Bring these Ribenuum to Nein and have him refine them. Then bring them back to me, would you?",把沛拉磷拿去给“罗殷”精炼之后，在拿来给我，你做得到吧？
PROPQUEST_DUNGEONANDPK_INC_000524,I heard that Nein lives somewhere in the Dead Walderness. He will refine the 30 pieces of impure Ribenuum into 10 pieces of high quality Ribenuum.,听说罗殷他住在龙息荒野附近，把高纯度沛拉磷拿给他吧！精炼完之后该会减少10个啦。
PROPQUEST_DUNGEONANDPK_INC_000525,Are you kidding me? Get lost! I do not have patience for games!,你现在跟我开玩笑吗？如果你是想耍我的话，你就给我滚回家啦！
PROPQUEST_DUNGEONANDPK_INC_000526,"Oh… Thank you, thank you, thank you! Take this necklace and some money with you.",喔～搜集到这么高纯度沛拉磷来了啊！不错喔～拿这个给人类的话，他们应该也不会说什么了！这个项链跟钱是我给你的，你就收下吧！
PROPQUEST_DUNGEONANDPK_INC_000527,Hmmm... maybe I was asking too much of you. You can just go home.,好吧！对你来说可能是一件很困难的事情啦...你就回家睡觉吧！
PROPQUEST_DUNGEONANDPK_INC_000528,Gather 10 pieces of high quality Ribenuum,搜集10个高纯度沛拉磷
PROPQUEST_DUNGEONANDPK_INC_000533,Bring Triduum,搜集特立磷
PROPQUEST_DUNGEONANDPK_INC_000534,"Ribenuum is useless to most humans. Maybe you have a Dwarpet friend you can give it to? Here, let me see it. These samples are too impure and even I cannot refine them without the right materials.",精炼沛拉磷吧...这个东西对我们人类来说没什么用啦！纯度真的是太低了呢～应该没办法这样拿来精炼啦～
PROPQUEST_DUNGEONANDPK_INC_000535,I need a special metal called Triduum in order to refine this. You can get it by hunting Violet Trillipy but they live deep in the Dekane Mine.,如果你要精炼这个东西的话，需要特立磷。这个东西在蜥蜴身上可以得到啦！它居住在达肯矿洞里...
PROPQUEST_DUNGEONANDPK_INC_000536,Well… If you really need the Ribenuum refined bring me 20 Triduums. You are going to need a special ID card to go in there.,而且、你要进去那里需要另外去找通行卡，可是你要精炼沛拉磷，所以也没办法咯～你就去搜集20个特立磷来好了！
PROPQUEST_DUNGEONANDPK_INC_000537,Go and get an ID card from the guys I used to work with.,可是你还是要先去找进入那里的通行证才可以啦！你应该要去找以前在矿山做过事情的人，他们应该会给你一些情报的！
PROPQUEST_DUNGEONANDPK_INC_000538,Ha ha ha.You can do that if you need to. I hope you are not doing this for some Dwarpet.,哈哈哈...如果这是你要需要的东西的话，我是没话说啦～可是如果你是为了矮人族做这些事情的话...我就更无言了～
PROPQUEST_DUNGEONANDPK_INC_000539,"Here is your refined Ribenuum. But, a word of warning, if the Dwarpet Kazen asked you for this… he is thinking more than he is saying.",哈～来！这是帮你精炼好的沛拉磷，拿去吧。这是卡斩请你帮忙的吗？我猜他应该有其他阴谋喔。
PROPQUEST_DUNGEONANDPK_INC_000540,Kazen has hated humans for as long as I have known him and him working with you means he is on to something big. You know… there is a rumor that he had a hand in all the deaths in that mine.,因为啊～他很讨厌我们人类啦！可是他还请你帮他做事情，我猜他应该有其他阴谋才对啦...而且也听说过他跟矿山的诡异事件有相关呢...
PROPQUEST_DUNGEONANDPK_INC_000541,You let me know if he is acting suspiciously. Maybe I can do something to help you.,反正啦～如果你觉得它怪怪的话，马上来跟我说吧！或许我可以帮得上你的忙。
PROPQUEST_DUNGEONANDPK_INC_000542,Why not just let it go? Go home and get some rest.,我觉得你还是不要自找麻烦啦！在这里放弃好不好？
PROPQUEST_DUNGEONANDPK_INC_000543,Get the ID card that will allow you into the room with the Violet Trillipy. Hunt them down and bring 20 pieces of Triduum to Nein.,得到通行卡之后，猎杀毒蜥蜴搜集20个特立磷回来吧！
PROPQUEST_DUNGEONANDPK_INC_000548,ID Card (1),通行卡的下落（上）
PROPQUEST_DUNGEONANDPK_INC_000549,"What? You want to know where the Violet Trillipy live? You seem so curious about this accursed mine. Unfortunately, there are not many people left who know much about it.",啊？你想知道关于毒蜥蜴的事情喔？你的好奇心未免也太大了吧！知道毒蜥蜴的人其实也不多呢～
PROPQUEST_DUNGEONANDPK_INC_000550,Only a few of the mine workers go that deep into the mine. I don't know much about them or the ID card they use to get down there. Oh! You should go speak with Bernard about this.,那里只有少数的人才可以进去啦！对那个地方我是完全不懂啦。对了！你去找番若迪好了，说不定他会知道一些事情。
PROPQUEST_DUNGEONANDPK_INC_000551,Would you please say Hi to Bernard for me?,好吧！你见到他的话，顺便帮我问他最近过得如何好吗？
PROPQUEST_DUNGEONANDPK_INC_000552,"No, you are right. You should not be the next one to suffer.",对啦～不要自找麻烦啦！
PROPQUEST_DUNGEONANDPK_INC_000553,Violet Trillipy… Do you mean you are going in there with them?,你说毒蜥蜴喔......难道你想进去那个地方吗？
PROPQUEST_DUNGEONANDPK_INC_000554,Why not just relax and give it up?,不要自找麻烦了啦～放弃好不好啊？
PROPQUEST_DUNGEONANDPK_INC_000555,"Chat with Bernard, then meet Andre in Darkon 3.",与番若迪交谈，然后去找达肯3的安德烈。
PROPQUEST_DUNGEONANDPK_INC_000560,ID card (2),通行卡的下落（下）
PROPQUEST_DUNGEONANDPK_INC_000561,"Look, I have no problem giving you the ID card… I just do not want to see you die… But if you really insist, then fine. Hunt some Watangka and I will give you the card.",给你通行卡是不成问题啦～可是我不希望你这个人去送死呢。好吧...不然我来看看你有没有那个能力进去好了...你想证明你的实力给我看的话，去猎杀巫民吧！
PROPQUEST_DUNGEONANDPK_INC_000562,If you can hunt Watangka you can probably hunt Violet Trillipy.,嗯！像他这种的话，应该跟毒蜥蜴有得比啦！
PROPQUEST_DUNGEONANDPK_INC_000563,Bye bye then! Take care of yourself…,加油喔！
PROPQUEST_DUNGEONANDPK_INC_000564,Hmm… Violet Trillipy may be stronger than Watangka.,嗯... 毒蜥蜴比他还要强啦！
PROPQUEST_DUNGEONANDPK_INC_000565,"Alright, here is the ID card. Just make sure you come out of there alive. I do not need a guilty conscience.",好吧！通行卡给你...不要死着回来喔～祝你好运喔。
PROPQUEST_DUNGEONANDPK_INC_000566,I guess we all get tired sometime?,咯～累的话休息吧！人生有什么意义呢？
PROPQUEST_DUNGEONANDPK_INC_000567,Defeat 30 Captain Watangka and the Lord Watangka.,Defeat 30 Captain Watangka and the Lord Watangka.
PROPQUEST_DUNGEONANDPK_INC_000572,Door of Dark,黑暗之门
PROPQUEST_DUNGEONANDPK_INC_000573,"Excuse me. If you are not busy, would you please listen to my story? Have you ever heard of the Iblis Temple?",请问一下，你有听说过[幻魔依普利神殿]吗？
PROPQUEST_DUNGEONANDPK_INC_000574,"The Iblis Temple was built by the followers of Iblis, a leader from before the first age of Madrigal.",我也不是很清楚，据说幻魔依普利神殿是瑞加世界的历史开始前，就由幻魔依普利所创造出来的… 
PROPQUEST_DUNGEONANDPK_INC_000575,"The temple is located in the Fantasy Desert, in the southern part of Saint Morning.",也有人说是人工所建造的地牢，地牢位于晨光南部梦幻沙漠！
PROPQUEST_DUNGEONANDPK_INC_000576,You see... every mayor has to explore all the Islands of Madrigal. In the course of these travels we have to visit the Iblis Temple but... I am so afraid.,各方的旅人都会经过这地方，但这地牢让人感觉得相当危险…
