Key,English,Simplified_Chinese
PROPQUEST_DUNGEONANDPK_INC_000577,Would you please help me? I beg of you.,所以勒，我希望你能帮帮忙！
PROPQUEST_DUNGEONANDPK_INC_000578,"Thank you! Please, investigate the entrance of the temple for anything dangerous. Would you?",太感谢你了！帮我打探一下地牢入口附近，看看有没有什么不寻常的状况。
PROPQUEST_DUNGEONANDPK_INC_000579,"I cannot force you to help me if you are busy. But maybe, when you have the time, you could come back and help me.",你有急事的话那就算了，不过，我还是希望你能帮这个忙。
PROPQUEST_DUNGEONANDPK_INC_000580,"Thank you, you did a great job.",辛苦你了！看起来应该是我多心了……
PROPQUEST_DUNGEONANDPK_INC_000581,It is very easy to find the entrance of the temple in Fantasy Desert.,地牢位于梦幻沙漠，应该很容易找到的！
PROPQUEST_DUNGEONANDPK_INC_000582,Investigate the temple entrace.,帮我打探一下地牢入口附近，看看有没有什么不寻常的状况。
PROPQUEST_DUNGEONANDPK_INC_000584,Temple of the Clown,小丑秘殿
PROPQUEST_DUNGEONANDPK_INC_000585,Oh... Back so soon? I am glad you are back but I am still so worried.,我看起来脸色很差？因为整个事情并没有真正了结……
PROPQUEST_DUNGEONANDPK_INC_000586,I guess I am still worrying about the Iblis Temple. I know you said that there is nothing to worry about but I still have a bad feeling about that place.,没错！就是幻魔依普利，听说又出些状况！！
PROPQUEST_DUNGEONANDPK_INC_000587,Would you please help me once more? I will not be able to rest until I know for sure…,各种谣言在市民间流传着，你一定要再帮帮我才行！
PROPQUEST_DUNGEONANDPK_INC_000588,"I heard that there is a copy of the Iblis Revelation in the temple. Please bring me a rubbed copy of it, I need to see what it says.",地牢里应该留有幻魔依普利的遗物，听说他有留下一本幻魔依普利启示录的拓本，能找找看吗？
PROPQUEST_DUNGEONANDPK_INC_000589,...but I... I... need your help…,(快要哭出来的样子)我……我………
PROPQUEST_DUNGEONANDPK_INC_000590,This… this is more shocking than I could have imagined. Bubble please protect us.,(在得知伊普里司启示录拓本的内容后)想不到竟然会发生这样的事情… 该怎么办啊？！事情比想像的要严重许多！
PROPQUEST_DUNGEONANDPK_INC_000591,There is a copy of the Iblis Revelation in the Iblis Temple. Bring a rubbed copy of it.,地牢里应该留有幻魔依普利的遗物，听说他有留下一本幻魔依普利启示录的拓本，请找回来给我！
PROPQUEST_DUNGEONANDPK_INC_000593,The Revival,复活
PROPQUEST_DUNGEONANDPK_INC_000594,What should we do?! What should we do?!,(语无伦次地说)真糟糕！该怎么办啊？
PROPQUEST_DUNGEONANDPK_INC_000595,I read the revelation and it speaks of the revival of Iblis as the trigger to the end of the world!,幻魔依普利启示录拓本的内容，竟然预言世界末日的到来，如果让幻魔依普利复活，那这世界就没希望了！
PROPQUEST_DUNGEONANDPK_INC_000596,"If this is true, we have to stop it! This could be worse than the Hero Wars of long ago.",一定要竭力所能阻止他复活才行！
PROPQUEST_DUNGEONANDPK_INC_000597,You told me that you saw new types of masquerpets while you were getting the revelation right? I think that maybe…,在地穴的出现的怪物就是他复活的前兆！请帮我搜集这些怪物的情报吧！
PROPQUEST_DUNGEONANDPK_INC_000598,...they are the scouts of the army of Iblis. It looks like we may have to work together for a little while longer. Are you willing to help?,只要你能完成，想要什么报酬都不是问题！
PROPQUEST_DUNGEONANDPK_INC_000599,Excellent. Go in to the temple and gather any information you can about the strange masquerpets.,请帮我搜集地穴怪物的情报，好好注意自身安全！
PROPQUEST_DUNGEONANDPK_INC_000600,What?! Are you really going to stand by and let the world end?,你一点都不觉得紧张吗？！世界末日就要到了…
PROPQUEST_DUNGEONANDPK_INC_000601,"Hmm... Iblis Crasher... So, that is one of the masquerpets? Alright, give me some time to study this information. Thank you.",就是这个……秘殿破坏者！！真是辛苦你了！
PROPQUEST_DUNGEONANDPK_INC_000602,Any information about any Masquerpets is good.,请帮我搜集地穴怪物的情报，一切小心！
PROPQUEST_DUNGEONANDPK_INC_000603,Go into the temple and gather any information you can.,请帮我搜集地穴怪物的情报，好好注意自身安全！
PROPQUEST_DUNGEONANDPK_INC_000605,Into the Dark,深入黑暗
PROPQUEST_DUNGEONANDPK_INC_000606,Hi. I have studied the information you brought me and I have found that there is an altar in the Iblis Temple. There is also evidence that there are masquerpets guarding the altar.,以你找到的相关消息来看，这幻魔依普利神殿里真的有祭团的存在……
PROPQUEST_DUNGEONANDPK_INC_000607,Do you see? They do not want anyone to interupt the revival of Iblis. We need to do something. We need to stop them!,祭团的存在，也与拓本里的内文相符，这绝不是巧合！
PROPQUEST_DUNGEONANDPK_INC_000608,Are you ready for one last journey into the dark?,可得要消灭祭团才行，这只能靠你帮忙了！
PROPQUEST_DUNGEONANDPK_INC_000609,"I knew you would be. There is a masquerpet name Iblis Guardian. If you can defeat it, you can enter the altar.",我就知道你会的。有一个怪物叫做秘殿警戒者，如果你可以打败它，你就能进入祭坛。
PROPQUEST_DUNGEONANDPK_INC_000610,Are you serious? What could be more important than saving the world?,事况紧急……该怎么办才好！？
PROPQUEST_DUNGEONANDPK_INC_000611,"Great job, now you can enter the altar. I am counting on you to defeat the followers of Iblis... we all are. Go to the altar now.",辛苦你了！这地牢有太多诡异的地方，可要多留意才行！
PROPQUEST_DUNGEONANDPK_INC_000612,I do not know exactly where Iblis Guardian is. But we have to find it and destroy it.,我不确定秘殿警戒者具体在哪，但是我们必须得找到并杀死它。
PROPQUEST_DUNGEONANDPK_INC_000613,Defeat Iblis Guardian and enter the altar.,击败秘殿警戒者，进入祭坛。
PROPQUEST_DUNGEONANDPK_INC_000615,If you can defeat the Iblis Guardian you can enter the altar.,如果你能击败秘殿警戒者，就可以进入祭坛。
PROPQUEST_DUNGEONANDPK_INC_000625,Dekane Mine,达肯矿洞
PROPQUEST_DUNGEONANDPK_INC_000626,Iblis Temple,幻魔依普利神殿
PROPQUEST_DUNGEONANDPK_INC_000640,Bloody corridor,血腥走廊
PROPQUEST_DUNGEONANDPK_INC_000641,Well... Not a bad deal... Can you collect 20 Blood Trillipy Shells and defeat a Mutant Keakoon Worker?,嗯...不错的交易...你能在噬血蜥蜴上收集 20 个战利品吗？然后再击杀1个奇昆模范劳工。
PROPQUEST_DUNGEONANDPK_INC_000642,"In that case...Hic, good luck.",在那种情况下......嗯，祝你好运吧
PROPQUEST_DUNGEONANDPK_INC_000643,Hmm... the Hazardous Blood Trillipys are much stronger...,额... 血腥蜥蜴更强大...
PROPQUEST_DUNGEONANDPK_INC_000644,Thanks to you the extraction in this area will be much easier!,多亏了你才能让这件事办得这么容易！
PROPQUEST_DUNGEONANDPK_INC_000645,Hmm... Despite your level the Hazardous Blood Trillipys are much stronger...,额... 相对你目前的等级来说，血腥蜥蜴更强大...
PROPQUEST_DUNGEONANDPK_INC_000646,Collect $QUEST_END_ITEM_COUNT$ loot from the Bloody Trilipy and kill $QUEST_END_KILL_COUNT$ $QUEST_END_KILL_NAME$.,从血腥蜥蜴上收集$QUEST_END_ITEM_COUNT$以及猎杀$QUEST_END_KILL_COUNT$ $QUEST_END_KILL_NAME$
PROPQUEST_DUNGEONANDPK_INC_000648,The bottom of the mine,矿洞的最深处
PROPQUEST_DUNGEONANDPK_INC_000649,"Hello, if you're here it's because you've defeated all the known monsters in the mine. I'm Dekane, the creator of this mine. Now that you've proven yourself, I'll be able to tell you the real problem that lies at the bottom of the mine. In a secret room sleep dragons from ancient times created by Shade ages ago.",你好，你能出现在这里，说明你已经击败了矿洞中所有的怪物。我是德卡内，这个矿洞的开拓者。既然你已经证明了自己，我就可以告诉你矿洞深处的真相了——神秘房间里沉睡着远古时代由谢莉德创造的龙。
PROPQUEST_DUNGEONANDPK_INC_000650,Good luck!,祝你好运！
PROPQUEST_DUNGEONANDPK_INC_000651,It is true that this is not an easy thing for an adventurer. Come and try your luck again when you are ready.,诚然，这对于冒险者来说并非易事。 准备好后再来试试吧。
PROPQUEST_DUNGEONANDPK_INC_000652,So you really did kill them all... Thank you very much.,所以你真的把他们都杀了……非常感谢
PROPQUEST_DUNGEONANDPK_INC_000654,Collect 30 Blood Trillipy Shells from the Bloody Trillipy and kill 3 Mutant Keakoon Workers.,从血腥蜥蜴上收集30个战利品以及猎杀3个奇昆模范劳工。
PROPQUEST_DUNGEONANDPK_INC_000656,"To defeat them, you'll need a well-armed team. Ah, but there's one detail I forgot to mention. You'll need 1,000,000 Penya to open the door, but for now, collecting 30 Blood Trillipy Shells and defeating 3 Mutant Keakoon Workers will be enough. Are you ready to accept this challenge?","要打败他们，你需要一支装备精良的队伍。哈，还有个细节：你需要 1,000,000 金币才能打开它的大门，但现在，30个血腥蜥蜴的战利品和3个奇昆模范劳工就足够了。你准备好接受这个挑战了吗？"
PROPQUEST_EILLUNQUESTS_INC_000001,Preparation,Preparation
PROPQUEST_EILLUNQUESTS_INC_000002,Prepare yourself... The first boss approaches!,Prepare yourself... The first boss approaches!
PROPQUEST_EILLUNQUESTS_INC_000003,Recover your strength. Next wave incoming!,Recover your strength. Next wave incoming!
PROPQUEST_EILLUNQUESTS_INC_000004,Steel yourself for the second boss battle!,Steel yourself for the second boss battle!
PROPQUEST_EILLUNQUESTS_INC_000005,Brace for impact. The third wave is coming!,Brace for impact. The third wave is coming!
PROPQUEST_EILLUNQUESTS_INC_000006,The third boss emerges. Stay vigilant!,The third boss emerges. Stay vigilant!
PROPQUEST_EILLUNQUESTS_INC_000007,Prepare for the fourth assault!,Prepare for the fourth assault!
PROPQUEST_EILLUNQUESTS_INC_000008,Another boss challenges you. Show your strength!,Another boss challenges you. Show your strength!
PROPQUEST_EILLUNQUESTS_INC_000009,One final wave awaits. Stand ready!,One final wave awaits. Stand ready!
PROPQUEST_EILLUNQUESTS_INC_000010,The ultimate challenge awaits. Fight with all your might!,The ultimate challenge awaits. Fight with all your might!
PROPQUEST_EILLUNQUESTS_INC_000011,"Complete Dungeon ""Rescue [Eillun Farmer] Sprout""","Complete Dungeon ""Rescue [Eillun Farmer] Sprout"""
PROPQUEST_EILLUNQUESTS_INC_000012,"Complete Dungeon ""Rescue [Eillun Farmer] Thorn""","Complete Dungeon ""Rescue [Eillun Farmer] Thorn"""
PROPQUEST_EILLUNQUESTS_INC_000013,"Complete Dungeon ""Defend [Eillun Farmer] Dr. Root""","Complete Dungeon ""Defend [Eillun Farmer] Dr. Root"""
PROPQUEST_EILLUNQUESTS_INC_000014,"Complete Dungeon ""Rescue [Eillun Farmer] Dr. Root""","Complete Dungeon ""Rescue [Eillun Farmer] Dr. Root"""
