Key,English,French
NPC_000620,"My name is Luda and I run the Vagrant Store of Flarine. I opened this shop after Boboku and Boboko stopped selling Vagrant items. Now I corner the market, hahaha!",Mon nom est Luda. Il n'y a pas meilleur personne que moi pour équiper les Vagabonds.
NPC_000621,Be careful out there. I wouldn't want to lose a potential customer! *Chuckles*,Bonne continuation en Madrigal !
NPC_000622,"Come one, come all! Get your supplies here! You're gonna need it!","#bBoissons, fioles, mantras, conjurations, flèches…#nb C'est ici que ça se passe ! Venez tous ! Faites vos provisions ici ! Vous en aurez besoin !"
NPC_000623,"Listen carefully, here's what I need you to do.","Écoutez attentivement, voici ce que j'ai besoin que vous fassiez."
NPC_000624,"Going somewhere? You look a little unprepared, so I'd think twice about leaving Flarine without stocking up on supplies. Good thing for you, I'm here. So, whaddya need?",Je n'arrive pas à croire que mon petit frère Roony ait un lien avec cet incident… Il est parti en grommelant qu'il ne reviendrait plus jamais.
NPC_000625,"Who am I? I'm Lui Keraldine, of course. My friends call me Handsome Lui. Since we're not friends, why don't you just call me Lui. If you buy something from my General Store here, I *might* let you call me Handsome.","Je m'appelle Lui Keraldine, mais les habitants de Flarine me surnomment Lui le Magnifique. (rires)"
NPC_000626,Don't forget to shop at Handsome Lui's General Shop for your adventuring needs!,"Reviens me voir, je te ferai peut être une ristourne ! Ha ha."
NPC_000627,"So many Vagrants, so little time!",Que Rhisis protège les aventuriers souhaitant devenir #bAcolyte#nb.
NPC_000628,"Assists are masters of healing wounds in combat, enhancing abilities, and can be fierce opponents in close quarters combat. Never underestimate an Assist. ",Tu dois continuer à t'entraîner pour expier tes crimes !
NPC_000629,My name is Maki Ah and I am the Assist Master of Flarine. I'm here to guide young Vagrants on the path to becoming an Assist.,"Je m'appelle Maki Ak, je suis le Maître des Acolytes."
NPC_000630,May Bubble watch over you.,Que la bénédiction de Rhisis t'accompagne.
NPC_000631,"Are you as intrigued by magic as I am? Well, look no further! I have wands, staves, blinkwings and Magician Armor in stock now!",Vous recherchez un univers de magie et de féerie ? Entrez dans ma boutique pour réaliser votre rêve !
NPC_000632,Please solve this mystery as soon as possible.,"S'il te plaît, résout cela aussi vite que possible."
NPC_000633,"My mentor, Mule, got himself into some trouble. I highly doubt I'll ever see him again. I've taken it upon myself to continue running his magic shop. It's the least I could do. ","Mon maître Mule a connu des ennuis. On a dit qu'il était lié à un terrible incident, et il a dû prendre la fuite. J'espère le revoir un jour…"
NPC_000634,"My name is Marche Hordin and I run the Magic Shop here in Flarine. Teehee, I also have a crush on this hunk named Bradley! Oh um, excuse me, would you like to buy something? Please let me know if I can be of assistance.",Je m'appelle Marche Hordin. Ma boutique contient tous les objets magiques dont on peut rêver.
NPC_000635,Thank you for visiting my magic shop! Be careful out there!,Merci de m'avoir rendu visite. A la prochaine !
NPC_000636,The history of Madrigal... strange to say the least. I must discover the secrets!,"#bL’histoire de Madrigal…#nb étrange, c’est le moins qu’on puisse dire. Je dois en découvrir les secrets !"
NPC_000637,"Do you know anything about the history of Madrigal? No? Well I've been uncovering some fascinating information as of late. It seems that much of our history has been conveniently covered up. Interesting, huh?",Bonjour ! Connais-tu l'histoire de Madrigal ? Non ? Hmm… Je ne connais pas tous les détails mon non plus…
NPC_000638,"Nice to meet you. My name is Martinyc Tictraibet. I know, it's a difficult name to pronounce, isn't it? Anyway, I'm a historian and I've made it my life's work to discover the secrets of Madrigal and document it's history.","Je suis historienne à Flarine, mon nom est Martinyc Tictraibet."
NPC_000639,"If you learn of any interesting facts about Madrigal's history, be sure to stop by again!",Les hommes font leur histoire même s'ils ne savent pas l'histoire qu'il font…
NPC_000640,Welcome to the #b#cffff0000Flarine Quest Office#nc#nb! Looking for work? I may have a job for you...,Bienvenue au #b#cffff0000Bureau des Quêtes de Flarine#nc#nb ! Vous cherchez du travail ? Il se pourrait que j’aie une mission pour vous…
NPC_000641,"My name is Mikyel and I am the manager of the Flarine Quest Office. When our citizens post a hunting order or another task, it is my job to find the right candidate for the job. Check back in from time to time to see if I have anything available!","Je m'appelle Mikyel et je suis le responsable du Bureau des Quêtes de Flarine. Lorsque nos citoyens publient un ordre de chasse ou une autre mission, c’est mon travail de trouver le candidat idéal. Revenez de temps en temps pour voir si j’ai quelque chose à vous proposer !"
NPC_000642,*Hic!* All those other jobs are useless. USELESS! You hear me? A Mercenary can cut through anything!,"Etre un Mercenaire n'est pas donné à tout le monde… mais selon moi ce sont les meilleurs aventuriers de Madrigal, ça ne fait aucun doute !"
NPC_000643,"Ah, fresh meat! Who the heck are you and why are you talking to me? Only aspiring Mercenaries can have the privilege of speaking with the Great Mustang!",Personne ne peut devenir Mercenaire sans avoir fait la connaissance du grand Mustang ! Ha ha ha.
NPC_000644,"I am Captain Mustang Loid of the Madrigal Job Training Center. You would be lucky to be trained by someone as handsome and talented as myself. Now, shoo!","Je m'appelle Mustang Loid, et je suis en charge d'enseigner le meilleur métier du monde... Mercenaire ! Tu devrais être fier de suivre mon entraînement ! (rires)"
NPC_000645,"Oh good, you're leaving. ",A bientôt l'aventurier ! Ha ha.
NPC_000646,"Cheer up child, there will be brighter days ahead of you!","De l'entrain mes enfants, de l'entrain !"
NPC_000647,"I want to move to Flarine with my husband, but we have not received our citizenship yet. I heard that will happen soon.","Nous voulons habiter à Flarine avec mon mari, mais nous attendons toujours notre citoyenneté…"
NPC_000648,"I am Nina Horis, Paul is my husband.","Je m'appelle Nina Horis, je suis l'épouse de Paul."
NPC_000649,Good luck to you wherever you go. Thank you.,Bonne chance dans tes aventures.
NPC_000650,Looks like the weather today is going to be mostly sunny with a small chance of showers!,Le temps aujourd'hui est… hmm…
NPC_000651,"So what can you do for me, huh?",Que peux-tu faire pour moi ?
NPC_000652,"Now that we've built this observatory, we can forecast the weather! I spent a long time building it, but it was certainly worth it. Are you interested in Astrology, young one?","Depuis que l'observatoire est construit, il est désormais possible de faire des prévisions météorologiques. J'ai vraiment bien fait de bâtir cet observatoire ! Ha ha ha."
NPC_000653,"That's a question I don't get asked often. Although, that may be because I don't get many visitors. My name is Noie Hedltern. I built this observatory and I manage it's day-to-day maintenance.",Je m'appelle Noier Hedltern. J'ai construit cet observatoire et j'en suis maintenant le directeur.
NPC_000654,Safe travels! Stop by if you need to check on the weather!,On n'a pas besoin de lumière quand on est conduit par le ciel ! Ha ha ha.
NPC_000655,Welcome to Flarine!,Bienvenue à Flarine
NPC_000656,"The Library is located to my right and the reception desk is to my left. You can speak with Julia for to access your bank, view ranking information, or browse your Guild Warehouse.","L'office public est là pour informer les habitants de Madrigal, et gérer tous les aspects administratifs de la ville."
NPC_000657,"We Public Officials work directly with the mayor to better Flarine. We are here to serve you. If you have any questions, just ask!",Je suis un intendant et j'aide également le maire de Flarine dans ses tâches quotidiennes.
NPC_000658,Thank you for visiting the Public Office. #b#cffff0000For Flarine!#nc#nb,Merci de votre visite au Bureau Public. #b#cffff0000Pour Flarine !#nc#nb
NPC_000659,I shall cut down our enemy with one swift thrust!,Je me sens chez moi dès que je peux me relaxer un peu…
NPC_000660,"What do you want?! Can't you see I'm busy? We've got a lot of training to do! Begone, pest!",Je suis imbattable pour peler les pommes. Tellement rapide que tu ne vois même pas mes mains bouger ! Ha ha ha.
NPC_000661,"They call me Phoho Andere and I am one of the hired Soldiers of Kion. No one, I repeat, NO ONE is better with a blade than I am! Care to test that theory with a little wager? Hmm?","Je m'appelle Phoho Andere. Je suis l'un des soldats de Kyon, et le meilleur combattant à l'épée !"
NPC_000662,For Kion!,Béni soit Kyon !
NPC_000663,"Mammy, it is cold!","Maman, il fait froid…"
NPC_000664,"We are moving here to be with my father, but I do not like it here.",Nous allons habiter ici pour vivre avec mon père. Mais je n'aime pas trop cet endroit…
NPC_000665,"My name is Pipi Horis, Paul is my father.","Je m'appelle Pipo, je suis le fils de Paul Horis."
NPC_000666,"We must find new Heroes, Kimel. It's our only hope.",Hmm... il semble que de plus en plus d'aventuriers aspirent à devenir des Héros ! Hé hé.
NPC_000667,Ancients texts speak of 8 meteors that will fall from the sky the day the world comes to an end. These ancient texts say nothing of what will become of us after this event. Will we be saved? Destroyed? ,"On dit que huit étoiles tomberont du ciel, juste avant que le monde arrive à sa fin... Mais cela sera t-il suffisant pour sauver le monde à ce moment ?!"
NPC_000668,"The Great Wise Man, Radion, has decreed that we preserve the memory of the Heroes, and work towards defending ourselves against Shade once more. I am Sage Radyon, Radion's humble servant.","Le Grand Sage, Radion, a décrété que nous perpétuions le souvenir des Héros et que nous œuvrions à nouveau pour nous défendre contre Shade. Je suis le Sage Radyon, humble serviteur de Radion."
NPC_000669,"Goodbye, brave one.","Tout comme l'écoulement de la rivière, l'histoire des Héros se poursuivra pour l'éternité…"
NPC_000670,I love my money. Can anyone else out there bathe themselves in Penya? Ha! I didn't think so!,Ha ha ha. J'adore mon argent. Y a-t-il quelqu'un d'autre qui se baigne dans des Penyas ? Ha ! Je ne crois pas ! Ha ha ha.
NPC_000671,"Psha! I have no desire to talk to the poor. Leave my property now before I call the authorities! What, are you deaf? I said LEAVE! I have esteemed guests LibraX and Condulus coming over! ","Pff ! Je n'ai aucune envie de parler aux pauvres. Quittez ma propriété immédiatement avant que j'appelle les autorités ! Quoi, vous êtes sourd ? J'ai dit PARTEZ ! J'ai des invités de marque, LibraX et Condulus, qui arrivent !"
NPC_000672,"I told you to leave. *Sigh* Very well, if it'll get you to leave me alone I'll tell you. My name is Rudvilhil Tailerz and my passion is collecting. Collecting rare artifacts is my obsession! Well, aside from money, of course. ",Ha ha ha. Je suis le millionnaire Rudvihil Tailer. Je suis tellement riche que je collectionne les objets les plus rares de Madrigal. Ha ha ha.
NPC_000673,What? Who doesn't like money?,Réfléchis… ensuite l'argent viendra à toi ! Ha ha ha.
NPC_000674,Soldiers! Raise the blue flag of JeongHwa! We exist for the people! We fight for the people!,Soldats ! Hissez le drapeau de Junghwa ! Battons nous pour l'honneur des peuples !
NPC_000675,"The dark will be weakened wherever they step, and then new light shall shine!","Le mal sera toujours repoussé, et la lumière éclairera le monde à nouveau."
NPC_000676,My name is Ryupang Silog I am Managing the House of Offerep and I lead the Blue Flag of JeongHwa soldiers,"Je m'appelle Ryupang Silog. En plus d'être un serviteur d'Offerep, je guide le drapeau bleu des soldats de Junghwa."
NPC_000677,Faith and trust will always lead us.,La foi et le courage seront nos seuls guides !
NPC_000678,How about conquering that mountain peak today? Hahaha I am just kidding!,"Pourquoi ne pas atteindre le sommet de cette montagne aujourd'hui ? Hé hé, je suis sûr que ça serait drôle."
NPC_000679,The sky will turn dark and there will be a big storm. Then 8 lights will illuminate the ground and whoever views this will be saved.,Le ciel s'assombrira et la foudre s'abattra. Puis huit étoiles apparaîtront et illumineront le monde…
NPC_000680,My name is Segho Pesin the Climber I manage the Drill Hall of Roentel My dream is to conquer every mountain in Madrigal!,"Mon nom est Regho Pesin. Je suis un alpiniste, mais également un serviteur de Roentel. Mon rêve serait de gravir toutes les montagnes de Madrigal."
NPC_000681,Each day has a new target! Hah!,"Puisque la montagne ne vient pas à nous, allons à la montagne !"
NPC_000682,"Something, a creature perhaps, is stirring within the Mars Mine. ",Par le dernier pont déferlera la mort
NPC_000683,"Here, young one. Please pick one that you would like to do.","Allez, choisis une mission que tu peux accomplir."
NPC_000684,"My 8 pupils and I are working feverishly to prepare Madrigal's citizens for the day that Shade returns to destroy us all. Only through the guidance and strength of the Heroes, can we hope to persevere.",Mes huit élèves et moi travaillons d'arrache-pied pour préparer les citoyens de Madrigal au jour où Shade reviendra nous anéantir. Seuls la force et le soutien des Héros nous permettront de survivre.
NPC_000685,"I am known as Radion Angamel the Great Wise Man. When you've lived as long as I have, you sort of inherit the title. Nevertheless, it is our duty to use our knowledge of the Heroes to protect ourselves from impending doom.","Je suis Radion Angamel. Certaines personnes considèrent que je suis un sage, mais je suis juste un vieil homme qui a vécu beaucoup de choses…"
NPC_000686,"Go with the Heroes, my child.",Toi... Hmm.. Non rien. A bientôt.
NPC_000687,"I love SUSHI! I could eat it all day, every day!",Le poisson est exquis et le riz délicat. Venez déguster nos succulents sushis !
NPC_000688,"Making Sushi is a fine art, you see. You don't just boil some rice, cut up some raw fish, and wrap it in seaweed, ya' know? You have to put your heart into it. You have to LOVE it!","Tu vois, il suffit de découper avec soin le filet de poisson, de préparer le riz, ajouter un peu de wasabi, et voilà… un succulent sushi ! Hu hu hu."
NPC_000689,"Hey there, you look a little hungry! My name is Sotta Segaku and I am the best sushi cook in al of Madrigal! Hang tight, I'll whip up some Naga Rolls just for you!","Je m'appelle Sotta Segakku, et je prépare les meilleurs Sushi de tout Madrigal. Enfin d'ici quelques années... hu hu."
NPC_000690,You'll ever find better sushi anywhere in Madrigal!,Reviens goûter mes sushis d'ici quelques temps.
NPC_000691,"Listen up, Soldiers of Kion! We've got a new directive from the Mayor of Flarine! It's time to train!","Soldats de Kyon, rassemblez-vous !"
NPC_000692,Are you looking for work? We can always use another hired hand here. You look like you have some skill. Show me what you got!,Il y a des yeux qui observent les huit Héros. Ils sont les yeux des créatures de ce monde.
NPC_000693,"My name is Teshar Testarotsa and I'm the leader of this rag-tag bunch. I manage the house of Hero, Aenn. Have you come to join our team?","Je suis le leader des soldats de Kyon, Teshar Testarotsa. Je suis également un serviteur de Aenn."
NPC_000694,"Farewell, champion! See you on the battlefield!",Mais… Arrête de faire l'idiot !!
NPC_000695,"All I need is my hammer, Tesh! I require no training.",Cette journée a été bien remplie...
NPC_000696,"This hammer was forged from the steel of a thousand Shuhammas! No one else is skilled or strong enough to wield it, except for me of course. You don't believe me? Try it! Hahaha!",Personne ne peut surmonter la puissance de mon marteau !
NPC_000697,"My name is Tomba Hammer and I am a soldier of Kion. This hammer goes everywhere with me. Everywhere. I live for battle, and a little extra Penya doesn't hurt either.",Mon nom est Tomba Hammer. Je suis le meilleur au maniement du marteau parmi tous les soldats de Kyon !
NPC_000698,Glory to Kion,Gloire à Kyon !
NPC_000699,"~*I've, been working on the dirt pile, all the live long day!*~",Parfois on observe des flèches tombants du ciel… c'est ce que l'on appelle une pluie de flèches.
NPC_000700,"It's rough out there, here, take this!",E voilà. Tu n'as pas d'autres choix que d'accepter. Hé hé !
NPC_000701,"We, the High-Dwarpets, are different from the common Dwarpets. Don't even compare us with them, you hear me? That's a sure fire way to have your molecules melted into slime.","Nous, les Grands Dwarpets, sommes différents des autres Dwarpets… Ne cherche pas à nous comparer."
NPC_000702,"Oh really? You want to know who I am? Well let me tell you, 'friend'. I have been kicked and hated by humans since I was born, so I don't particularly like your kind. Happy?","Moi ? Tu veux savoir qui je suis ? Ecoute, je suis le Dwarpet qui déteste les êtres humains, c'est compris ?"
NPC_000703,Good riddance!,Adieu.
NPC_000704,Want to play with me?,Qui veut jouer avec moi ?
NPC_000705,Pick something you can do. Something you can really do.,Choisis en une que tu peux faire. Hé hé !
NPC_000706,Want to play with me? Ok!,Tu veux jouer avec moi ? Ok !
NPC_000707,"I am the noble, elegant, and sophisticated Ancimys.","Je me nomme Ancimys. Comme tu peux le constater, je suis d'une élégance et d'une sophistication rare."
NPC_000708,My name is Ann Peltrot I am in charge of guiding Saint City and managing the Garden of Rhisis.,Je m'appelle Ann Peltrot. Je m'occupe notamment du Jardin de Rhisis.
NPC_000709,"This is Saint City, the holy morning city\n Is it not peaceful? I am really proud to live here\n As happy as I am to be here, there are still a lot of Masquerpets outside the walls.","Bienvenue à Saincity, la ville du matin sacré.\nCette ville est si calme, c'est vraiment un bonheur de tous les jours que de vivre ici.\nPar contre il faut éviter de mettre les pieds en dehors de la ville…"
NPC_000710,Feel free to wander around and gather as much information as you can. \n It is a good time to meet all of the merchants and prepare for your travels.,Il est important de rendre visite à tous les commerçants pour bien se préparer à l'aventure.
NPC_000711,Hi! I am Bill. Come get everything you need in my General Shop.,Le bazar de Bill contient toutes les merveilles que vous recherchez !
NPC_000712,What can you do for me?,Peux-tu me donner un coup de main s'il te plaît ?
NPC_000713,"Tina and I love each other very much. But we are seeing each other secretly because Karin and Bulrox, my mentor, do not get along. ","Tina et moi, nous nous aimons. Mais pour l'instant, nous sommes obligés de nous voir en cachette..."
NPC_000714,My name is Bill Bergenass and I run the General Shop in Saint City.,"Je m'appelle Bill Bergenass, mon bazar est indéniablement la meilleure boutique de Saincity ! Hé hé."
NPC_000715,Good bye! Please come again!,Au plaisir de te revoir !
NPC_000716,Do you want something special? This is a very special bowl.,Une bonne soupe chaude ?
NPC_000717,"What kind of bowl are you looking for? I made all the bowls here, so they are very special.",Que recherches-tu ? Toutes les soupes que je prépare sont très spéciales !
NPC_000718,Hahaha My name is <Bowler Clo> and I am running a small bowl shop.,"Hahaha. Je m'appelle Bowler Clo, j'ai monté cette petite boutique de soupe il y a quelques temps."
NPC_000719,Please visit whenever you need a special bowl.,Reviens me voir quand tu voudras une bonne soupe.
NPC_000720,Shields that have both strength and beauty can be found here in my Shield Shop!,Des armures alliant robustesse et magnificence sont en vente dans ma boutique !
NPC_000721,What can you do for me?,Peux-tu me donner un coup de main s'il te plaît ?
NPC_000722,"It seems like Bulrox does not like me. Is it bad to make shields beautiful? I think there is nothing wrong with beauty, am I right?",j'ai l'impression que Bulrox ne m'apprécie guère… Est-il mal vu de chercher à rendre les armures jolies en plus d'être efficaces ??
NPC_000723,My name is Bozman Hangteiler and I run the Shield Shop in Saint City.,"Je m'appelle Bozman Hangteiler, et je tiens cette petite armurerie."
NPC_000724,Thank you for visiting me. See you next time!,Ma boutique sera toujours ouverte pour toi !
NPC_000725,"I will let you watch the best play, performed by Pepoview",Venez voir les meilleures pièces interprétées par la fameuse troupe Pepole.
NPC_000726,I really like stories about heroes. So I am collecting books about them. Do you know the Book of Hero Combat? The book is really great!,"J'adore les histoires sur les Héros, je fais d'ailleurs la collection des romans relatant leurs péripéties. Tiens je te conseille le livre sur les Combat des Héros, c'est un ouvrage formidable."
NPC_000727,"Pepoview is the best known troupe in Madrigal! I am Brodeay, one of the leaders. Nice to meet you.","Pepole est la meilleure troupe de théâtre de Saint Morning, mais également de tout Madrigal ! Enchanté, je suis Brodeay."
NPC_000728,"Our troupe is always the best! If you come to one of our shows, I will let you watch for free.","Notre troupe n'a pas d'égal. Si tu viens, je te laisserai entrer gratuitement."
NPC_000729,Come and see what superior weapon crafting is like at Weapon Shop of Bulrox!,"Le forgeron Bulrox vous propose les meilleures armes de Saint Morning, n'hésitez pas !"
NPC_000730,What can you do for me?,Peux-tu me donner un coup de main s'il te plaît ?
NPC_000731,"Bill? It seems like he is seeing Tina secretly. Well, it does not matter to me because I like her. She is such a kind and polite girl! The real problem is that fat and obstinate woman! Darn!","J'aime vraiment beaucoup Tina, elle est si douce et gentille… mais j'ai l'impression que Bill voit Tina en secret. Erf. Enfin le vrai problème c'est cette bonne femme..."
NPC_000732,"My name is Bulrox SHynante and I run the Weapon Shop in Saint City. Bill is my best pupil. He is very, very smart Hahaha","Je suis Bulrox SHynante, le meilleur forgeron de Saincity. Je m'occupe aussi de l'arène ! Bill est mon meilleur élève, ha ha ha."
NPC_000733,Good bye. There is nothing you cannot defeat with my weapons!,Il n'existe rien que tu ne pourras vaincre avec mes armes !
NPC_000734,Shields for sale! Please form a single line.,Bouclier en vente ! Faites la queue.
NPC_000735,You are in the right place if you are looking for a good shield. We only sell the highest quality ones.,Tu es tombé au bon endroit si tu cherches de l'équipement ! Je ne vends que des produits de grande qualité.
NPC_000736,My name is Colack I opened this shop when Bozman started selling armor for Acrobats.,Je m'appelle Colack. En fait je n'ai ouvert cette boutique que récemment.
NPC_000737,Please visit me again!,Reviens me voir aussi souvent que tu le voudras.
NPC_000738,"Saint City, the most beautiful place in Madrigal! The ecology here is the blessing of God itself!!","Saincity, la ville la plus paisible de Madrigal. L'écosystème ici est un miracle de la nature !"
NPC_000739,Please solve these as soon as possible.,"S'il te plaît, accompli ces quêtes au plus vite."
NPC_000740,"There are various Masquerpets here in Saint City, so I always have lots to do Ha ha ha","Les environs de Saincity sont infestés de monstres, donc j'ai de l'occupation. Ha ha ha."
NPC_000741,My name is Dr. Estern I am studying the ecology of Madrigal with my 2 brothers.,"Je m'appelle Dr Estern. Comme mes deux autres frères, j'étudie l'écosystème de Madrigal."
NPC_000742,Please enjoy the beauty and mystery of nature.,"La nature est ancienne, mais elle nous surprend tous !"
NPC_000743,Ha ha ha The history of Madrigal is really mysterious. Do you agree? Ha ha ha,Ha ha ha ! L'histoire de Madrigal est vraiment mystérieuse. Vous êtes d'accord ? Ha ha ha !
NPC_000744,"History should not be hidden at all, whether it is unpleasant or not.","L'histoire ne devrait jamais être enfouie et oubliée, qu'elle soit plaisante à entendre ou non !"
NPC_000745,My name is Gothante Destratin and I am the chairman of the Madrigal Historical Society. You can just call me Gothante.,"Enchanté, je m'appelle Gothante Destratin, je suis le directeur de la Société de l'Histoire de Madrigal."
NPC_000746,"You have to know the history no matter what, right? Ha ha ha","La légende est, à mes yeux, plus vraie que l'histoire. Médite là-dessus, ha ha ha."
NPC_000747,"Everyone who wants to be a Magician, please come to me! My name is Hee and I will show you how to be the best Magician.","Vous qui souhaitez devenir Magicien, approchez ! Je suis Hee et je vous enseignerai comment devenir le meilleur #bMagicien#nb."
NPC_000748,"Being a Magician is the greatest job ever. Magicians are always smarter and more powerful. You agree with me, right?","Le Magicien est celui qui possède la plus grande puissance, le plus grand savoir et la plus grande spiritualité, n'es-tu pas d'accord avec moi ?"
NPC_000749,"I am Master Hee Lyu, and I am a Job Master. I am in charge of finding new Magicians, but this job is very boring.","Je suis Hee Lyu, le Maître des Magiciens. Je cherche à recruter de nouveaux disciples, mais les aventuriers talentueux se font rares…"
NPC_000750,The light of the Magicians will protect you for all time.,Garde à l'esprit que la véritable force commence par la sagesse !
