Key,English,French
NPC_000331,Here you are. Time to fulfill your duty.,Ceci est ton devoir.
NPC_000332,Everything is the Acrobat. The Acrobat is everything. Take a moment to ponder what I have said.,Le tout compose l'Acrobate. L'Acrobate est tout. Réfléchis à cela…
NPC_000333,"My name is Pyre and I am the Acrobat Master. Nice to meet you. Ha ha ha I am in charge of helping the vagrants, who want to, become an Acrobat.","Je suis Pyre, le Maître des Acrobates. J'aide ceux qui veulent devenir de grands Acrobates."
NPC_000334,Good bye. Never forget the way of the Acrobat. Ha ha ha,Au revoir.
NPC_000335,"No one can stop you from jumping into it, even though you know that it is extremely hot.","Personne ne peut t'empêcher de sauter dedans… attention quand même, c'est extrêmement chaud."
NPC_000336,Cell,Cell
NPC_000337,What? What do you want?,Quoi ? Que veux-tu ?
NPC_000338,I know you were here before. I believe you have the ability to overcome the dangers.,Je te connais… tu es déjà venu ici. Je pense que tu as les capacités pour te jouer des dangers.
NPC_000339,Speaking to me is already dangerous as it is. What do you want?,Sais-tu qu'il est dangereux de me parler ?! Que veux-tu ?
NPC_000340,Everything is the same. Or is there something special about you? Ha ha Everything is the same.,"Qu'est-ce qui pourrait bien te rendre spécial ? Ha ha, vous êtes tous pareils."
NPC_000341,"You MUST be crazy if you want to know about the mine behind me! If you really wish to enter the mine, talk to Cell. He is somewhere in Darkon.",Tu dois être fou si tu cherches à entrer dans la mine derrière moi ! Mais si tu es sûr de toi... va parler à Cell. Tu devrais le trouver à l'Usine des Erons de Darkon 1.
NPC_000342,..,.....
NPC_000343,Oh Cell! He is really a bother. I have written this message for him. Please deliver it to him.,Oh Cell ! Il est comme un frère. Va lui remettre ce message que je lui ai écrit.
NPC_000344,"Do you want to get the best weapon in Madrigal? Then come here, you will not regret it.","Cherchez-vous les meilleures armes de Madrigal ? Alors venez ici, vous ne serez pas déçus !"
NPC_000345,"Come on, choose one. Which one do you want?","Allez, quelle arme désires-tu ?"
NPC_000346,"Even though I am very young, many people say that I am the best weapon manufacturer in all of Madrigal.","Même si je suis encore jeune, je reste le meilleur forgeron de tout Madrigal !"
NPC_000347,"My name is Remine Crowd, and I run the Weapon Shop here in Darken.","Je m'appelle Remine Crowd, et je tiens le magasin d'armes de Darken."
NPC_000348,Please visit me again!,Reviens me voir aussi souvent que tu le voudras.
NPC_000349,"Roentel, the seed you sowed in this world will be harvested soundly.","Roentel, les graines que tu as plantées dans ce monde germeront bientôt."
NPC_000350,Everything began with them and everything will end with them.,Ils sont le commencement et la fin de tout…
NPC_000351,"My name is Ride Ropeaedilo, and I am the Billposter Master.","Je suis le Maître des Moines, Ride Ropeaedilo."
NPC_000352,I hope the courage of Roentel will be delivered to you.,Je te souhaite que le courage de Roentel t'accompagne.
NPC_000353,"You, who wants to follow the Ringmaster hero Aenn. Do you believe in the will of the hero?","Toi qui cherche à succéder au grand Prêtre Aenn, Héros de Madrigal... es-tu prêt à suivre la Voie des Héros ?"
NPC_000354,The world will be divided into two factions. Those who follow the heroes and those that follow those who the heroes face.,Le monde est divisé en deux: ceux qui suivent la Voie des Héros et les autres.
NPC_000355,"My name is Romvoette Guardian I am protecting the will of Aenn, the Ringmaster hero.","Mon nom est Romvoette, et je suis le Gardien de la Pierre d'âme du Prêtre Aenn. J'enseigne le courage du Héros à ses successeurs."
NPC_000356,The teardrops of Aenn will protect you.,La Larme de Aenn te protégera…
NPC_000357,The best armors are here. I am Rocky the Armor artist.,"Par ici les futurs héros, j'ai ce qu'il vous faut !"
NPC_000358,Hey! Can you do anything about this?,"Hey, qu'en penses-tu ?"
NPC_000359,You have a good eye for great shields. And these are the best.,"Tu as un oeil d'expert pour évaluer les boucliers. Comme tu le vois, les miens sont de la meilleure qualité qu'il soit."
NPC_000360,My name is Rocky Forward. I am the Armor Artist that runs this Armor shop! Ha ha ha!,"Bienvenue dans le magasin de bouclier de Roocky, le meilleur artisan des environs !"
NPC_000361,Hope to see you soon alive! Ha ha ha!,"Au plaisir de te revoir… vivant, hahaha"
NPC_000362,"Oh Hynan, I will follow your great will.",Ô Hynan… je suivrai ta volonté.
NPC_000363,"When night falls and daylight disappears, the heroes will rise.","Quand la nuit viendra, les Héros apparaîtront. Et les gens les admireront..."
NPC_000364,I am honoring the Ranger hero Hynan as one of the 8 Priests of Altar. I am in charge of passing on the will of the Ranger to you.,J'honore le Héros des Rangers. Je suis en charge de transmettre la dextérité de Hynan à ses successeurs.
NPC_000365,May the blessing of Hynan be with you always.,Que l'esprit de Hynan soit toujours avec toi !
NPC_000366,"You, who want to follow the Blade hero Heren, are you ready to follow the hero?","Toi qui cherche à succéder au grand Assassin Heren, Héros de Madrigal... es-tu prêt à suivre la Voie des Héros ?"
NPC_000367,The Clowns will have their amusement. And their amusement will destroy the world.,Souviens-toi que le divertissement et la distraction engendreront la destruction du monde...
NPC_000368,"My name is Sencyrit Guardian. I am protecting the will of Heren, who is the Blade hero.","Mon nom est Sencyrit, et je suis le Gardien de la Pierre d'âme de l'Assassin Heren. J'inculque l'énergie du Héros à ses successeurs."
NPC_000369,Heren will bless you forever.,Heren te protégera toujours.
NPC_000370,"You, who want to follow the Psykeeper hero Offerep, do you honor the will of hero?","Toi qui cherche à succéder au grand Sorcier Offerep, Héros de Madrigal... es-tu prêt à suivre la Voie des Héros ?"
NPC_000371,Everything will end like it began.,Tout commencera ainsi… Et tout finira ainsi…
NPC_000372,"My name is Shyniff Guardian. I am protecting the will of Offerep, the Psykeeper hero.","Mon nom est Shyniff, et je suis le Gardien de la Pierre d'âme du Héros Offerep. J'enseigne la puissance du Héros à ses successeurs."
NPC_000373,The spirit of Offerep will strengthen your soul.,L'esprit d'Offerep renforcera ton âme faible.
NPC_000374,Everything you want is here in the Weapon Shop of Stima!,"Les plus belles armes sont ici, dans la boutique de Stima !"
NPC_000375,What would you do for me?,Que puis-je faire pour toi ?
NPC_000376,"Being a travelling salesman was too hard so I settled here. My shop is still small, but I have a good feeling about this place.","J'en avais assez de parcourir Madrigal, alors je me suis installé ici. Ma boutique est encore petite, mais je suis sûr que je m'agrandirai d'ici quelques temps."
NPC_000377,My name is Stima Ogonel. I travel from place to place selling weapons. Nice to meet you.,"Je m'appelle Stima Ogonel. Je viens d'ouvrir ce magasin d'arme ici, à l'Usine des Erons."
NPC_000378,It was very nice to meet you. I hope I can see you again.,Ce fut un plaisir de faire ta connaissance. J'espère bientôt te revoir !
NPC_000379,Are you ready?,Es-tu prêt ?
NPC_000380,It is your duty!,Ceci est ton devoir.
NPC_000381,I am a proud training instructor of Madrigal!,Je suis fier d'être l'un des instructeurs de Madrigal.
NPC_000382,I am here to show vagrants the way.,Mon rôle est de montrer la voie au Vagabonds.
NPC_000383,Attention! Salute!,Bon vol !
NPC_000389,"You, who want to become the successor of the Elementor hero Lillip, do you believe in the will of the hero?","Toi qui cherche à succéder au grand Elémentaliste Lillip, Héros de Madrigal... es-tu prêt à suivre la Voie des Héros ?"
NPC_000390,You will be one of the 8 that watch the stars for a sign of their arrival.,"Vous verrez huit étoiles disparaître, et l'une d'entre elles sera la larme rouge qui irriguera le sol..."
NPC_000391,"My name is Wendien Guardian. I am protecting the will of Lillip, the Elementor hero.","Mon nom est Sencyrit, et je suis le Gardien de la Pierre d'âme du Prêtre Lillip. J'inculque la sagesse du Héros à ses successeurs."
NPC_000392,You will be enlightened with the wisdom of Lillip.,Vous aspirez à devenir un vaillant #bMercenaire#nb ? Félicitations ! Une grande aventure vous attend !
NPC_000393,You will be enlightened with the wisdom of Lillip.,Vous aspirez à devenir un vaillant #bMercenaire#nb ? Félicitations ! Une grande aventure vous attend !
NPC_000394,"A piece of advice? A Mercenary's weapon is their livelihood. You must dedicate your life to the blade, and in turn, it will protect you. ","Si tu as besoin de quelque chose, n'oublie pas qu'il faut d'abord le payer."
NPC_000395,"Hello, I'm Andy Kimu, the Mercenary Master of Flarine. The pay is good, but they make me wear this ridiculous looking robe. It's so itchy! I stroke my beard all day just to keep my mind off of it.","Je suis Andy Kimu, l'instructeur des Mercenaires. Je suis là pour enseigner l'art du Mercenaire aux Vagabonds. J'avoue que ce rôle est nouveau pour moi, mais je fais de mon mieux…"
NPC_000396,"Rhisis will be with you, always, young one.","Rhisis sera toujours avec toi, jeune enfant."
NPC_000397,Hmm Aha! Why not ask the vagrants? Maybe they can handle this.,Hmm… Pourquoi ne pas demander aux autres Vagabonds ?
NPC_000398,Merry Christmas! I hope everything goes well this time!,Joyeux Noël !! J'espère que les fêtes se passent bien cette année !!
NPC_000399,My name is Saint Aramy and I am one of the Santa's in the Madrigal Christmas Society. Nice to meet you,"Bonjour, je m'appelle Saint Aramy, et je suis l'un des Pères Noël de Madrigal."
NPC_000400,Hey! Merry Christmas!,Et Joyeux Noël !!
NPC_000401,Hmm It is very hard to track Noie's Planet in the Amedus galaxy. Maybe I have to use the chaos theory.,Hmm… il est très difficile de suivre la planète de Noier dans la galaxie Amedos… Peut-être devrais-je avoir recours à la théorie de chaos.
NPC_000402,"*Hmmm... carry the two, divide by zero, and subtract the square root of fourte... Wait a minute. Divide by zero? That's impossible! This would be so much easier if I had more than just this flimsy abacus.","Et il se réveillera… Le Héros ressuscitera à nouveau dans un lieu de souffrance et de mort, empli du bruit des machines…"
NPC_000403,"Hi there! My name is Ata Milleniut and I am learning Astronomy from Noie, my mentor. Hey, do you think you could analyze this fractal curve?","Bonjour, mon nom est Ata Millenuit et j'étudie l'astronomie auprès de Noier. Hmm… saurais-tu analyser cette fractale ?"
NPC_000404,Argh! Where was I? Distractions...,"Désolé, je suis occupé pour le moment…(se parlant à soi-même) Donc cette fractale serait… Hmm…"
NPC_000405,Brothers! What should I do? Huh? Christmas.. Christmas will be Ruined!,Mes frères ! Que dois-je faire ? Huh ? Noël…Noël sera… (en pleurs)
NPC_000406,I hope you have a wonderful Christmas!,Je te souhaite un merveilleux Noël.
NPC_000407,My name is Saint Atto and I am one of the Santa's in the Madrigal Christmas Society. Nice to meet you,"Bien le bonjour. Mon nom est Saint Atto, comme tu peux le voir, je suis l'un des Pères Noël de Madrigal."
NPC_000408,Merry Christmas! Merry Christmas!,Joyeux Noël ! Joyeux Noël ! Ho ho ho
NPC_000409,"The perfect shields of the Bobo family are only here, in the Shield Shop of Boboku!","Les fameuses armures créées par la famille Bobo sont en vente ici, et je m'occupe aussi de toutes vos réparations !"
NPC_000410,What should I ask you to do?,Que puis-je faire pour toi ?
NPC_000411,"You won't find a better armor selection in all of Flaris, I'll guarantee you that! ","Le secret de la confection des armures ? Je ne peux malheureusement te le révéler, comprends moi…"
NPC_000412,"Who am I? You must be joking. I'm only the most famous armorer in Flarine! I'm Boboko Bobo and I run the Bobo family Armor Shop for new Mercenaries, Acrobats and Assists.","Bienvenue, je suis Boboko Bobo. Je suis le propriétaire de cette boutique d'armure, et je m'occupe aussi de toutes les réparations d'équipement. Mon grand frère Boboku tiens le magasin d'armes à proximité."
NPC_000413,Tell your friends buy Bobo Family Equipment!,Seul un équipement de qualité protégera ta vie ! N'oublie jamais cela...
NPC_000414,"Your weapon is looking a little dull there, friend. Thank Rhisis for you, I buy and sell weapons!","Ton arme a l'air un peu terne, mon ami. Merci à Rhisis pour toi, j'achète et je vends des armes !"
NPC_000415,Here you are. Please solve this as soon as possible.,Et voilà.
NPC_000416,"*sighs* Oh, sorry! I was daydreaming about Julia over there. She's so amazing! Hey, do you think a girl like her and a guy like me could ever be? What? How could she resist me?!","Je suis le fils aîné de la famille, il serait temps pour moi de me marier… Ha ha (rougissant) Pour être honnête j'aime Julia... Elle est adorable n'est-ce pas ?"
NPC_000417,"Greetings from the Bobo Family, stranger! I am Boboku Bobo. I run the Weapon Shop here in Flarine. Have a look around and don't forget to visit my brother's shops!","Je m'appelle Boboku Bobo, et voici ma fameuse boutique d'arme. Je peux aussi appliquer un piercing sur une armure, afin que tu puisses l'améliorer. Au fait, mon petit frère vend des armures à côté, n'hésite pas à y jeter un oeil."
NPC_000418,Thanks for stopping by! Tell Julia I said hello!,N'oubliez pas que la famille Bobo sera toujours là pour vous proposer les meilleurs équipements !
NPC_000419,"Do not worry, where there is a will, there is a way.","Ne t'inquiètes pas, il y a toujours une solution."
NPC_000420,Have you been a very good boy this year? Then you should be rewarded with a big present Ha ha ha,As-tu été sage cette année jeune aventurier ? Dans ce cas tu mérites un beau cadeau ! Ho ho ho.
NPC_000421,My name is Saint Buruto and I am one of the Santa's in the Madrigal Christmas Society. Nice to meet you,"Bonjour ! Mon nom est Saint Buruto, et je suis l'un des Pères Noël de Madrigal."
NPC_000422,Ha ha ha! Merry Christmas!,Ho ho ho ! Joyeux Noël !
NPC_000423,"Mommy, I am hungry.","Maman, j'ai faim !"
NPC_000424,"I moved here with my father I do not have citizenship yet, but I will very soon.",Je viens de m'installer ici avec mon père. Nous n'avons pas encore la citoyenneté… mais nous espérons l'obtenir très bientôt.
NPC_000425,"My name is ChiChi Horis, and this is my father Paul Horis.","Je m'appelle Chichi Horis, et voici mon père, Paul Horis."
NPC_000426,Good bye,Au revoir !
NPC_000427,The new year has come!,Le Nouvel An est arrivé !!
NPC_000428,"How strange, I cannot remember the Happy New Year song.","C'est bizarre, je n'arrive pas à me rappeler la chanson du Nouvel An…"
NPC_000429,Happy new year!,Bonne année !!!
NPC_000430,New year has come!,"Santé, Bonheur et Richesse !"
NPC_000431,You will be happy with the leader of the chorus. That is me! My name is Monaco.,"Je m'appelle Monako, je fais partie du choeur de Madrigal."
NPC_000432,New year has come!,"Santé, Bonheur et Richesse !"
NPC_000433,How strange I do not remember the Happy New Year song.,"Erf, impossible de me rappeler de l'air de la chanson du Nouvel An…"
NPC_000434,New year has come!,"Santé, Bonheur et Richesse !"
NPC_000435,"How strange, I do not remember the Happy New Year song.","Olala, je ne me souviens plus de la chanson du Nouvel An !"
NPC_000436,"Trust in Aenn, and your path shall be lit with the light of a thousand candles.","Vraiment ? Peut-être penses-tu ainsi car tu es écrivain, mais je ne veux pas faire de vague avec ça…"
NPC_000437,"The Heroes sacrificed themselves to defeat Shade, but she will one day return. We must prepare.","Les héros se sont sacrifiés pour vaincre Shade, mais elle reviendra un jour. Nous devons nous y préparer."
NPC_000438,"My name is Clamb Cobonet, the Ringmaster Wise Man. I am here to preserve the legacy of Aenn, the Ringmaster Hero and to light the path for those that wish to follow in Aenn's footsteps. Have faith, young one, Aenn watches over you.","Je suis le Sage des Prêtres, Clamb Cobonet. J'étudie et médite sur la vie d'Aenn, le Héros des Prêtres."
NPC_000439,"Follow the path of Aenn, and you will never be forgotten.","Quoi qu'en dise les gens, ils ont été les Héros de Madrigal. N'es-tu pas de mon avis."
NPC_000440,Bubble watches over all aspiring heroes. ,Bubble veille sur tous les héros en herbe.Profite bien de ton aventure ! Ha ha ha !
NPC_000441,The shields of the Heroes have defended Madrigal from the wrath of Shade. We are forever grateful for their bravery and wish to preserve their memory for all time.,Les boucliers des Héros ont protégé Madrigal de la colère de Shade. Nous leur serons éternellement reconnaissants pour leur bravoure et souhaitons perpétuer leur mémoire à jamais.
NPC_000442,"My name is Cuarine Coexar and I am the Psykeeper Wise Man. I preserve the history of the Heroes and provide guidance for those wishing to follow the path Offerep, the Psykeeper Hero.","Je suis le Sage des Sorciers, Cuarine Coexar. J'étudie et médite sur la vie d'Offerep, le Héros des Sorciers."
NPC_000443,"Follow the path of the Heroes, and you will never lose your way.",La puissance du Sorcier tiens à la force de son esprit. Souviens-toi de cela !
NPC_000444,A strange energy emanates from this fountain. What is it?,Tu es vraiment surprenant. Ha ha ha.
NPC_000445,"We lie in wait, preparing for the worst, and hoping for a future to come when the heroes will arise once more.",Ils se réveilleront dans le sanctuaire… et deviendront alors de véritables Héros.
NPC_000446,"My name is Cuzrill Rembright and I am the Elementor Wise Man. I preserve the history of the Heroes and provide guidance for those wishing to follow the path Lillip, the Elementor Hero.","Je suis le Sage des Elémentalistes, Cuzrill Rembright. J'étudie et médite sur la vie de Lillip, le Héros des Elémentalistes."
NPC_000447,"Trust in the legacy of the Heroes, adventurer. For it is all that can save us now.",Seul ceux gagnés par la sagesse pour honorer la volonté de Lillip. Je te souhaite cette vertu.
NPC_000448,Welcome to #b#cff0000ffDior Station#nc#nb! You can find #b#cffff0000flying information#nc#nb here.,Bienvenue à la #b#cff0000ffGare de Dior#nc#nb ! Vous pouvez trouver ici des #b#cffff0000informations sur les vols#nc#nb. À ceux qui cherchent à atteindre le septième ciel : venez à la station de vol de Flarine !
NPC_000449,"Please, if you can help me, I will be in your debt.","S'il te plaît, rend moi service."
NPC_000450,My family has managed the Flarine Station for generations. I am proud to continue that tradition. ,"Bienvenue à la station de vol de Flarine, que puis-je faire pour toi ?"
NPC_000451,"My name is Dior Christin. I've lived in Flarine all my life and I love this place. Look at me, I can't stop bouncing! Anyway, I manage the station here so let me know if you have any questions! ","Je m'appelle Dior Cristin. Ma famille s'occupe de cette station de vol depuis des générations, et en a fait la meilleure station de tout Flaris."
NPC_000452,"1. First, you'll need to buy a broom or a board and be at least level 20 in order to fly\n 2. Next, double-click the board or broom in your inventory or simply move it to a hot key to climb aboard.","1. À partir du niveau 20, achète un balai ou une planche à la station.\n 2. Double clique sur ton véhicule pour l'enfourcher. Tu peux également le placer dans ta barre de raccourcis."
NPC_000453,3. Press the Space Bar to accelerate your flying vehicle. Press the Space Bar key again while moving to stop. Think of the accelerator like a toggle button for *Go* and *Stop*.,3. Ensuite appuie sur la barre d'espace pour décoller ou t'arrêter.
NPC_000454,"4. To navigate, you can simply hold the Right Mouse Button down and angle the camera in the direction that you want to go.\n Alternatively, you can also use the W, A, S and D controls to turn.","4. Utilise alors les touches Z, Q, S, D ou maintiens enfoncé le bouton droit de la souris pour contrôler ton vol."
NPC_000455,"5. Additionally, you can simply tap the Right Mouse Button twice to lock the camera to the mouse pointer. This allows you to navigate without holding down the right mouse button. Clicking twice again will turn off this effect.",5. Double clique sur le bouton droit de la souris pour changer de direction sans maintenir le bouton enfoncé.
NPC_000456,6. Anyone can fly in Madrigal. You simply have to acquire a flying vehicle!\n 7. There are numerous makes and models of flying vehicles. Trying shopping around in player shops or click the Use Premium Item Shop icon next to the Start Button.,6. Il y a de nombreux modèles de véhicules volants. Tu peux en trouver dans les boutiques d'autres joueurs ou en parcourant la Boutique d'Objets Premium.
NPC_000457,"I hope the information I gave you was helpful. You're on your own now, aviator! See you in the clouds!","J'espère que ces informations t'auront été utiles. A toi de jouer maintenant, je te souhaite bon vol !"
NPC_000458,"1. Occasionally, you will run into some pesky masquerpets while flying. You will see a red box surrounding them.",Le combat en vol possède quelques particularités:\n1. Des symboles ainsi qu'une boîte rouge entourent les monstres volants quand tu t'en approches.
NPC_000459,"2. You can target these creatures with the Left Mouse Button. If you lose sight of them while flying, a green arrow appears on the edge of the screen to indicate which direction you need to turn. ","2. Les monstres volants peuvent être ciblés en utilisant la touche Tab ou un clic gauche sur la souris. Si vous les perdez de vue, une flèche verte apparaître sur le bord de l'écran pour vous indiquer leur direction."
NPC_000460,"3. To attack the creature, simply get as close as you can and press the Left Mouse Button or the Insert Key.\n 4. If you want to follow the monster automatically, press the Z Key.","3. Pour attaquer un monstre ciblé, il te suffit de t'en approcher et cliquer gauche, ou presser la touche Insert.\n4. Le monstre peut également être suivi automatiquement en pressant sur la touche W."
NPC_000461,5. Magicians and Acrobats can shoot from range while in the air. Mercenaries and Assists must rely on melee attacks. You can also use your skills!,"5. Une fois morts, les monstres volants lâchent des objets qui restent en suspend dans les airs."
NPC_000462,"6. When you destroy a flying masquerpet, any dropped loot will be placed into your inventory automatically. If there is no room in your inventory, the loot is lost, so be careful!","6. Pour ramasser l'objet, clique dessus ou utilise le mouvement adéquat pour ramasser les objets à proximité (touche F3 par défaut)."
NPC_000463,"7. That about covers it for your flying combat training, cadet! Just one more thing... Don't crash and burn! Hahaha, just a little pilot humor.","7. Les Mercenaires et Acolytes peuvent attaquer une fois au corps à corps, alors que les Magiciens et Acrobates sont en mesure d'attaquer à distance."
NPC_000464,Have fun out there and be safe! Don't forget to check your six!,Je te souhaite de devenir aussi redoutable dans les airs que sur terre.
NPC_000465,"Goodbye, adventurer! Feel free to stop by again if you have any questions about flying.","Avant tout, prenez plaisir à voler !!"
NPC_000466,Why do we all have to wear the same outfit? ,Ha ha ha ! Je me sens vraiment à mon aise ici.
NPC_000467,"Rhisis created the three Clown Gods; Shade, Iblis and Bubble and bestowed each of them with a different aspect of herself. Shade, infused with the Fear and Rage of Rhisis, nearly destroy our original home, Roika.","Rhisis créa les trois Dieux : Shade, Ivillis et Bubble, et leur conféra à chacun un aspect différent d’elle-même. Shade, imprégnée de la Peur et de la Rage de Rhisis, faillit détruire notre monde d'origine."
NPC_000468,"I am Domek Ilujian, the Billposter Wise Man. I am here to record the history of the Billposter Hero, Roentel, and educate travelers on Madrigal's rich history.","Je suis le Sage des Moines, Domek Ilujian. J'étudie et médite sur la vie de Roentel, le Héros des Moines."
NPC_000469,"Farewell, traveler. If we do not learn from our past, we are doomed to repeat it.",Il faut toujours avoir de l'espoir… Eux aussi ont toujours su garder espoir.
NPC_000470,#b#cff8a004fCheck in here to review the weekly results of the #cfffc0000Guild Siege!#nc#nb,#b#cff0000ffVoulez-vous connaître le résultat de la dernière Guerre des Guildes ?#nc#nb
NPC_000471,Only the most cunning of guilds can hope to achieve victory in the Guild Sieges. Are you ready for the challenge?,Votre courage et votre sagesse conduiront votre guilde à la victoire !
NPC_000472,"Hello, it's very nice to meet you! I am the Rewards Manager for the Guild Siege Center. I can reward prize money, return application fees, or even show you this week's ranking for the Guild Siege.","Je suis la manager des Guerres de Guildes. Je m'occupe de distribuer les récompenses, rembourser les frais d'inscription, réaliser les classements, etc."
NPC_000473,Good luck to you! I hope I see you on the ranking charts!,Bonne chance à tout le monde pour la Guerre des Guildes !
NPC_000474,"Madrigal's ecosystem is truly fascinating! The more you discover, the greater the mystery!","L'écosystème de Madrigal est vraiment étonnant ! Plus on l'étudie, plus le mystère s'épaissit..."
