Key,English,French
NPC_100055,You like crystals right? No way! Me too! I honestly can't believe it. We both like crystals!,"Tu aimes les cristaux, n'est-ce pas ? Incroyable ! Moi aussi. Je peux à peine y croire. Nous aimons tous les deux les cristaux !"
NPC_100056,,
NPC_100057,,
NPC_100058,,
NPC_100059,,
NPC_100060,,
NPC_100061,You are ready to challenge the Red Meteonyker. Are you sure you would like to enter?\n[Yes][IDS_NPC_Yes_Enter] / [No][IDS_NPC_No_Enter]\n\n#cffff0000All the party members participating must be close to you to enter.#nc,Vous vous apprêtez à affronter le Meteonyker Rouge. Êtes-vous sûr de vouloir entrer ?\n[Oui][IDS_NPC_Yes_Enter] / [Non][IDS_NPC_No_Enter]\n\n#cffff0000Tous les membres du groupe voulant entrer doivent être proches de vous.#nc
NPC_100062,You must go and speak with Kumah to forge the Volkane Key.,Vous devez aller parler à Kumah pour forger la Clé de Volcane.
NPC_100063,"Hello I am Azria Pang, the oldest of the Pang brothers. We manage the Lodelights.","Bonjour ! Je suis le Pang d'Azria, le plus vieux des frères Pang. Nous sommes en charge des Havres de Vie."
NPC_100064,#b#cff8a004fThe #cfff60000Level 80 Guild Siege Application Center #cff8a004fis open!#nc#nb,#b#cff8a004fLe #cfff60000Centre d'inscription à la Guerre de Guildes niveau 80#cff8a004fest ouvert !#nc#nb
NPC_100065,Good Luck!,Bonne chance !
NPC_100066,#b#cff8a004fEnjoy the #cfff60000Level 60 Guild Siege #cff8a004fbefore your second class!#nc#nb,#b#cff8a004fProfitez de la #cfff60000Guerre de Guildes niveau 60 #cff8a004favant votre changement de classe !#nc#nb
NPC_100067,"With global warming, I’m gonna end up living in a freezer..","Avec le réchauffement climatique, je vais finir par devoir vivre dans un congélateur..."
NPC_100068,See you soon! At least if I still exist when you come back...,"À la prochaine ! Du moins, si j'existe toujours quand tu reviendras..."
NPC_100069,It is way too early for you... Come back when you reach the appropriate level!,Il est bien trop tôt pour toi... Reviens quand ton niveau sera suffisant !
NPC_100070,Creatures are appearing from the Leren Chasm. We must stop them!,"Des créatures apparaissent, venant du Gouffre de Leren. Nous devons les arrêter !"
NPC_100071,Great strength will be required to survive within the Leren Chasm.,Il te faudra une grande force pour survivre le Gouffre de Leren.
NPC_100072,This place is far too dangerous.. leave now or you may get hurt.,Cet endroit est bien trop dangereux... Pars maintenant ou tu pourrais être blessé.
NPC_100073,"I am a Flarine guard, assigned my post here to protect passersby from entering the Leren Chasm.","Je suis un garde de Flarine, mais j'ai été posté ici pour empêcher les passants d'entrer dans le Gouffre de Leren."
NPC_100074,Farewell.. may you be safe from the dangers of Leren Chasm!,Au revoir... Reste à l'abri des dangers du Gouffre de Leren !
NPC_100075,Will this storm ever end?..,Cette tempête finira-t-elle jamais...?
NPC_100076,You must have an iron will to survive the Rhisis Catacombs.,Seuls ceux qui ont une volonté de fer survivront aux Catacombes de Rhisis.
NPC_100077,"These grounds are electrified.. return from where you can, less you be shocked.","Le sol est électrifié... Retourne d'où tu viens, ou tu risques d'être électrocuté."
NPC_100078,"I hail from the noble ranks of Saint City's guardians, entrusted with the duty of safeguarding the Rhisis Catacombs from curious adventurers.","Je suis un garde de Saincity, mais j'ai été posté ici pour protéger les aventuriers sans méfiance des Catacombes de Rhisis."
NPC_100079,Goodbye for now.. be safe from the storms!,Au revoir... Reste à l'abri des tempêtes !
NPC_100080,How long as this palace been hidden within the Cave of Envy?,Depuis combien de temps ce palais est-il caché dans la Caverne de l'Envie ?
NPC_100081,Beware the masquerpets touched by waters of the Envy Depths.,Fais attention aux monstres contaminés par les eaux de l'Abîme de l'Envie.
NPC_100082,Turn around while you still have some life left in you.. these waters are cursed.,Retourne d'où tu viens tant qu'il reste de la vie en toi... Ces eaux sont maudites.
NPC_100083,I am a guard hired by the Mayor of Darken City to ensure the safety of adventurers who wander too close to the Envy Depths.,Je suis un garde employé par le Maire de Darken pour assurer la sécurité des aventuriers qui s'approchent trop de l'Abîme de l'Envie.
NPC_100084,Tell those who are weak to avoid the Envy Depths at all costs!,Dis à ceux qui sont faibles d'éviter l'Abîme de l'Envie quoi qu'il arrive !
NPC_100085,The heart of the Guardiane Sanctuary has been torn asunder!,Le cœur du Sanctuaire de Gardiane a été arraché !
NPC_100086,Death and decay are all that remain within the Guardiane Sanctuary..,Seul la mort et la pourriture sont présentes dans le Sanctuaire de Gardiane.
NPC_100087,Escape this place before you are turned into the living dead like those poor souls.,Quitte ces lieux avant que tu ne deviennent mort-vivant comme ces pauvres âmes.
NPC_100088,I was sent here to guard the entrance of the Guardiane Sanctuary.. hopefully the Purple Magician does not come back.,J'ai été envoyé ici pour protéger l'entrée du Sanctuaire de Gardiane... J'espère que le Mage Pourpre ne reviendra pas.
NPC_100089,May the heart of Guardiane be one day restored!,Que le cœur de Gardiane soit un jour restauré !
NPC_100090,Something strange is in the mountain air of Storm Peak..,Quelque chose d'étrange est dans l'air du Pic de Tempête...
NPC_100091,Within the Storm Peak mountain a great evil is said to lurk.,"À l'intérieur du Pic de Tempête, on dit qu'un mal immense se cache."
NPC_100092,Go back home before you get frostbite!,Rentre chez toi avant d'attraper des engelures !
NPC_100093,"I've watched over the Storm Peak mountain trails for many years, ensuring the safety of all who venture forth.",Cela fait bien longtemps que je garde les sentiers menant au Pic de Tempête.
NPC_100094,"One day you will see, that the Frostiae peak ahead holds a dark secret.",Tu verras un jour que le pic de Frostiae ici cache un sombre secret.
NPC_100095,Azria Mine,Mine d'Azria
NPC_100096,"I shouldn't say anything, but there are other mines abandoned around Madrigal that contain power even stronger than that within Dekane. One of those mines is hidden in the mountains of Azria.","Je ne devrais rien dire, mais il existent d'autres mines abandonnées autour de Madrigal, qui contiennent un pouvoir encore plus fort que celui de Dekane. Une de ces mines est cachée dans les montagnes d'Azria."
NPC_100097,"My name is Rankashu, and my ancestors have lived in the mountains of Darkon long before you creatures ever showed up. And no.. I am not one of those stuck up High-Dwarpets.","Je m'appelle Rankashu, et mes ancêtres vivaient dans les montagnes de Darkon bien avant que vous autres ne fassiez votre apparition. Et non... je ne suis pas un de ces Haut-Dwarpets coincés."
NPC_100098,My people are all gone.. I am alone here.,Mon peuple a disparu... Je suis seul ici.
NPC_100099,I have lived here for what feels like an eternity collecting materials that may one day save Madrigal.,"J'ai vécu ici pendant ce qui me semble être une éternité, rassemblant des matériaux qui pourraient un jour sauver Madrigal."
NPC_100100,No one should be here.. leave before you are killed.,Personne ne devrait être ici... Pars avant d'être tué.
NPC_100101,"My name is Rankashin.. I have lived here for many years now. Long ago I helped build a powerful weapon, but in the end it was turned against us..","Je m'appelle Rankashin. Je vis ici depuis de nombreuses années. Il y a longtemps, j'ai aidé à construire une arme puissante, mais elle s'est finalement retournée contre nous..."
NPC_100102,May the Clockworks War never be forgotten!,Que la Guerre du Clockworks ne soit jamais oubliée !
NPC_100103,"Hi I am Kebaras Pang, the strongest of the Pang brothers. We manage the Lodelights.","Bonjour, je suis le Pang de Kebaras, le plus fort des frères Pang. Nous gérons les Havres de Vie."
NPC_100104,Cursed Symbol,Symbole Corrompu
NPC_100105,"I can feel the dark power radiating from your bag.. you have one of the symbols of corruption, don't you? Hand it to me if you don't mind.","Je peux sentir la puissance obscure qui émane de votre sac... Vous avez l'un des Symboles Corrompus, n'est-ce pas ? Donnez-le moi si vous le voulez bien."
NPC_100106,Give the Symbol,Donner le Symbole
NPC_100107,"The past few years have felt like a blur to me. I wrote this letter to an old friend, but I can't remember who..","Ces dernières années m'ont semblé floues. J'ai écrit cette lettre à un vieil ami, mais je ne me souviens pas de qui..."
NPC_100108,IDS_Hael_Letter,IDS_Hael_Letter
NPC_100109,"Though Hael has gained back some memories of his past, it saddens me that he has forgotten so much. Thank you for bringing me his letter.","Bien que Hael ait retrouvé quelques souvenirs de son passé, je suis triste qu'il ait oublié tant de choses. Merci de m'avoir apporté sa lettre"
NPC_100110,Give Letter,Donner la Lettre
NPC_100111,This letter is fascinating.. apparently Hael began to lose his memory after a series of strange encounters with odd creatures along his travels. And look.. there's a map here.,"Cette lettre est fascinante... Apparemment, Hael a commencé à perdre la mémoire après une série de rencontres étranges avec des créatures bizarres au cours de ses voyages. Et regardez... il y a une carte ici."
NPC_100112,You are a rare specimen. Not like other humans I see. Speak with me once more and I will show you a secret..,Vous êtes un spécimen rare. Pas comme les autres humains que je vois. Parlez-moi encore une fois et je vous dirai un secret...
NPC_100113,"Wow, you found my favorite trinket! If you had a map, I could show you where something special is hidden..","Wow, vous avez trouvé ma babiole préférée ! Si vous aviez une carte, je pourrais vous montrer où se cache quelque chose de spécial..."
NPC_100114,I love rare trinkets! My favorite trinket drops from a cute one-eyed bat..,J'adore les bibelots rares ! Ma babiole préférée tombe d'une jolie chauve-souris borgne...
NPC_100115,You've been touched by an incredible amount of purple magic. It's good that you found me before you became one of them..,Vous avez été touchée par une quantité incroyable de magie violette. C'est une bonne chose que vous m'ayez trouvé avant de devenir l'un d'entre eux...
NPC_100116,"It's not too late to save your mind of corruption, but we must act quickly. To cleanse shade's aura from your body I'll need a stone blessed by angels and a powerful elixir that can cure disease.","Il n'est pas trop tard pour sauver votre esprit de la corruption, mais nous devons agir vite. Pour nettoyer l'aura de l'ombre de votre corps, j'aurai besoin d'une pierre bénie par les anges et d'un puissant élixir capable de guérir les maladies."
NPC_100117,"Ah! You've brought everything needed to cleanse the evil from your body, just in time, too! In fact, there's enough here to create a second elixir of cleansing.. perhaps it will be useful in your travels.","Ah ! vous avez apporté tout ce qu'il faut pour nettoyer le mal de votre corps, et juste à temps ! En fait, il y a de quoi créer un deuxième Elixir de Purification... peut-être sera-t-il utile lors de vos voyages."
NPC_100118,,
NPC_100119,,
NPC_100120,,
NPC_100121,Who is gonna attend the #bfinals in Manila#nb and win the #bFlyff World Championship 2026#nb? Prove that you are the best!,Qui atteindra les #bFinales de Manille#nb et remportera le #bChampionnat du monde Flyff 2026#nb ? #b#cff0000ffAstral réussira-t-il une nouvelle fois à s’imposer ?#nc#nb
NPC_100122,"Welcome, competitor! I am Ava, the manager of the Flyff World Championship. I will trade you the best equipment you can get to win the competition!","Bienvenue, compétiteur ! Je suis Ava, la responsable du Championnat du monde Flyff 2026. Je vous offrirai le meilleur équipement possible pour gagner la compétition !"
NPC_100123,"Hm I can feel that you are the best PvE competitor! No, wait... Maybe PvP? Ha I don't know. Good luck!","Hm je sens que tu es le meilleur compétiteur JcE ! Non, attendez... Peut-être en JcJ ? Je ne sais pas. Bonne chance !"
NPC_100124,May the best win!,Que le meilleur gagne !
NPC_100125,"I am an automated machine intended to replace and eliminate humans. However, I am also designed to deliver rewards in exchange for coins.","Je suis une machine automatisée destinée à remplacer et à éliminer les humains. Cependant, je suis également conçu pour offrir des récompenses en échange de pièces de monnaie."
NPC_100126,"We will probably meet again, and I might have more items for you next time!","Nous nous reverrons probablement, et j'aurai peut-être d'autres articles à vous proposer la prochaine fois !"
NPC_100127,"Hi, I am Private Leo. I got separated from my group after entering this dungeon.","Bonjour, je suis le Soldat Leo. J'ai été séparé de mon groupe après être entré dans ce donjon."
NPC_100128,"Thank you for saving me, I owe you one!","Merci de m'avoir sauvé, je vous en dois une !"
NPC_100129,Let's get out of here!,Partons de là !
NPC_400000,Collect some #bW-Token#nb from masquerpets and I will give you nice rewards!,Récupère des #bToken-W#nb en tuant des monstres et je te donnerai de belles récompenses !
NPC_100130,"Upgrade Costume Boxes with Repair Hammer that drops when you hunt a monster, and get various items!","Améliorez la Boîte de Costume avec un Marteau de Réparation qui tombe lorsque vous chassez un monstre, et obtenez divers objets !"
NPC_100131,"I'm the guardian of The Wilds, a wild and savage realm. What brings you here?","Je suis le gardien de Désiréa, un royaume sauvage. Qu'est-ce qui vous amène ici ?"
NPC_100132,Always another group thinking they can conquer 'The Wilds.' Let's see who comes out in one piece this time.,Encore un autre groupe qui pense pouvoir conquérir Désiréa. Voyons qui s'en sortira en un seul morceau cette fois-ci.
NPC_100133,"Stay safe out there. Remember, not all who wander find their way back.",Restez en sécurité. N'oubliez pas que tous ceux qui s'égarent ne retrouvent pas le chemin du retour.
NPC_100134,"A wise decision, my friend. You're about to embark on a journey that will carve your legend. Brace yourself, for the untamed awaits.","Une sage décision, mon ami. Vous êtes sur le point d'entamer un voyage qui façonnera votre légende. Préparez-vous, car la nature sauvage vous attend."
NPC_100135,"Life's full of choices, and 'The Wilds' isn't for everyone. If you ever hunger for adventure, remember where I stand.","La vie est faite de choix, et Désiréa n'est pas pour tout le monde. Si jamais vous avez soif d'aventure, rappelez-vous où je me trouve."
NPC_100136,Interested in having your very own room?,Vous souhaitez avoir votre propre chambre ?
NPC_100137,You now have the opportunity to claim your own space! Invite a few friends or organize exclusive meetings with your guildmates.,Vous avez maintenant la possibilité de revendiquer votre propre espace ! Invitez quelques amis ou organisez des réunions exclusives avec vos compagnons de guilde.
NPC_100138,I specialize in crafting top-notch furniture and other household items to adorn your room. I'm renowned as the finest carpenter around!,Je suis spécialisé dans la fabrication de meubles et d'autres articles ménagers de qualité supérieure qui orneront votre pièce. Je suis réputé pour être le meilleur menuisier qui soit !
NPC_100139,Owning a splendid home can rejuvenate and fortify you for battles in Madrigal.,Posséder une splendide maison peut vous rajeunir et vous fortifier pour les batailles à Madrigal.
NPC_100140,Does your guild aspire to have its own house?,Votre guilde aspire-t-elle à avoir sa propre maison ?
NPC_100141,"Greetings! If you're interested in acquiring a guild ship, you're in the right place. You'll need a guild with a minimum of 12 members.","Salutations ! Si vous souhaitez acquérir une maison de guilde, vous êtes au bon endroit. Il vous faut une guilde comptant au moins 12 membres."
NPC_100142,"Hello, my name is Lousiana, and I manage this ship.","Bonjour, je m'appelle Lousiana et je dirige ce navire."
NPC_100143,"Look who we have here on the vibrant shores of Coral Island! After all these years, fresh faces like yours bring a spark of excitement to my inventor's heart. With your helping hand, I just might accelerate the pace of my ingenious projects!","Regardez qui nous avons ici sur les rives vibrantes de l'Île Corail ! Après toutes ces années, des visages frais comme le vôtre apportent une étincelle d'excitation à mon cœur d'inventeur. Avec votre aide, je pourrais bien accélérer le rythme de mes projets ingénieux !"
NPC_100144,"Hey there! It's a thrill to have you join our little island community! I'm on the brink of something revolutionary, and I need someone as creative and ambitious as you to help me build my next groundbreaking invention. Together, we can shape the destiny of Madrigal!","Bonjour à tous ! Je suis ravi que tu rejoignes notre petite communauté insulaire ! Je suis sur le point de réaliser quelque chose de révolutionnaire, et j'ai besoin de quelqu'un d'aussi créatif et ambitieux que toi pour m'aider à mettre au point ma prochaine invention révolutionnaire. Ensemble, nous pouvons façonner le destin de Madrigal !"
NPC_100145,"Building complex machinery is like crafting art - it takes time, patience, and vision. If you're intrigued by the world of invention and wish to collaborate in the future, know that I'll be here, ready to embark on electrifying ventures!","Construire des machines complexes, c'est comme faire de l'art : cela demande du temps, de la patience et de la vision. Si le monde de l'invention vous intrigue et que vous souhaitez collaborer à l'avenir, sachez que je serai là, prêt à m'embarquer dans des aventures électrisantes !"
NPC_100146,"Greetings, I'm Remi! A fervent inventor who can't resist the allure of gadgets and gizmos. Coral Island is my canvas, and I'm constantly conjuring up new marvels and tinkering with the unknown.","Bonjour, je suis Remi ! Un fervent inventeur qui ne peut résister à l'attrait des gadgets et autres bricoles. L'Île Corail est ma toile, et je n'ai de cesse d'imaginer de nouvelles merveilles et de bricoler vers l'inconnu."
NPC_100147,"As you set forth on your adventures across this bewitching island, remember it's a realm of both beauty and peril. Be cautious, intrepid traveler, for the world of invention may be exhilarating, but Madrigal can be equally treacherous!","Alors que vous partez à l'aventure sur cette île envoûtante, n'oubliez pas qu'il s'agit d'un royaume à la fois beau et dangereux. Soyez prudent, intrépide voyageur, car le monde de l'invention peut être exaltant, mais Madrigal peut être tout aussi traître !"
NPC_100148,"Welcome to our charming Coral Island village! I've dedicated myself to mastering the culinary arts, conjuring delectable dishes with the island's finest ingredients.","Bienvenue dans notre charmant village de l'Île Corail ! Je me suis consacré à la maîtrise de l'art culinaire, en concoctant des plats délectables avec les meilleurs ingrédients de l'île."
NPC_100149,"Oh, what a delight to have new and hungry souls to satiate! There's no greater joy for a chef like me than the smiles and satisfaction of full bellies.",Quel bonheur d'avoir de nouvelles âmes affamées à rassasier ! Il n'y a pas de plus grande joie pour un chef comme moi que les sourires et la satisfaction de ventres pleins.
NPC_100150,"If you ever find yourself yearning for the extraordinary flavors that Coral Island has to offer, look no further. Come to me, and I'll whip up a tantalizing feast that'll leave your taste buds dancing! Rare food ingredients, you say? Consider it a delicious deal!","Si vous avez envie de goûter aux saveurs extraordinaires de l'Île Corail, ne cherchez plus. Venez me voir et je vous concocterai un festin alléchant qui fera danser vos papilles ! Des ingrédients rares, dites-vous ? Considérez cela comme une délicieuse affaire !"
NPC_100151,"I'm Pau Pau, the culinary maestro of Coral Island. I've harnessed my love for cooking to nourish and cherish my friends here. May your time on this island be a banquet of delights, and may your travels be seasoned with happiness!","Je suis Pau Pau, le maestro culinaire de l'Île Corail. J'ai exploité mon amour de la cuisine pour nourrir et chérir mes amis ici. Que votre séjour sur cette île soit un banquet de délices et que vos voyages soient agrémentés de bonheur !"
NPC_100152,"Keep those eyes wide open as you explore the island; you'll stumble upon a treasure trove of marvelous cooking ingredients. They're scattered like edible gems all around Coral Island, waiting for the discerning palates of adventurous souls like yours!","Ouvrez grand les yeux en explorant l'île ; vous tomberez sur un trésor d'ingrédients culinaires merveilleux. Ils sont disséminés comme des joyaux comestibles tout autour de l'Île Corail, attendant les palais avisés des aventuriers comme vous !"
NPC_100153,"It's a real treat to have you grace our cozy little village. Our mail system hasn't been very active the past few years, but I have a hunch that things are about to change now that the island's mysterious mist has lifted!","C'est un vrai plaisir de vous voir dans notre petit village douillet. Notre système de courrier n'a pas été très actif ces dernières années, mais j'ai le pressentiment que les choses sont sur le point de changer maintenant que le brouillard mystérieux de l'île s'est dissipé !"
NPC_100154,"You, my friend, are as sharp as a tack! It's no wonder the folks in this village put their faith in you. Your trustworthiness shines like a beacon.","Vous, mon ami, vous êtes très malin ! Il n'est pas étonnant que les habitants de ce village vous fassent confiance. Vous êtes digne de confiance et vous brillez tel un phare."
NPC_100155,"Coral Island is a haven, but peril lurks in the shadows. That's why we welcome outsiders like you with open arms. A helping hand from adventurers like you is always a ray of sunshine.","L'Île Corail est un havre de paix, mais le danger rôde dans l'ombre. C'est pourquoi nous accueillons les étrangers comme vous à bras ouverts. Un coup de main de la part d'aventuriers comme vous est toujours un rayon de soleil."
NPC_100156,"Greetings, greetings! I'm none other than your cheerful host, Sunny Pang. I'm here to make your island life a breeze. Whether it's sending heartwarming letters to friends, safeguarding your treasures in the bank, or just being the friendly face of our village, you can count on me!","Bonjour, bonjour ! Je ne suis autre que votre joyeux hôte, Sunny Pang. Je suis là pour faire de votre vie sur l'île un jeu d'enfant. Qu'il s'agisse d'envoyer des lettres réconfortantes à vos amis, de protéger vos trésors à la banque ou simplement d'être le visage amical de notre village, vous pouvez compter sur moi !"
NPC_100157,"Feel the warmth of Coral Island's embrace as you savor your stay, and rest assured, I'll be right here, ready to lend a helping flipper wherever I can. Enjoy the island, dear friend!","Sentez la chaleur de lÎle Corail vous étreindre pendant votre séjour, et soyez assuré que je serai là, prêt à vous donner un coup de main chaque fois que je le pourrai. Profitez de l'île, cher ami !"
NPC_100158,"Oh, what an absolute delight to welcome a visitor like you to our cozy village! Your presence warms my heart, and I hope that my humble wares bring a smile to your face.","Quel bonheur d'accueillir un visiteur comme vous dans notre petit village ! Votre présence me fait chaud au cœur, et j'espère que mes modestes marchandises vous donneront le sourire."
NPC_100159,We're deeply grateful for your kindness and support in helping our tight-knit community. Every bit of assistance is like a ray of sunshine on our village's path to prosperity.,Nous vous sommes profondément reconnaissants de votre gentillesse et de votre soutien à notre communauté. Chaque aide est comme un rayon de soleil sur le chemin de la prospérité de notre village.
NPC_100160,"Coral Island is a treasure trove of experiences waiting to be explored. Take your sweet time, immerse yourself in the lush jungles, and set sail on the boundless seas that surround this enchanting island.","L'Île Corail est un trésor d'expériences qui ne demande qu'à être exploré. Prenez votre temps, immergez-vous dans les jungles luxuriantes et partez à l'assaut des mers infinies qui entourent cette île enchanteresse."
NPC_100161,"I'm Kammie, your friendly neighborhood General Vendor. I make sure our village stays well-stocked with all the essentials our villagers and allies need to brave the wild frontiers of Coral Island.","Je suis Kammie, votre sympathique vendeuse générale. Je m'assure que notre village reste bien approvisionné en produits essentiels dont nos villageois et nos alliés ont besoin pour braver les frontières sauvages de l'Île Corail."
NPC_100162,"Don't be a stranger, dear visitor! If there's ever anything you desire or require, do return for a visit. I'll be here with open arms and a collection of goods to make your heart flutter!","Ne soyez pas farouche, cher visiteur ! Si vous avez besoin de quoi que ce soit, revenez me voir. Je serai là, les bras ouverts, avec une collection de produits qui fera battre votre cœur !"
