Key,English,Japanese
NPC_100032,"In a secret room sleep dragons from ancient times created by Shade ages ago. To defeat them, you'll need a well armed team. Ah, but there's one detail I forgot to mention, you need 1,000,000 Penya, you've already collected 50 Blood Trillipys and killed 50 Mutant Keakoon Workers to open the gate. Are you and your team ready to accept this challenge?\n[Yes][IDS_NPC_Yes] / [No][IDS_NPC_No]\n\n#cffff0000All the guild members participating must be close to you to enter.#nc","この秘密の部屋には昔、シェイドが創った古代のドラゴンが眠っているとされる。奴を倒すには絆を深めたチームと、ゲートを開けるための1,000,000ペニャが必要となる。君たちは血のトリルピを50匹集め、ゲリラキクン労働者を50体討伐してここにたどり着いた。英雄そのものだ。さあ、いってきたまえ。\n[はい][IDS_NPC_Yes] / [いいえ][IDS_NPC_No]\n\n#cffff0000参加するギルドメンバーは全員近くにいる必要があります。#nc"
NPC_100033,Would you like to take up the challenge again?\n[Yes][IDS_NPC_Yes] / [No][IDS_NPC_No]\n\n#cffff0000All the guild members participating must be close to you to enter.#nc,もう一度挑戦しますか？\n[はい][IDS_NPC_Yes] / [いいえ][IDS_NPC_No]\n\n#cffff0000参加するギルドメンバーは全員あなたの近くにいる必要があります。#nc
NPC_100034,Sorry but you are not rich enough.,申し訳ありませんが、あなたは十分な金持ちではありません。
NPC_100035,"It's alright, young successor. Only the bravest of souls can hope to stand against the strong Meteonyker. We'll keep him imprisoned here until the right person is ready to face him.",大丈夫、若い後継者です。勇敢な魂だけが強いメテオニカに立ち向かうことを望むことができます。適切な人物が彼と向き合う準備ができるまで、ここで彼を投獄し続けます。
NPC_100036,There are other brave souls locked in fierce combat with Meteonyker at the moment. Their deaths will be swift. You must wait.,今もなお、メテオニカと激しい戦闘を繰り広げている勇者がいる。彼らの死はきっと早いだろうが、今はただ待つのだ。
NPC_100037,"You defeated Meteonyker? Excellent work, successor!",メテオニカを倒しただって？すばらしい！きみが後継者だ！
NPC_100038,"Welcome! Don't forget to complete quests, they give many #bexperience and rewards#nb! Hope you will enjoy the game!",ようこそ～！クエストは完了したか～い？ #b経験値と報酬#nbがいっぱいもらえるからね！この先、きみがもっともっと楽しめることを願っているよん！
NPC_100039,Who goes there?,そこにいるのはだれだ？
NPC_100040,I am Gigaka! Protector of these lands.,ギガカです！わたしは土地の守護者。
NPC_100041,Watch yourself.,気をつけてください。
NPC_100042,Welcome to Azria!,アズリアへようこそ！
NPC_100043,"Stay safe out there, traveler.",旅人さん、どうかお気をつけて。
NPC_100044,Stay safe.,おげんきで。
NPC_100045,Hm... Yes...,うーん...はい...
NPC_100046,...,...
NPC_100047,May Rhisis be with you.,リシスがあなたと共にありますように。
NPC_100048,You should not be here...,あなたはここにいるべきではありません...
NPC_100049,Volkane is an ancient and once forgotten cavern in the depths of Magmient. The air is filled with volcanic ash and hot gases. This is no place for you.,ヴォルケインはマガミエントの奥深くにある、かつては忘れ去られていた古代の洞窟です。空気は火山灰と高温ガスで満たされています。ここはあなたのための場所ではありません。
NPC_100050,A traveler? In this place? Oh my.,冒険者？この場所で？なんてこった。
NPC_100051,Hm.,うーん。
NPC_100052,This is no place for travelers. You must leave if you value your life.,ここは旅人がくるべきところではありません。命を大事に思うなら帰ってください。
NPC_100053,The name's Buur! I love crystals more than anything. I can't get enough crystals. There is no such thing as too many crystals.,バウアーだよ！クリスタルがすっきなんだあ～。クリスタルをたっくさん集めてきて！クリスタルは多いに越したことはないからね。
NPC_100054,I love crystals but they are so hard to come by. You can only get crystals by defeating a masquerpet here.,クリスタルは好きだけど、なかなか手に入らないんだよね～。この辺りのモンスター倒せばクリスタル手に入るんだけど...。
NPC_100055,You like crystals right? No way! Me too! I honestly can't believe it. We both like crystals!,クリスタル好きでしょ？とんでもない！私も！正直信じられません。私たちは両方ともクリスタルが好きです！
NPC_100056,,
NPC_100057,,
NPC_100058,,
NPC_100059,,
NPC_100060,,
NPC_100061,You are ready to challenge the Red Meteonyker. Are you sure you would like to enter?\n[Yes][IDS_NPC_Yes_Enter] / [No][IDS_NPC_No_Enter]\n\n#cffff0000All the party members participating must be close to you to enter.#nc,レッドメテオニカに挑戦する準備が整いました。入場しますか？\n[はい][IDS_NPC_Yes_Enter] / [いいえ][IDS_NPC_No_Enter]\n\n#cffff0000参加するパーティーメンバー全員があなたの近くにいる必要があります。#nc
NPC_100062,You must go and speak with Kumah to forge the Volkane Key.,ヴォルケインキーを偽造するにはクマ―に話かける必要があります。
NPC_100063,"Hello I am Azria Pang, the oldest of the Pang brothers. We manage the Lodelights.",やあやあ、バフ・ファン兄弟の長男、アズリア・ファンだぞ！ぼくらはロードライトの管理をしているぞ！
NPC_100064,#b#cff8a004fThe #cfff60000Level 80 Guild Siege Application Center #cff8a004fis open!#nc#nb,#b#cff8a004fThe #cfff60000レベル80ギルドシージアプリケーションセンター#cff8a004fis open!#nc#nb
NPC_100065,Good Luck!,ご武運を！
NPC_100066,#b#cff8a004fEnjoy the #cfff60000Level 60 Guild Siege #cff8a004fbefore your second class!#nc#nb,#b#cff8a004fEnjoy the #cfff60000レベル60ギルドシージ#cff8a004fbefore your second class!#nc#nb
NPC_100067,"With global warming, I’m gonna end up living in a freezer..",地球温暖化で、冷凍庫で生活することになります..
NPC_100068,See you soon! At least if I still exist when you come back...,また近いうちにお会いしましょう！せめて君が戻ってきた時、僕が生きていれば…
NPC_100069,It is way too early for you... Come back when you reach the appropriate level!,あなたには時期尚早です...適切なレベルに達したら戻ってきてください!
NPC_100070,Creatures are appearing from the Leren Chasm. We must stop them!,クリーチャーはレレンの淵から現れています。私たちは彼らを止めなければなりません!
NPC_100071,Great strength will be required to survive within the Leren Chasm.,レレンの淵内で生き残るには、大きな力が必要になります。
NPC_100072,This place is far too dangerous.. leave now or you may get hurt.,この場所はあまりにも危険です..今すぐ離れないと怪我をするかもしれません。
NPC_100073,"I am a Flarine guard, assigned my post here to protect passersby from entering the Leren Chasm.",私はフレアリンの警備員で、通行人がレレンの淵に入るのを防ぐためにここに私のポストを割り当てられました。
NPC_100074,Farewell.. may you be safe from the dangers of Leren Chasm!,お別れ。。レレンの淵の危険ですから安全に！
NPC_100075,Will this storm ever end?..,この嵐はいつまでも終わるのでしょうか?..
NPC_100076,You must have an iron will to survive the Rhisis Catacombs.,リシスの地下墓地を生き残るには鉄の意志が必要です。
NPC_100077,"These grounds are electrified.. return from where you can, less you be shocked.",これらの敷地は電化されています。あなたができるところから戻って、あなたがショックを受けることはほとんどありません。
NPC_100078,"I hail from the noble ranks of Saint City's guardians, entrusted with the duty of safeguarding the Rhisis Catacombs from curious adventurers.",私はセントシティの警備員で、無防備な冒険者からリシスの地下墓地を守るために任命されています。
NPC_100079,Goodbye for now.. be safe from the storms!,とりあえずさようなら..嵐から守ってください!
NPC_100080,How long as this palace been hidden within the Cave of Envy?,この宮殿が羨望の洞窟の中に隠されていたのはどれくらいですか?
NPC_100081,Beware the masquerpets touched by waters of the Envy Depths.,エンヴィーデプスの水に触れたモンスターに注意してください。
NPC_100082,Turn around while you still have some life left in you.. these waters are cursed.,あなたがまだあなたの中にいくらかの人生が残っている間に振り返ってください..これらの水は呪われています。
NPC_100083,I am a guard hired by the Mayor of Darken City to ensure the safety of adventurers who wander too close to the Envy Depths.,私はダーコン市長に雇われた警備員で、エンヴィーデプスに近づきすぎた冒険者の安全を確保しています。
NPC_100084,Tell those who are weak to avoid the Envy Depths at all costs!,自信のない人には、エンヴィーデプスから離れるように伝えてください!
NPC_100085,The heart of the Guardiane Sanctuary has been torn asunder!,ガーディアンサンクチュアリの中心部が引き裂かれました!
NPC_100086,Death and decay are all that remain within the Guardiane Sanctuary..,死と腐敗は、ガーディアンサンクチュアリ内に残っているすべてです..
NPC_100087,Escape this place before you are turned into the living dead like those poor souls.,あなたがそれらの貧しい魂のように生きている死者になる前に、この場所を脱出してください。
NPC_100088,I was sent here to guard the entrance of the Guardiane Sanctuary.. hopefully the Purple Magician does not come back.,私はガーディアンサンクチュアリの入り口を守るためにここに送られました..うまくいけば、紫の魔術師は戻ってこない。
NPC_100089,May the heart of Guardiane be one day restored!,いつの日かガーディアンの心が回復しますように!
NPC_100090,Something strange is in the mountain air of Storm Peak..,ストームピークの山の空気に奇妙な何かがあります。
NPC_100091,Within the Storm Peak mountain a great evil is said to lurk.,ストームピーク山の中には大きな悪が潜んでいると言われています。
NPC_100092,Go back home before you get frostbite!,凍傷になる前に家に帰ってください!
NPC_100093,"I've watched over the Storm Peak mountain trails for many years, ensuring the safety of all who venture forth.",私は長い間ストームピーク山に通じる道を守ってきました。
NPC_100094,"One day you will see, that the Frostiae peak ahead holds a dark secret.",いつの日か、前方のフロスティアエピークが暗い秘密を持っていることがわかります。
NPC_100095,Azria Mine,アズリア鉱山
NPC_100096,"I shouldn't say anything, but there are other mines abandoned around Madrigal that contain power even stronger than that within Dekane. One of those mines is hidden in the mountains of Azria.",何も言うべきではないが、マドリガル周辺には他にも放棄された鉱山があり、デカイン内のものよりもさらに強力な力を含んでいる。それらの鉱山の1つはアズリアの山に隠されています。
NPC_100097,"My name is Rankashu, and my ancestors have lived in the mountains of Darkon long before you creatures ever showed up. And no.. I am not one of those stuck up High-Dwarpets.",私の名前はランカシュで、私の祖先はあなたが生き物が現れるずっと前からダーコンの山に住んでいました。そして、いいえ..私は立ち往生しているハイドワーペットの一人ではありません。
NPC_100098,My people are all gone.. I am alone here.,私の人々は皆去りました..私はここに一人です。
NPC_100099,I have lived here for what feels like an eternity collecting materials that may one day save Madrigal.,私はいつの日かマドリガルを救うかもしれない材料を集める永遠のように感じるもののためにここに住んでいました。
NPC_100100,No one should be here.. leave before you are killed.,誰もここにいてはいけません..あなたが殺される前に去ってください。
NPC_100101,"My name is Rankashin.. I have lived here for many years now. Long ago I helped build a powerful weapon, but in the end it was turned against us..",私の名前はランカシンです。私は何年もここに住んでいます。ずっと前に私は強力な武器を作るのを手伝いました、しかし結局それは私たちに背を向けました..。
NPC_100102,May the Clockworks War never be forgotten!,時計じかけの戦争が決して忘れられませんように!
NPC_100103,"Hi I am Kebaras Pang, the strongest of the Pang brothers. We manage the Lodelights.",こんにちは、私はケバラス・パン、パン兄弟の中で最強です。私たちはロードライトを管理します。
NPC_100104,Cursed Symbol,呪われたシンボル
NPC_100105,"I can feel the dark power radiating from your bag.. you have one of the symbols of corruption, don't you? Hand it to me if you don't mind.",私はあなたのバッグから放射される闇の力を感じることができます..。あなたは腐敗の象徴の1つを持っていますね。よろしければお渡しください。
NPC_100106,Give the Symbol,シンボルを与える
NPC_100107,"The past few years have felt like a blur to me. I wrote this letter to an old friend, but I can't remember who..",ここ数年はぼんやりとしているように感じました。この手紙は古い友人に書きましたが、誰だったか思い出せません。
NPC_100108,IDS_Hael_Letter,IDS_Hael_Letter
NPC_100109,"Though Hael has gained back some memories of his past, it saddens me that he has forgotten so much. Thank you for bringing me his letter.",ヘールは過去の記憶を取り戻したが、あまりに多くのことを忘れてしまったのは悲しい。手紙を持ってきてくれてありがとう。
NPC_100110,Give Letter,手紙を贈る
NPC_100111,This letter is fascinating.. apparently Hael began to lose his memory after a series of strange encounters with odd creatures along his travels. And look.. there's a map here.,この手紙は魅力的です..どうやらヘールは、旅の途中で奇妙な生き物と奇妙な出会いをした後、記憶を失い始めたようです。で、ほら。。ここに地図があります。
NPC_100112,You are a rare specimen. Not like other humans I see. Speak with me once more and I will show you a secret..,あなたは稀有な標本です。他の人間とは違う。もう一度私と話してください、そして私はあなたに秘密を教えます..。
NPC_100113,"Wow, you found my favorite trinket! If you had a map, I could show you where something special is hidden..",うわー、あなたは私のお気に入りの装身具を見つけました!地図があれば、何か特別なものが隠されている場所を教えてあげるのに......。
NPC_100114,I love rare trinkets! My favorite trinket drops from a cute one-eyed bat..,珍しい装身具が大好きです!私のお気に入りの装身具は、かわいい片目のコウモリから落ちます..。
NPC_100115,You've been touched by an incredible amount of purple magic. It's good that you found me before you became one of them..,信じられないくらいの紫色の魔法に心を打たれましたね。あなたが彼らの一人になる前に私を見つけてくれて良かったです...
NPC_100116,"It's not too late to save your mind of corruption, but we must act quickly. To cleanse shade's aura from your body I'll need a stone blessed by angels and a powerful elixir that can cure disease.",腐敗から心を救うのに遅すぎることはありませんが、私たちは迅速に行動しなければなりません。シェイドのオーラを体から浄化するには、天使に祝福された石と、病気を治す強力なエリクサーが必要です。
NPC_100117,"Ah! You've brought everything needed to cleanse the evil from your body, just in time, too! In fact, there's enough here to create a second elixir of cleansing.. perhaps it will be useful in your travels.",あら！あなたはあなたの体から悪を浄化するために必要なすべてのものを、ちょうど間に合いました!実際、ここには浄化の第二のエリクサーを作るのに十分です。もしかしたら、旅のお役に立てるかもしれません。
NPC_100118,,
NPC_100119,,
NPC_100120,,
NPC_100121,Who is gonna attend the #bfinals in Manila#nb and win the #bFlyff World Championship 2026#nb? Prove that you are the best!,Who is gonna attend the #bfinals in Manila#nb and win the #bFlyff World Championship 2026#nb? Prove that you are the best!
NPC_100122,"Welcome, competitor! I am Ava, the manager of the Flyff World Championship. I will trade you the best equipment you can get to win the competition!",ようこそ、ライバル!私はフリフワールドチャンピオンシップのマネージャーであるアヴァです。競争に勝つために手に入れることができる最高の機器を交換します!
NPC_100123,"Hm I can feel that you are the best PvE competitor! No, wait... Maybe PvP? Ha I don't know. Good luck!",うーん、あなたは最高のPvE競技者であると感じます!待たないでいいです。。。PvPかな?はぁ、わかんない。がんばって！
NPC_100124,May the best win!,最高の勝利がありますように!
NPC_100125,"I am an automated machine intended to replace and eliminate humans. However, I am also designed to deliver rewards in exchange for coins.",私は人間に取って代わり、抹殺することを意図した自動化された機械です。ただし、コインと引き換えに報酬を配信するように設計されています。
NPC_100126,"We will probably meet again, and I might have more items for you next time!",また会えるかもしれないし、次回はもっとアイテムがあるかも!
NPC_100127,"Hi, I am Private Leo. I got separated from my group after entering this dungeon.",こんにちは、プライベートレオです。このダンジョンに入った後、グループとはぐれてしまいました。
NPC_100128,"Thank you for saving me, I owe you one!",私を救ってくれてありがとう、私はあなたに借りがあります!
NPC_100129,Let's get out of here!,ここから出ましょう！
NPC_400000,Collect some #bW-Token#nb from masquerpets and I will give you nice rewards!,仮面舞踏会から #W-Token#nbを集めれば、素敵な報酬を差し上げます!
NPC_100130,"Upgrade Costume Boxes with Repair Hammer that drops when you hunt a monster, and get various items!",モンスターを狩るとドロップするリペアハンマーでコスチュームボックスをアップグレードして、さまざまなアイテムを手に入れましょう!
NPC_100131,"I'm the guardian of The Wilds, a wild and savage realm. What brings you here?",私は荒野で野蛮な領域である荒野の守護者です。なぜここに来たのですか?
NPC_100132,Always another group thinking they can conquer 'The Wilds.' Let's see who comes out in one piece this time.,常に「荒野」を征服できると思っている別のグループ。今回は誰がワンピースで出てくるか見てみましょう。
NPC_100133,"Stay safe out there. Remember, not all who wander find their way back.",安全にお過ごしください。彷徨うすべての人が帰る道を見つけるわけではないことを忘れないでください。
NPC_100134,"A wise decision, my friend. You're about to embark on a journey that will carve your legend. Brace yourself, for the untamed awaits.",賢明な決断だ、友よ。あなたはあなたの伝説を刻む旅に乗り出そうとしています。気を引き締めて、手つかずのものが待っています。
NPC_100135,"Life's full of choices, and 'The Wilds' isn't for everyone. If you ever hunger for adventure, remember where I stand.",人生は選択肢に満ちており、「ザ・ワイルズ」は万人向けではありません。冒険に飢えているなら、私の立ち位置を思い出してください。
NPC_100136,Interested in having your very own room?,自分だけの部屋を持つことに興味がありますか?
NPC_100137,You now have the opportunity to claim your own space! Invite a few friends or organize exclusive meetings with your guildmates.,これで、自分のスペースを主張する機会があります!何人かの友達を招待したり、ギルドメイトと特別な会議を開催したりできます。
NPC_100138,I specialize in crafting top-notch furniture and other household items to adorn your room. I'm renowned as the finest carpenter around!,私はあなたの部屋を飾る一流の家具やその他の家庭用品を作ることを専門としています。私は最高の大工として有名です!
NPC_100139,Owning a splendid home can rejuvenate and fortify you for battles in Madrigal.,立派な家を所有することで、マドリガルでの戦いに備え、若返り、強化することができます。
NPC_100140,Does your guild aspire to have its own house?,あなたのギルドは自分の家を持つことを熱望していますか?
NPC_100141,"Greetings! If you're interested in acquiring a guild ship, you're in the right place. You'll need a guild with a minimum of 12 members.",よくここまで来ましたね！ギルドハウスに興味があるなら、ギルドに12人以上のメンバーを集め、私にお尋ねください。
NPC_100142,"Hello, my name is Lousiana, and I manage this ship.",こんにちは、私の名前はルイジアナで、この船を管理しています。
NPC_100143,"Look who we have here on the vibrant shores of Coral Island! After all these years, fresh faces like yours bring a spark of excitement to my inventor's heart. With your helping hand, I just might accelerate the pace of my ingenious projects!",コーラル島の活気に満ちた海岸にいる人を見てください!長い年月を経て、あなたのようなフレッシュな顔ぶれは、私の発明家の心に興奮の火花を散らします。あなたの助けを借りれば、私は独創的なプロジェクトのペースを加速させるかもしれません!
NPC_100144,"Hey there! It's a thrill to have you join our little island community! I'm on the brink of something revolutionary, and I need someone as creative and ambitious as you to help me build my next groundbreaking invention. Together, we can shape the destiny of Madrigal!",ねえ！私たちの小さな島のコミュニティに参加していただけるのはスリル満点です!私は何か革命的なことの瀬戸際にいて、あなたのように創造的で野心的な人が、私の次の画期的な発明を作るのを手伝ってくれる人を必要としています。一緒に、マドリガルの運命を形作ることができます!
NPC_100145,"Building complex machinery is like crafting art - it takes time, patience, and vision. If you're intrigued by the world of invention and wish to collaborate in the future, know that I'll be here, ready to embark on electrifying ventures!",複雑な機械を作るのは、工芸品を作るようなもので、時間、忍耐、そしてビジョンが必要です。もしあなたが発明の世界に興味を持ち、将来コラボレーションをしたいと思っているなら、私がここにいて、電撃的なベンチャーに着手する準備ができていることを知ってください!
NPC_100146,"Greetings, I'm Remi! A fervent inventor who can't resist the allure of gadgets and gizmos. Coral Island is my canvas, and I'm constantly conjuring up new marvels and tinkering with the unknown.",こんにちは、レミです!ガジェットやギズモの魅力に抗うことができない熱烈な発明家。珊瑚島は私のキャンバスであり、私は常に新しい驚異を呼び起こし、未知のものをいじくり回しています。
NPC_100147,"As you set forth on your adventures across this bewitching island, remember it's a realm of both beauty and peril. Be cautious, intrepid traveler, for the world of invention may be exhilarating, but Madrigal can be equally treacherous!",この妖艶な島を冒険する旅に出るときは、この島が美しさと危険の両方に満ちた領域であることを忘れないでください。勇敢な旅人よ、用心深く、発明の世界は爽快かもしれないが、マドリガルも同様に危険だ!
