Key,English,Japanese
NPC_WHOAREYOU,Who are you?,紹介
NPC_GOODBYE,Goodbye!,さようなら
NPC_CARGO,CARGO,CARGO
NPC_WHATSGOINGON,What's going on?,近況
NPC_EXIT,Exit,出る方法
NPC_HOWTOFLY,How to Fly,飛行操縦
NPC_COMBATFLYING,Combat Flying,飛行戦闘
NPC_IDCARD,ID CARD,IDCARD
NPC_WHATABOUTTHEMINE,What about the mine?,デェカネス
NPC_MOVE,Move,移動
NPC_FORHONOR,For Honor!,モンスターに挑戦！
NPC_FORFUN,For Fun!,見てるだけです
NPC_MEHJUSTBECAUSE,"Meh, just because?",やっぱり帰ります
NPC_YES_ENTER,Yes_Enter,はい_入場
NPC_NO_ENTER,No_Enter,いいえ_入場
NPC_WHEREAMI,Where am I?,場所
NPC_MAKEANAPPOINTMENT,Make an appointment,復活場所の設定？
NPC_FINALIZESTATSELECTION,Finalize Stat selection,ステータス初期化
NPC_DEKANEMINE,Dekane Mine,デェカネス鉱山
NPC_CELL,Cell,セル
NPC_AZRIAMINE,Azria Mine,アズリア鉱山
NPC_CURSEDSYMBOL,Cursed Symbol,呪われたシンボル
NPC_GIVESYMBOL,Give the Symbol,シンボルを与える
NPC_HAELLETTER,Hael's Letter,ハエルの手紙
NPC_GIVELETTER,Give Letter,手紙を贈る
NPC_TREASURE_BOX,Treasure,宝
NPC_LOSTMEMORIES,Lost Memories,失われた記憶
NPC_BREWINGPOTIONS,Brewing Potions,醸造ポーション
NPC_THECURE,The Cure,ザ・キュアー
NPC_GUIDETOFLYING,Guide to Flying,飛行操縦ガイド
NPC_GUIDETOCOMBATFLYING,Guide to Combat Flying,飛行戦闘ガイド
NPC_SHOPS,Shops?,購入
NPC_DEATH,Death?,死
NPC_RECEIVEADDITIONALREWARDS,Receive additional rewards,追加の報酬を受け取る
NPC_000044,"Welcome to Keakoon, human! I've got a favor to ask... C'mere!",クックックッ、心優しき人間の方よ、俺の頼みを聞いてくれっ！
NPC_000045,Fathers Package,お父さんの荷物
NPC_000046,"Hrrmph! How strange... How did a human like you manage to get in here, anyway?",クックックッ、お前たち人間がこんなところまでやって来るなんて、珍しいじゃないか！
NPC_000047,"Thank you for saving my father, human. So what brings you here?",親父を助けてくれてありがとな。ところで何の用だ？
NPC_000048,"Please, save my father. He's imprisoned east of here! Hurry!",親父のいる監獄は、一番右に位置するキクン町にあるぞ。おい、早く助けてくれよ！
NPC_000049,"Hrrmph, listen... I don't know how you found this place, and I don't care. Leave now! This place is too dangerous for your kind.",クックックッ、お前たち人間がどうやってここまでやって来たかは知らないが、お前らの来るところではないぞ。危ないからさっさと行け！
NPC_000050,"Hrrmph! I am Drian - Son of Nevil, the Patriarch of Keakoon. You people look down on us, but you're the inferior ones!",クックックッ、俺はキクン族の酋長ネビルの息子ドリアンだっ！人間どもは俺を馬鹿にしてるが、俺たちにとっては人間の方が低能に見えるぜ！
NPC_000051,"This place is too dangerous for the likes of you, silly human. Go home!",クックックッ、とにかくここは危ないから、早く帰れ！
NPC_000052,Here is the package my father left me... Hrrmph!,親父に頼まれた荷物なら、ここにあるぜ、クックックッ。
NPC_000053,*Sigh* this might take a while...,あぁ～ なかなか纏まらないなぁ～
NPC_000054,"What? A human?! Here?!? Muahahahah!!! You're either brave or not all there in the head, buddy.",おっ? お前、人間だな。度胸のいいやつだな～。
NPC_000055,"Ewww!! A hew-mann... Your kind is not welcome here. Get out of my sight, vermin!",ちぇっ! 人間のくせに生意気な奴！早く消え去らないと、ドワーフ拳法お見舞いしてやるぞ！
NPC_000056,Who am I? Hah! Liked I'd consort with the likes of a human. Get lost!,残念だが、人間どもに自己紹介する気はないさ。
NPC_000057,"Beat it, human! You're not welcome here!",そうさ、帰った方がいいぞ。ここはお前ら人間がむやみに来るところじゃないからな。
NPC_000058,*Whistles*,...
NPC_000059,"Gwarrll! You just gonna stand there, or are you gonna get me out of here? You know, people don't necessarily like to be stared at...",........
NPC_000060,"Garr!! I've not seen a human in years! I am Nevil, the honorable Patriarch of Keakoon.",カッカッカッ、おっ、人間に会うなんて久しぶりだな！ 私はキクン族の酋長ネビルだっ！
NPC_000061,"*Snort!* A human, eh? Very interesting... I haven't seen one of you weirdos in years! See ya later!",カッカッカッ、人間に会うなんて久しぶりだが、また今度な！
NPC_000062,Feel free to come see me whenever you are in need of magical goods.,魔法アイテムが必要でしたら、私にお尋ねください。
NPC_000063,Nice to meet you. Have you also come to research the magical fields surrounding the islands?,この島にいらしたということは、私と同じく魔法磁気の研究に関心を持ってるのですか？お会いできて嬉しいです。
NPC_000064,My name is Ciel and I am doing research on the various magical phenomena in the area.,私はシエルと申します。この地域で魔法に絡んだ異常現象が起きているそうなので、研究しにやって来ました。
NPC_000065,Farewell!,みなさんがんばってください～！
NPC_000066,Come to me if you seek absolution.,罪を悔い改め、許しを請う者よ、こちらへ。
NPC_000067,Are you here for confession?,私に懺悔しに来たのか?
NPC_000068,Your aura shines brightly. May it never again lose its brilliance.,君は表情が明るいね。これからは明るい人生を送りなさい。
NPC_000069,I am a shepherd who helps sinners find their way back to the path of righteousness. Come to me if you wish to be cleansed.,私はあなたのような罪を犯した者を救う牧師ヘロンだ。犯した罪を悔い改め、許しを請うのなら、私に話してみなさい。
NPC_000070,Get the key from one of the criminal Masquerpets. Once you get the key you can enter the Warp Zone in the mountains.,ここから出るには、アズライアの山頂にあるワープゾーンを利用しなさい。このワープゾーンに出入りするには、鍵が必要だが、その鍵は罪深きあるモンスターが持っていることでしょう。
NPC_000071,"Good luck to you, stranger. Try not to get caught again, okay?",さようなら、もう罪は犯さないように。
NPC_000072,"You will not survive here without a shield, friend.",こんな過酷な場所にそんな無防備で！お前さん大変だったろうよ！
NPC_000073,Huh? Do you want something from me? Then speak up!,何？ 俺と話をしようってか？
NPC_000074,"My name is Rocbin and I came here for a number of reasons, none of which I would like to discuss with you at this time. Now shoo!",俺の名前はロックビン。ここに来たってことは、お前さん訳ありだな？俺だってお前さんに負けないくらいいろいろあるけど、もちろん今は話せないぜ。
NPC_000075,Take care! ,じゃあな、気をつけろよ。
NPC_000076,Looking to work on your terrible equipment? Allow me to assist you!,武器が必要な時は俺に任せろよな！
NPC_000077,Hahaha! You look like the rest of those felons. What brings you here?,お前さん何者だ？ 俺に何か用か？
NPC_000078,"Greetings, adventurer! I am Shun, your friendly neighborhood arms dealer. I don't care who you are, a customer is a customer. Come right over and buy my gear!",ハハハ。俺は正義の武器商人シュン。相手を選んで商売するような奴は嫌いだぜ！お前さん好きなの選んでみな。
NPC_000079,Hehehe! Alright I hope we can hang out together someday.,フフッ、そうか、まあ近いうちに一杯やろうぜ。
NPC_000080,I sell supplies to the weary adventurer. I've got everything you need!,フード、ドリンク、ポスターなどを売ってます。
NPC_000081,You look like you have something to tell me...,何かお困りですか？
NPC_000082,My name is Yuna. I believe you will find my food and medicine reasonably priced.,私はケラバスでフードやドリンクなどを売っているユナです。これから仲良くしましょ。
NPC_000083,"Come one, come all! Visit Achaben's General Shop for your adventuring needs! *cough*",いらっしゃいませ！様々な商品を扱ってますよ！･･･ゴホっ！ゴホっ！
NPC_000084,May I help you?,何をしてくれるんですか？
NPC_000085,"*Cough* I am happy to have a *wheeez* customer! If you need it, we have it... *cough* *huck* You wouldn't happen to have some cough medicine, would you?",ゴホっ！ゴホっ！お客様が喜ぶ顔を見るのが私の何よりの生きがいです。ゴホっ！ゴフっ！
NPC_000086,"*Ha-CHEW!* Sorry about that, allow me to clear my throat. *AHEM* My name is Achaben, and I run the General Shop here in Darken City. *cough*",私はダーコンで雑貨ショップを営んでいる＜アチャベン・コマネド＞と言います。
NPC_000087,Thank you for your patronage! Come back and visit sometime! Bring some cough medicine!,また是非お越しください！
NPC_000088,#b#cff0001ffFlying Information#nc#nb is available here! I also have #b#cffff0000flying boards and brooms#nc#nb in stock!,#b#cff0000ff飛行に関する情報#nc#nbを提供している。アルマーニのステーションだ。
NPC_000089,What do you want to do?,何を知りたい？
NPC_000090,"Flying through the clouds high above Madrigal is my favorite dream come true. I would be flying right now, but I'm having some family trouble and I need to pay the bills!",空は無限の憧れを駆り立てるものだ。･･･家が没落してさえいなければ、私も今頃あの空を飛び回っていただろう。運命とははかないものだな･･･。
NPC_000091,"My name is Almani, and I run the Station here in Darken city. I sell flying boards and brooms in addition to teaching the basics of flying.",私はかつての名門貴族＜エムブリア一族＞の末裔で、名は＜アルマーニ・ゾルジーオ・バン・ビオテ・エムブリア＞と申すもの。
NPC_000092,"1. First, you'll need to buy a broom or a board and be at least level 20 in order to fly. \n 2. Next, double-click the board or broom in your inventory or simply move it to a hot key to climb aboard.",1. 飛行が出来る ＜ホウキ＞ や ＜ボード＞ はステーションから購入ができる。\n 2. インベントリウィンドウから ＜ボード＞ や ＜ホウキ＞ のアイテムをダブルクリックするか、右下にある装備位置にドラックすると乗れるぞ。レベルが20以上に限られるがな。
NPC_000093,3. Press the Space Bar to accelerate your flying vehicle. Press the Space Bar key again while moving to stop. Think of the accelerator like a toggle button for *Go* and *Stop*.,3. スペースバーを押すと、加速を始めます。停止したいときはもう1度スペースを押してくださいね。
NPC_000094,"4. To navigate, you can simply hold the Right Mouse Button down and angle the camera in the direction that you want to go.\n Alternatively, you can also use the W, A, S and D controls to turn.",4. マウスの右ボタンをクリックしたまま動かすと、方向を変えることができるの。\n マウスの代わりにキーボードの「W」、「S」、「A」、「D」キーでも同様の操作が可能よ。
NPC_000095,"5. Additionally, you can simply tap the Right Mouse Button twice to lock the camera to the mouse pointer. This allows you to navigate without holding down the right mouse button. Clicking twice again will turn off this effect.",5. Tipをさらに1つ。マウス右ボタンをダブルクリックすると、マウス右ボタンをクリックしなくても、マウスを動かすだけで方向を変えることができるようになるのよ。
NPC_000096,6. Anyone can fly in Madrigal. You simply have to acquire a flying vehicle!\n 7. There are numerous makes and models of flying vehicles. Trying shopping around in player shops or click the Use Premium Item Shop icon next to the Start Button.,6. 乗り物は、職業に制限されないから、好きなものを使ってね。\n7. 乗り物にはたくさんの種類あるの。個人商店で買ったり、プレミアムアイテムにも売っているよ。
NPC_000097,"I hope the information I gave you was helpful. You're on your own now, aviator! See you in the clouds!",以上、基本的な飛行ガイドでした。後は君の腕次第ね。空の旅を楽しんでね。
NPC_000098,"1. Occasionally, you will run into some pesky masquerpets while flying. You will see a red box surrounding them.",1. 空を飛んでいると、空中でもモンスターに出くわすことがあるの。たまに怒って攻撃されるかもしれないから、くれぐれも気を付けることね。
NPC_000099,"2. You can target these creatures with the Left Mouse Button. If you lose sight of them while flying, a green arrow appears on the edge of the screen to indicate which direction you need to turn. ",2. ターゲットする対象をクリックすると狙うことができるわ。もし飛行中に相手を見失っても、画面の端に緑色の矢印が表示されて、行くべき方向が示されるはずよ。
NPC_000100,"3. To attack the creature, simply get as close as you can and press the Left Mouse Button or the Insert Key.\n 4. If you want to follow the monster automatically, press the Z Key.",3. ターゲッティングしたモンスターに近づき、マウス左ボタンをクリックすると攻撃ができるわ。\n 4. モンスターをターゲットしている状態でZキーを押すと、目標を自動的に追いかけることができるわよ。
NPC_000101,5. Magicians and Acrobats can shoot from range while in the air. Mercenaries and Assists must rely on melee attacks. You can also use your skills!,5. Magicians and Acrobats can shoot from range while in the air. Mercenaries and Assists must rely on melee attacks. You can also use your skills!
NPC_000102,"6. When you destroy a flying masquerpet, any dropped loot will be placed into your inventory automatically. If there is no room in your inventory, the loot is lost, so be careful!",6. 飛行中のモンスターを倒した時は、ドロップしたアイテムが自動でインベントリに入るから安心してね。でも、もしインベントリに空きがなかったら消えてしまうからそこは要注意よ！
NPC_000103,"7. That about covers it for your flying combat training, cadet! Just one more thing... Don't crash and burn! Hahaha, just a little pilot humor.",7. これであなたはもう一人前ね！そうそう、最後に1つだけ。きれいなお姉さんを見つけたからって、よそ見運転なんか絶対やめてね？事故起こされたらたまったもんじゃないわ。えへへ、冗談よ。
NPC_000104,Have fun out there and be safe! Don't forget to check your six!,カッコ良く飛び回りながら、スリル溢れる空中戦を楽しんでくださいね！
NPC_000105,"Goodbye, adventurer! Feel free to stop by again if you have any questions about flying.",また会いましょうね！寂しいときにはどうか広い空を見上げてみてね！きっと元気が出えるはずだから。頑張って！
NPC_000106,The Red Bang Troupe will never break through our defenses as long as I'm here!,私がここを守る限り、虫一匹もここに攻め込むことは出来ないぞ！
NPC_000107,"Hello, traveler. I have some missions for you!",元気ですか？旅人さん。ミッションを用意しておきますね。
NPC_000108,"Greetings, traveler! You are welcome to visit the Erons Factory as long as I, Amadolka, am here. It can get pretty dangerous out here so watch your back!",ここは大変危険な場所だ。心配なら帰ったほうがいい。だが、この＜アマドルカー＞がここを守っているうちは、安全は約束しよう。ハハッ。
NPC_000109,My name is Amadolka Liviehindekinas. I am in charge of security here at the Erons Factory. Why do you ask?,私はこの巨大なエランス工場地帯、エランパークス地域の警備をしている警備長、＜アマドルカー・リビデラス＞という者だ。
NPC_000110,"Be careful out there, traveler! I'll stand guard here!",ここは私が守るから安全だ。しかし、くれぐれも危険なところには行かないでくれ。
NPC_000111,I'm such a coward! *Cries*,俺はただの臆病者なんだ…。
NPC_000112,The curse has been removed for the 3rd time now. Please don't get cursed again or it will be the last time for sure.,俺に話しかけるんじゃない！君にも呪いがふりかかるかもしれないからな。
NPC_000113,I'm the Mysterious Teller of Tales! Wanna hear something spooky?,過去に呪いから逃れた犯罪者の名前？そんなこと知って、そうするんだ？
NPC_000114,Stop by anytime you wanna hear a spooky story!,うん、それがいいでしょうね。
NPC_000115,ID Card,通行証
NPC_000116,Hello there! How are you today!,おい、おい、どうしたってんだ？
NPC_000117,"Uhh, yes? If you've got something to say, say it. Otherwise leave me alone. I'm very busy securing these steel panels by tapping my foot repeatedly.",ん？俺に聞きたいことがあるって？　まあ、役に立てるかどうかは分からんがな。
NPC_000118,That's none of your business and I'll thank you to stay out of my personal affairs.,俺が元気かって？　ありがとうな。　まあ、心配ご無用だぜ！
NPC_000119,"Alright, hope to see you soon!",そうか、またいつか会えるといいな。
NPC_000120,"Oh! You're asking about the ID Card that grants access to the Trillipy room in the mines, right? You should find Andre. I heard he spends most of his time in a forest filled with many ancient trees.",えっ？ トリルピゾーンへ行ける通行証のことか？　それなら古代の木の森に住んでいるアンドレっていう奴に聞いてみな。
NPC_000121,"Hail and well met, adventurers! My name is Bolpor and I'm the best chef in town!",食べ物ならここにあるぜ！
NPC_000122,What do you want already?! I've got things to do!,なんだ？
NPC_000123,"I'm the best chef in town, you got that? Anyone that tells you different is more than welcome to discuss it with my butcher knife. There will be more than just *chicken* on a stick on my menu...",見ればわかるだろう？ふんっ！まさかフードショップを知らんわけではあるまい！
NPC_000124,"My name is Bolpor Centaurn, the best darn chef in Darken. I'm also the best looking. I didn't get this handsome overnight, you know.",何だ？ふんっ！名前くらいは教えてやるさ。俺の名は＜ボルバー＞。見てのとおり＜フードショップ＞の店員だ。分かったら、さっさと買い物だけして帰りな！
NPC_000125,"See ya later, alligator! Mmm, alligator... that gives me an idea for a new dish!",気をつけてな！
NPC_000126,"Only the bravest adventurer can hope to succeed on the path of the Knight Hero, Billaon. Are you worthy?",ナイト英雄＜鉄壁の豪腕＞ビレリアンの志を継ぐ者よ、英雄の道を歩む準備は出来ていますか？
NPC_000127,We must never forget the sacrifice of the Heroes. We are here to train those who wish to follow their path in hopes of a worthy successor.,たとえ彼らの名が忘れられても、彼らの志は生き続けるでしょう･･･。
NPC_000128,"I am Guardian Boneper. I'm here to protect the will of Billaon, the Knight Hero, at all costs. We are seeking those who are worthy enough to follow the path of the Knight Hero.",私はナイトの英雄 ＜鉄壁の豪腕＞ビレリアンの志を守護するナイトの守護者＜ファンベーラ＞といいます。
NPC_000129,"May the courage of Billaon be with you, adventurer.",＜ビレリアン＞の志を継ぐ者、彼の力と勇気が共にりますように…。
NPC_000130,We are here to protect the will of the Heroes. Are you worthy to become a successor of the Billposter Hero?,ビルポスターの英雄 ＜鋼の拳＞ロエンテールの志を継ぐ者よ、英雄の道を歩む準備は出来ていますか？
NPC_000131,"I fear that those who follow Shade, Iblis and Bubble too closely will be destroyed by them in the end. Follow the path of the Heroes and you will not lose your way.",従うもの、屈する者、彼らは滅びの道を歩む。抗うものだけが生き残るでしょう･･･。
NPC_000132,"My name is Guardian Capafe. I am here as a guide and I protect the will of Roentel, the Billposter Hero.",ビルポスターの英雄 ＜鋼の拳＞ロエンテールの志を守護するビルポスターの守護者＜カペーペ＞です。
NPC_000133,The power of Roentel will protect and guide you.,＜ロエンテール＞の活力と勇気が共にありますように･･･。
NPC_000134,Rare metals and minerals reside deep within the Dekane Mine.,鉱山に行くと、石もあるし、金属もあるからな。
NPC_000135,You looking for some adventure? Why not discover the mystery of the curse of Darkon? ,ひょっとしてお前さん危険を楽しんでるのか？　だったら隠された「ダーコンの呪い」を解明してみな！
NPC_000136,"Now's not the time for pleasantries, my simple-minded friend. Besides, I know you don't actually care. No one does...",元気かって？　俺に興味があるなんて、こりゃ驚いたな！　で、用件は何だ？
NPC_000137,"Fine, leave if you want to! I don't need your help, fool! ",行くんなら行くがいいさ。　どうせ俺のことを気にしてくれる奴なんていないからな。
NPC_000138,"Have you ever heard the name Neverant? Few know it now, but long ago it was the top-ranking mining guild in Darkon. I used to be a member of that guild.",お前さんネバーランドっていう名前を聞いたことあるか？　今は存在してないが、昔はネバーランドといえば、大陸最強の鉱山ギルドだったぞ。俺もある時、ネバーランド鉱山管理員の一人だったんだ。
NPC_000139,"Today, the Neverant Guild is no more. It's hierarchy was torn apart by a terrible curse that emanated from the mine itself. Ironic, isn't it?",ネバーランドはもうなくなったんだよ、呪われたデェカネスに陥没されたネバーランドは、かわいそうにな。
NPC_000140,Check out the Dekane Mine west of here if you want. I won't step foot near there.,かわいそうなネバーランドの魂を慰めるため、デェカネスを捜しているんなら、ダーコンの鉱山地帯へ行ってみな！
NPC_000141,Chenbing's Shield Shop is open for business! The best finely-crafted nomad shields Penya can buy!,さすらいの商人＜シェンビン＞の最上級の防具はいかがですか？
NPC_000142,"Well, what are you gonna do for me? Hmmm?",何を手伝ってくれますか？
NPC_000143,"We, the Khan Union, are traveling merchants. Our fine craftsmanship is well-known throughout Madrigal. So whaddya say? Interested in taking a peek at my inventory? ",さすらいの商人集団、ムー商隊はマドリガル中をさすらいながら、最上級の品物を販売することで有名です。
NPC_000144,"I am Chenbing Khan and I sell the best, finely-crafted, and affordable shields you'll find anywhere in Madrigal.",オイラはこの＜ムーの谷＞で防具を販売している＜シェンビン＞です。え？みんな同じ顔をしているって？よく見てくださいよ。オイラは商隊で2番目か3番目にハンサムな顔をしているでしょう。へへへっ。
NPC_000145,Take care! Tell your friends about us!,一流の商品でおもてなしをいたします。是非またいらしてください。
NPC_000146,"So, have you completed that which you needed to in order to proceed?",目標を成し遂げたようだな･･･。では試練に赴くか？
NPC_000147,What do you want?,汝は何を求めているか･･･？
NPC_000148,You couldn't possibly hope to understand what lies beyond this gate. I don't care how much research you've done. ,恐怖に目を閉じてはならぬ、恐怖は逃げるものを追いかけるだろう。しかと目を見開き、恐怖と向かい合うがいい。
NPC_000149,Don't concern yourself with such things. Who I am is of no consequence to you. All you need to know is that I am here to protect this gate.,我はこの場所を見守るために存在する。それが我の存在理由の全て･･･。
NPC_000150,"Farewell, strange one.",汝の探求が成就せんことを･･･。
NPC_000151,"Hey, you there! Help me! Let me out of here right now! Argh!!!",おーい！おーい！誰か、誰かいないですか～！助けてくださ～い！　
NPC_000152,"Oh thank Rhisis, I knew someone would come! Oh thank you, thank you, thank you! Well, what are you doing just standing around? Let me out, darn it!!",ああよかった、そこの冒険者さん！私をここから連れ出してください！命からがら逃げてきたら、こんな場所に…
