Key,English,Japanese
NPC_000432,New year has come!,今年もよろしく～～！
NPC_000433,How strange I do not remember the Happy New Year song.,キャ！どこまで歌ったか忘れちゃった～。ヤダ～
NPC_000434,New year has come!,今年もよろしく～～！
NPC_000435,"How strange, I do not remember the Happy New Year song.",あの・・・・・・　　その詩なんだっけ？？
NPC_000436,"Trust in Aenn, and your path shall be lit with the light of a thousand candles.",時がどれほど移り変わろうと、英雄の偉業は色あせぬ。
NPC_000437,"The Heroes sacrificed themselves to defeat Shade, but she will one day return. We must prepare.",8つの運命の光は約束の地に集う。最後の日はすぐそこまで来ておる。
NPC_000438,"My name is Clamb Cobonet, the Ringmaster Wise Man. I am here to preserve the legacy of Aenn, the Ringmaster Hero and to light the path for those that wish to follow in Aenn's footsteps. Have faith, young one, Aenn watches over you.",ワシは八賢者の一人、＜クラムボ・コボネト＞じゃ。リングマスターの英雄＜神の声を聞く者＞エーエンヌの生涯を記録に残しておる。
NPC_000439,"Follow the path of Aenn, and you will never be forgotten.",誰のために生きる？友のため、愛のため、己のため……。
NPC_000440,Bubble watches over all aspiring heroes. ,誰も運命からは逃れられぬ。
NPC_000441,The shields of the Heroes have defended Madrigal from the wrath of Shade. We are forever grateful for their bravery and wish to preserve their memory for all time.,英雄達は別々の道を歩んだ。じゃが、その終着点は同じじゃった。
NPC_000442,"My name is Cuarine Coexar and I am the Psykeeper Wise Man. I preserve the history of the Heroes and provide guidance for those wishing to follow the path Offerep, the Psykeeper Hero.",ワシは八賢者の一人、＜クリサリス・コエクサー＞じゃ。サイキーパーの英雄＜閉じられし瞳＞オルファーの生涯を記録に残しておる。
NPC_000443,"Follow the path of the Heroes, and you will never lose your way.",心を鍛えよ。運命に立ち向かう強い心を持つのじゃぞ。
NPC_000444,A strange energy emanates from this fountain. What is it?,苦難という名の滝を越え、その先にある光を求めるか？
NPC_000445,"We lie in wait, preparing for the worst, and hoping for a future to come when the heroes will arise once more.",聖域で覚醒し、ついには世界を背負し者、それが英雄じゃ。
NPC_000446,"My name is Cuzrill Rembright and I am the Elementor Wise Man. I preserve the history of the Heroes and provide guidance for those wishing to follow the path Lillip, the Elementor Hero.",ワシは八賢者の一人、＜カズリル・ラムブライト＞じゃ。エレメンターの英雄＜異世界の理を識る者＞リルリップの生涯を記録に残しておる。
NPC_000447,"Trust in the legacy of the Heroes, adventurer. For it is all that can save us now.",空や大地にも心がある。世界と心通わせよ。
NPC_000448,Welcome to #b#cff0000ffDior Station#nc#nb! You can find #b#cffff0000flying information#nc#nb here.,飛行に対する情報を提供しているディオールのステーションです。
NPC_000449,"Please, if you can help me, I will be in your debt.",ぜひ助けてください！
NPC_000450,My family has managed the Flarine Station for generations. I am proud to continue that tradition. ,私の一族は代々このステーションを管理しています。私も一族の名に恥じないよう立派に役目を果たしたいです。
NPC_000451,"My name is Dior Christin. I've lived in Flarine all my life and I love this place. Look at me, I can't stop bouncing! Anyway, I manage the station here so let me know if you have any questions! ",フラリスが誇る最高のステーションを管理している＜ディオール・クリスティン＞といいます。ずっとフラリスに住んでいて、ここが本当に好き。何か質問があったら言ってね！
NPC_000452,"1. First, you'll need to buy a broom or a board and be at least level 20 in order to fly\n 2. Next, double-click the board or broom in your inventory or simply move it to a hot key to climb aboard.",1. 飛行ができる＜ホウキ＞や＜ボード＞をステーションから購入できます。\n 2.インベントリウィンドウから、＜ホウキ＞や＜ボード＞のアイコンを装備欄にドラックするか、ダブルクリックすることで乗ることができますよ。
NPC_000453,3. Press the Space Bar to accelerate your flying vehicle. Press the Space Bar key again while moving to stop. Think of the accelerator like a toggle button for *Go* and *Stop*.,3. スペースバーを押すと、加速を始めます。停止したいときはもう1度スペースを押してくださいね。
NPC_000454,"4. To navigate, you can simply hold the Right Mouse Button down and angle the camera in the direction that you want to go.\n Alternatively, you can also use the W, A, S and D controls to turn.",4. マウスの右ボタンをクリックしたまま動かすと、方向を変えることができるの。\n マウスの代わりにキーボードの「W」、「S」、「A」、「D」キーでも同様の操作が可能よ。
NPC_000455,"5. Additionally, you can simply tap the Right Mouse Button twice to lock the camera to the mouse pointer. This allows you to navigate without holding down the right mouse button. Clicking twice again will turn off this effect.",5. Tipをさらに1つ。マウス右ボタンをダブルクリックすると、マウス右ボタンをクリックしなくても、マウスを動かすだけで方向を変えることができるようになるのよ。
NPC_000456,6. Anyone can fly in Madrigal. You simply have to acquire a flying vehicle!\n 7. There are numerous makes and models of flying vehicles. Trying shopping around in player shops or click the Use Premium Item Shop icon next to the Start Button.,6. 乗り物は、職業に制限されないから、好きなものを使ってね。\n7. 乗り物にはたくさんの種類あるの。個人商店で買ったり、プレミアムアイテムにも売っているよ。
NPC_000457,"I hope the information I gave you was helpful. You're on your own now, aviator! See you in the clouds!",以上、基本的な飛行ガイドでした。後は君の腕次第ね。空の旅を楽しんでね。
NPC_000458,"1. Occasionally, you will run into some pesky masquerpets while flying. You will see a red box surrounding them.",1. 空を飛んでいると、空中でもモンスターに出くわすことがあるの。たまに怒って攻撃されるかもしれないから、くれぐれも気を付けることね。
NPC_000459,"2. You can target these creatures with the Left Mouse Button. If you lose sight of them while flying, a green arrow appears on the edge of the screen to indicate which direction you need to turn. ",2. ターゲットする対象をクリックすると狙うことができるわ。もし飛行中に相手を見失っても、画面の端に緑色の矢印が表示されて、行くべき方向が示されるはずよ。
NPC_000460,"3. To attack the creature, simply get as close as you can and press the Left Mouse Button or the Insert Key.\n 4. If you want to follow the monster automatically, press the Z Key.",3. ターゲッティングしたモンスターに近づき、マウス左ボタンをクリックすると攻撃ができるわ。\n 4. モンスターをターゲットしている状態でZキーを押すと、目標を自動的に追いかけることができるわよ。
NPC_000461,5. Magicians and Acrobats can shoot from range while in the air. Mercenaries and Assists must rely on melee attacks. You can also use your skills!,5. マジシャンとアクロバットは空中にいる間、遠距離攻撃ができるわ。マーシナリーとアシストは近接攻撃になるわ。スキルも使えるのよ！
NPC_000462,"6. When you destroy a flying masquerpet, any dropped loot will be placed into your inventory automatically. If there is no room in your inventory, the loot is lost, so be careful!",6. 飛行中のモンスターを倒した時は、ドロップしたアイテムが自動でインベントリに入るから安心してね。でも、もしインベントリに空きがなかったら消えてしまうからそこは要注意よ！
NPC_000463,"7. That about covers it for your flying combat training, cadet! Just one more thing... Don't crash and burn! Hahaha, just a little pilot humor.",7. これであなたはもう一人前ね！そうそう、最後に1つだけ。きれいなお姉さんを見つけたからって、よそ見運転なんか絶対やめてね？事故起こされたらたまったもんじゃないわ。えへへ、冗談よ。
NPC_000464,Have fun out there and be safe! Don't forget to check your six!,カッコ良く飛び回りながら、スリル溢れる空中戦を楽しんでくださいね！
NPC_000465,"Goodbye, adventurer! Feel free to stop by again if you have any questions about flying.",また会いましょうね！寂しいときにはどうか広い空を見上げてみてね！きっと元気が出えるはずだから。頑張って！
NPC_000466,Why do we all have to wear the same outfit? ,世界を放浪する者よ。おぬしを導こう。
NPC_000467,"Rhisis created the three Clown Gods; Shade, Iblis and Bubble and bestowed each of them with a different aspect of herself. Shade, infused with the Fear and Rage of Rhisis, nearly destroy our original home, Roika.",かつて神々に反逆した者達がおった。彼らの遊戯によって、全ての命は一つ、また一つと消えてゆくじゃろう。
NPC_000468,"I am Domek Ilujian, the Billposter Wise Man. I am here to record the history of the Billposter Hero, Roentel, and educate travelers on Madrigal's rich history.",ワシは八賢者の一人、＜ンドゥーク・イルジアン＞じゃ。ビルポスターの英雄＜鋼の拳＞ロエンテールの生涯を記録に残しておる。
NPC_000469,"Farewell, traveler. If we do not learn from our past, we are doomed to repeat it.",拳に刻め。おぬしの魂を。
NPC_000470,#b#cff8a004fCheck in here to review the weekly results of the #cfffc0000Guild Siege!#nc#nb,#b#cff0000ffギルドコンバットの対戦結果を知りたいの！？案内するからちょ～っと待ってね！#nc#nb
NPC_000471,Only the most cunning of guilds can hope to achieve victory in the Guild Sieges. Are you ready for the challenge?,キミの勇気と知恵が、きっとギルドを勝利に導いてくれるよっ！
NPC_000472,"Hello, it's very nice to meet you! I am the Rewards Manager for the Guild Siege Center. I can reward prize money, return application fees, or even show you this week's ranking for the Guild Siege.",ボク？ボクはGCC所属員の報酬マネージャーとして、賞金の支払いや、申請金の払戻しとか、ランキングなんかを管理しているんだよっ！　
NPC_000473,Good luck to you! I hope I see you on the ranking charts!,ギルドコンバットに参加するみんなに勝利の女神が微笑みますように！
NPC_000474,"Madrigal's ecosystem is truly fascinating! The more you discover, the greater the mystery!",多分、私は3人目だと思う･･･。
NPC_000475,"Researching Madrigal's vast ecosystem, particularly that of the Masquerpets, is very rewarding. I get to work outdoors, and examine all of the strange creatures created by the Clown Goddess of Fear and Rage, Shade.",クロックワークス･･･太古の昔に誕生した異形の魔物、今日存在するどの魔物の進化パターンにも当てはまりません･･･。謎は深まるばかりですよ。
NPC_000476,"My name is Dr. Estly and I am studying Madrigal's Ecosystem with my 2 brothers. Have you ever heard of Clockworks? He is the most amazing creature I have ever had the chance to study! Very, very dangerous, though.",私は＜Dr.エストリー＞といいます。2人の兄と共にマドリガルの生態系に対し、研究しています。
NPC_000477,"Thanks for stopping by, friend. Let me know if you ever need any information on a specific creature.",心を閉ざしていてはモンスターも心を開きませんよ･･･。
NPC_000478,"Assists are way better than Mercenaries! Quiet Mustang! *chuckles* Hey you, c'mere if you want to learn about Assists!",アシストは奉仕の精神が必要だが、まずは自分自身をしっかりと助けたまえ。助ける自分が倒れては、誰ひとり助けることができないぞ。
NPC_000479,"What is that crazy Mustang babbling about now... Ah, no matter. Every party needs an Assist. Any schmuck can wack a monster in the head, but we can do that AND play a support role! Do you like popularity? Than this is the job for you!",私はアシストになるために苦しい試練を乗り越えてきた。アシストを目指す諸君も、かの道を歩んでいかねばならない。頑張ってくれたまえ。
NPC_000480,"I am Captain Elic Eward of the Madrigal Job Training Center. If you want to become an Assist, I can help you.",私はマドリガル職業訓練所の教官、＜エリック・アワード＞という。アシストとして道を切り開きたいなら、私のところにくるがいい。
NPC_000481,"Remember, every party needs an Assist! Don't leave home without us!",まずは、自分自身を助けるという言葉を忘れないようにな、諸君！
NPC_000482,Yay! I am so happy! Bubble smiles on us!,あたしの魔法、みる？
NPC_000483,"I may not look like much, but I'm very powerful. I'm ready for anything! The Soldiers of Kion will prevail!",あたしの魔法はその辺の魔法使いとは一味違うわよ！
NPC_000484,"My name is Eoners Archer and I am one of the hired soldiers of Kion. We are here to protect the citizens of Flarine, as long as the money is right. \n*wink*",あたしはキオン傭兵団の団員＜アナス・アーチャ＞、魔法の腕にかけてはマドリガル中をさがしたって右に出るものはいないわよ！？
NPC_000485,Love to Kion!!,ジーク・キオン！！
NPC_000486,"Welcome to Flarine! Please, enjoy your stay!",フラリス市民のみなさま！安心してください。わたくしがお守りします。
NPC_000487,"Flarine is the capital city of Madrigal. It may be a small city, but it's certainly the most beautiful. Feel free to come see me if you ever need anything.",フラリスは小さい町ですが、マドリガル一の行政中心地であり、なにより、とても美しい町です。
NPC_000488,I am the mayor of Flarine. The well-being of the citizens is my highest priority. Is there anything I can help you with?,わたくしは、フラリスの全てを管理している市長です。　
NPC_000489,#b#cff8a004fWe have a #cfffc0000Guild Siege #b#cff8a004fevery Saturday. Speak to the Guild Siege Managers for more information!#nc#nb,#b#cff8a004f私たちは#cfffc0000ギルドコンバット#b#cff8a004fを毎週土曜日開催しています。詳しくはギルコンマネージャーに聞いてみなさい！#nc#nb
NPC_000493,"*scribbles* Ah, yes! This is good stuff... I'm such a great writer! Now I just need a good protagonist...",よし！今回の小説は、これでいこう！　しかし、どう書き出したものか・・。うーん・・・
NPC_000494,"I am writing one of my best novels yet! It's action-packed, fast paced, dark, and even a little scary! It's about this hero who enters a dark cave and... well wait, if I tell you, you might steal my idea! Who are you anyway!?",小説ってものはだな、多くの者達が読むのだよ。　面白く、そしてより刺激的に！わかるかな？　
NPC_000495,Pleased to meet you! My name is Gergantes Hambert. I live here in Flarine and I love it. I am a famous novelist as well as the Chairman of the Publication Society. Do you like to read?,私はマドリガルの有名な小説家であり、出版協会長でもあるゲルガンテス・ハムブトというものだ。
NPC_000496,"My next novel will be a best seller, I'm sure! Keep an eye out for it!",私の新作は？だと？　はっはっはっ！大いに期待してくれたまえ！　はっはっはっ！！　
NPC_000497,"We, the Soldiers of Kion, are family! ",わが一撃は無敵なり！！
NPC_000498,"Don't speak to me as if you know me, stranger. I am the most feared martial artist in all of Madrigal. I can take you down with one finger!",我らは＜ロエンテール＞様の最強封印奥義＜シャドウ・アバター＞をマドリガルで最初に復活させる使命を受けているのだ！
NPC_000499,"My name is Ghalade Elore, if you must know. I am one of the hired Kion Soldiers for Flarine. I am a legend in the world of martial arts, as I've followed in the footsteps of Roentel. Don't cross me.",私はキオン傭兵団の団員＜ガラード・エロア＞だ。体術でおいては並ぶもののない伝説の使い手と呼ばれている！
NPC_000500,Glory to Kion,ジーク・キオン！！
NPC_000501,Tucani! Would you PLEASE stop singing that stupid song? I have a headache...,何だ？人間が何か用なのか？
NPC_000502,"Humans look down us because we used to do their work for them. But as 'smart' as humans may be, we are far stronger. We are by no means, inferior. Understand?",人間たちはたいがい、俺たちドワーフ種族を見下す奴ばかりさ。人間がまったく愚かだよ。いつだって自分達が一番優れていると思っているんだからな。
NPC_000503,"Yeah, not gonna happen. If you didn't already figure it out, we don't particularly like you people. So unless you have some sort of business to discuss, I suggest you leave. Now.",もうどっかに行ってくれ。　人間とは関わりたくないんだ。
NPC_000504,It's about time you left...,うるさいやつだなあ…用があったってなくたって、目障りには変わりないんだよ。　さっさとどこかにいってくれ。
NPC_000505,Only the bravest of adventurers should dare to enter. Are you prepared?,勇気のある達よ！　汝らはこの闘いに、自らの意志で挑もうというの？！
NPC_000506,"You are brave, young one. Go with honor.",まだ時は来ておらぬ！汝らの出番を待つのだ！
NPC_000507,"If you have any doubts whatsoever, you should just quit now. Too much blood has been spilled already over all of this.",勇気なき者よ！汝らが命、惜しいのならば、ここに近づくではないぞ！　
NPC_000508,You are indeed foolish if you think you can go in there alone. You must bring friends if you wish to have a even a small chance at victory.,なんと無謀な。たった一人で挑もうというのか！笑止千万！むざむざと死なせる訳にはいかぬわ！
NPC_000509,You are not yet ready to challenge the beast within this lair. You are foolish if you think I would allow you to enter.,なに？この闘いを望んでいると？汝はまだ何も知らぬ・・・　そのような資格もなきことに気づかぬか・・・　フラリス北広場へ向うがよい。
NPC_000510,Travel to Northern Flarine and speak with the Novelist there. I cannot help you. ,そこには、汝を導いてくれる者がいるはずだ。その者、小説家を探すのだ！
NPC_000511,"No, not yet. You are not qualified to challenge this creature yet. Now please, leave in peace.",いや、まだね。あなたにはまだ挑戦する資格はないわ。平和と自由を重んじてここから去りなさい！
NPC_000512,"So you want to know who I am, my child? I exist... and yet, I do not exist. That is all you need to know and I will tell you no more.",私を知ろうとするではない。私は存在し、そして、存在しない・・・　それ以上でもそれ以下でもないのだ・・・　
NPC_000513,"Farewell, brave one.",気をつけなさい。勇気ある者よ。
NPC_000514,"Worry not, Hormes. We will not fail. ",振り向くでない。過去から未来へ、時の流れに身を任せよ。
NPC_000515,"It's hard to interpret the ancient texts. They are extremely old and in poor condition. What we have discerned, is that the fight for peace is far from over, and we must prepare ourselves for what's coming.",赤々と燃え立つ夕焼けの向こう、一つの星が消えようとも、残された七つの星々はさらなる輝きを放つじゃろう。
NPC_000516,"My name is Guabrill Elldoradin, the Blade Wise Man. We've all come together to guide to adventurer's such as your self on the path of the Heroes. Will you stand up for Madrigal, young one?",ワシは八賢者の一人、＜ガブリ・エルドラディン＞じゃ。ブレードの英雄 ＜疾風の刃＞ヘレンの生涯を記録に残しておる。
NPC_000517,The Heroes will never be forgotten. Stories of their sacrifice will be told for generations to come.,光の中に闇を、闇の中に光を求めよ。
NPC_000518,"#b#cff8a004fWelcome, competitors! The #cfff60000Guild Siege Application Center #cff8a004fis open for business!#nc#nb",#b#cff8a004fみなぎる勇気！湧き出る知恵！集え！新進気鋭の冒険者達よ！#cfff60000ギルドコンバット#cff8a004fはおまえ達を待っているぞ！#nc#nb
NPC_000519,"If your guild has reached the point where you think you have the strength and numbers to compete against another guild, then you’re in the right place. Prove to everyone that you’re able to become a legend like Badza! ",おまえ達の勇気と知恵で、挑戦してみないか？ここで、真の実力を試してみろよ！
NPC_000520,"It's a pleasure to make your acquaintance. I am the Guild Siege Master of Flarine. Speak with me if you need general Guild Siege information, want to apply, form your party, or enter the arena.",俺はGCC所属員として、ギルドコンバットの申請と入場をマネージメントしているんだ。
NPC_000521,For Glory!,ギルドの大いなる栄光の為に！
NPC_000522,I smell human... gross!,ここは人間の来るところじゃないぞ。何しにやってきたんだ？
NPC_000523,"We are superior to humans in all ways. You're lucky I'm even speaking to you. Now, what is it you want? Can't you see I'm busy?",オレたちは、人間よりもっと優秀な種族なんだ。　君らは認めたくないだろうけどな。
NPC_000524,"Who wants to know? You? Haha! Right, like I owe you anything at all, human. Why don't you make like a tree, and get out of here?",何だ？　まだ何かオレたちの知識を聞き出そうとしてるのか？　オレらに興味を持ってる人間なんて、たいがいイヤラしいやつらなんだ。もう喋ることはないぜ。どっかにいってくれよ。
NPC_000525,"Thanks for leaving, chump!",ああ、まったくもって面倒くさいな・・・ぶつぶつ・・・
NPC_000526,"So you want to know who I am, my child? I exist... and yet, I do not exist. That is all you need to know and I will tell you no more.",私を知ろうとするではない。私は存在し、そして、存在しない・・・　それ以上でもそれ以下でもないのだ・・・　
NPC_000527,"Shade will return, this much is certain. We can only hope to be ready for her.",人は歴史を生み、歴史を語り継ぐ。人が生き続ける限り、歴史も生き続けるのじゃ。
NPC_000528,"We await the day of our impending doom. The day will come, and pass. We must stand together.",世界が暗闇に包まれし時、8つの光が現れる。光はまばゆい輝きを放ち、ワシらを導くじゃろう。
NPC_000529,"My name is Hormes Kudo, the Knight Wise Man. I lead those who wish to become a Knight successor, and I help to preserve the memory of the Heroes.",ワシは八賢者の一人、＜ホロメス・カド＞じゃ。ナイトの英雄 ＜鉄壁の豪腕＞ビレリアンの生涯を記録に残しておる。
NPC_000530,Rhisis watch over you.,剣をかかげよ！イバラの道を突き進むのじゃ！
NPC_000531,Draw your weapon and cut down everything that stands in your way! A Mercenary fears nothing!,鋭き刃を振りかざし、立ちふさがる全ての邪悪をなぎ払うのです！そして力強く進みなさい。
NPC_000532,"The three most important things for a successful Mercenary are instinct, courage, and level headedness. If you possess these qualities, then you have what it takes to be a Mercenary.",マーシナリーに一番重要な事は、慎重、正確、迅速です。この３つが身に備わってこそ、真のマーシナリーになれるのです。
NPC_000533,"Hello, my friend. It is my pleasure to make your acquaintance. My name is Hyuit Jenive and I am a sergeant of the Madrigal Job Training Center. I help train Vagrants to become Mercenaries, after Mustang signs off on them, of course. ",私はマーシナリー職業訓練所の助手＜ヒューイット・ゼネル＞です。マーシナリーを志す者をサポートするために頑張ります。
NPC_000534,"Keep your pride, courage and hope!",プライドと勇気・・・そして何より希望を忘れないように！
NPC_000535,"Welcome! If you need any help or information, please don't hesitate to ask.",何かご不明なことはありませんか？私に声をかけてくれれば、全て解決いたしますよ。
