Key,English,Portuguese
PROPQUEST_DUNGEONANDPK_INC_000578,"Thank you! Please, investigate the entrance of the temple for anything dangerous. Would you?","Obrigado! Por favor, investigue a entrada do templo em busca de algum perigo. Você faria isso?"
PROPQUEST_DUNGEONANDPK_INC_000579,"I cannot force you to help me if you are busy. But maybe, when you have the time, you could come back and help me.","Eu não posso forçá-lo a me ajudar se você estiver ocupado. Mas talvez, quando tiver tempo, você possa voltar e me ajudar."
PROPQUEST_DUNGEONANDPK_INC_000580,"Thank you, you did a great job.","Obrigado, você fez um grande trabalho."
PROPQUEST_DUNGEONANDPK_INC_000581,It is very easy to find the entrance of the temple in Fantasy Desert.,É muito fácil localizar a entrada do templo no Deserto da Fantasia.
PROPQUEST_DUNGEONANDPK_INC_000582,Investigate the temple entrace.,Investigue a entrada do templo.
PROPQUEST_DUNGEONANDPK_INC_000584,Temple of the Clown,O Templo do Curinga
PROPQUEST_DUNGEONANDPK_INC_000585,Oh... Back so soon? I am glad you are back but I am still so worried.,"Oh... Já está de volta? Fico contente com a sua volta, porém ainda estou preocupada."
PROPQUEST_DUNGEONANDPK_INC_000586,I guess I am still worrying about the Iblis Temple. I know you said that there is nothing to worry about but I still have a bad feeling about that place.,"Acho que ainda estou preocupada com o Templo Iblis. Sei que você disse que não há nada com que se preocupar, mas ainda estou com um pressentimento ruim a respeito daquele lugar."
PROPQUEST_DUNGEONANDPK_INC_000587,Would you please help me once more? I will not be able to rest until I know for sure…,Você poderia me ajudar mais uma vez? Não poderei descansar até ter certeza…
PROPQUEST_DUNGEONANDPK_INC_000588,"I heard that there is a copy of the Iblis Revelation in the temple. Please bring me a rubbed copy of it, I need to see what it says.","Soube que existe uma cópia da Revelação de Iblis no templo. Por favor, traga-me uma cópia. Preciso verificar o que diz na Revelação."
PROPQUEST_DUNGEONANDPK_INC_000589,...but I... I... need your help…,..mas eu... eu..preciso de sua ajuda…
PROPQUEST_DUNGEONANDPK_INC_000590,This… this is more shocking than I could have imagined. Bubble please protect us.,"Isto… isto é mais chocante do que eu poderia ter imaginado. Bubble, por favor nos proteja."
PROPQUEST_DUNGEONANDPK_INC_000591,There is a copy of the Iblis Revelation in the Iblis Temple. Bring a rubbed copy of it.,Existe uma cópia da Revelação de Iblis no Templo Iblis. Traga uma cópia dela.
PROPQUEST_DUNGEONANDPK_INC_000593,The Revival,A Ressurreição
PROPQUEST_DUNGEONANDPK_INC_000594,What should we do?! What should we do?!,O que devemos fazer?! O que devemos fazer?!
PROPQUEST_DUNGEONANDPK_INC_000595,I read the revelation and it speaks of the revival of Iblis as the trigger to the end of the world!,Li a revelação e ela fala da ressurreição de Iblis como o estopim para o fim do mundo!
PROPQUEST_DUNGEONANDPK_INC_000596,"If this is true, we have to stop it! This could be worse than the Hero Wars of long ago.","Se isto for verdade, temos que detê-la! Isto poderia ser pior que a Guerra dos Heróis, acontecida há muito tempo."
PROPQUEST_DUNGEONANDPK_INC_000597,You told me that you saw new types of masquerpets while you were getting the revelation right? I think that maybe…,"Você me disse que viu novos tipos de masquerpets enquanto pegava a revelação, não é? Acho que talvez…"
PROPQUEST_DUNGEONANDPK_INC_000598,...they are the scouts of the army of Iblis. It looks like we may have to work together for a little while longer. Are you willing to help?,Eles sejam os soldados do exército de Iblis. Parece que teremos que trabalhar juntos por mais tempo. Está disposto a ajudar?
PROPQUEST_DUNGEONANDPK_INC_000599,Excellent. Go in to the temple and gather any information you can about the strange masquerpets.,Excelente. Vá até o templo e obtenha todas as informações que puder a respeito dos masquerpets estranhos.
PROPQUEST_DUNGEONANDPK_INC_000600,What?! Are you really going to stand by and let the world end?,O que?! Você realmente vai ficar parado esperando o fim do mundo?
PROPQUEST_DUNGEONANDPK_INC_000601,"Hmm... Iblis Crasher... So, that is one of the masquerpets? Alright, give me some time to study this information. Thank you.","Hmm... Iblis Esmagador... Então, esse é um dos masquerpets? Tudo bem, me dê algum tempo para estudar essas informações. Obrigada."
PROPQUEST_DUNGEONANDPK_INC_000602,Any information about any Masquerpets is good.,Qualquer informação a respeito de Masquerpets é útil.
PROPQUEST_DUNGEONANDPK_INC_000603,Go into the temple and gather any information you can.,Vá até o templo e obtenha todas as informações que puder.
PROPQUEST_DUNGEONANDPK_INC_000605,Into the Dark,Na Escuridão
PROPQUEST_DUNGEONANDPK_INC_000606,Hi. I have studied the information you brought me and I have found that there is an altar in the Iblis Temple. There is also evidence that there are masquerpets guarding the altar.,Oi. Estudei as informações trazidas por você e descobri que existe um altar no Templo Iblis. Também há evidências de que existem masquerpets guardando o altar.
PROPQUEST_DUNGEONANDPK_INC_000607,Do you see? They do not want anyone to interupt the revival of Iblis. We need to do something. We need to stop them!,Você percebe? Eles não querem que ninguém interrompa a ressurreição de Iblis. Precisamos fazer alguma coisa. Precisamos pará-los!
PROPQUEST_DUNGEONANDPK_INC_000608,Are you ready for one last journey into the dark?,Você está preparado para uma última incursão nas trevas?
PROPQUEST_DUNGEONANDPK_INC_000609,"I knew you would be. There is a masquerpet name Iblis Guardian. If you can defeat it, you can enter the altar.","Eu sabia que você estaria. Há um masquerpet chamado Guardião Iblis. Se você derrotá-lo, então poderá entrar no altar."
PROPQUEST_DUNGEONANDPK_INC_000610,Are you serious? What could be more important than saving the world?,Você está falando sério? O que poderia ser mais importante do que salvar o mundo?
PROPQUEST_DUNGEONANDPK_INC_000611,"Great job, now you can enter the altar. I am counting on you to defeat the followers of Iblis... we all are. Go to the altar now.","Bom trabalho, agora você já pode entrar no altar. Estou contando com você para derrotar os seguidores de Iblis. Todos nós estamos. Vá até o altar agora."
PROPQUEST_DUNGEONANDPK_INC_000612,I do not know exactly where Iblis Guardian is. But we have to find it and destroy it.,Eu não sei o local exato onde o Guardião Iblis se encontra. Mas temos que encontrá-lo e destruí-lo.
PROPQUEST_DUNGEONANDPK_INC_000613,Defeat Iblis Guardian and enter the altar.,Derrote o Guardião Iblis e entre no altar.
PROPQUEST_DUNGEONANDPK_INC_000615,If you can defeat the Iblis Guardian you can enter the altar.,"Se você for capaz de derrotar o Guardião Iblis, poderá entrar no altar."
PROPQUEST_DUNGEONANDPK_INC_000625,Dekane Mine,Mina Dekane
PROPQUEST_DUNGEONANDPK_INC_000626,Iblis Temple,Templo Iblis
PROPQUEST_DUNGEONANDPK_INC_000640,Bloody corridor,Corredor Sangrento
PROPQUEST_DUNGEONANDPK_INC_000641,Well... Not a bad deal... Can you collect 20 Blood Trillipy Shells and defeat a Mutant Keakoon Worker?,Bem... Não é um mau negócio... Você poderia coletar 20 Conchas de Trillipy Sangrenta e derrotar um Trabalhador Keakoon Mutante?
PROPQUEST_DUNGEONANDPK_INC_000642,"In that case...Hic, good luck.","Nesse caso... Hic, boa sorte."
PROPQUEST_DUNGEONANDPK_INC_000643,Hmm... the Hazardous Blood Trillipys are much stronger...,Hmm...as Trillipys Sangrentas são muito mais fortes...
PROPQUEST_DUNGEONANDPK_INC_000644,Thanks to you the extraction in this area will be much easier!,Graças a você a extração nesta área será muito mais fácil!
PROPQUEST_DUNGEONANDPK_INC_000645,Hmm... Despite your level the Hazardous Blood Trillipys are much stronger...,"Hmm... Apesar do seu nível, as Trillipys Sangrentas são muito mais fortes..."
PROPQUEST_DUNGEONANDPK_INC_000646,Collect $QUEST_END_ITEM_COUNT$ loot from the Bloody Trilipy and kill $QUEST_END_KILL_COUNT$ $QUEST_END_KILL_NAME$.,Colete $QUEST_END_ITEM_COUNT$ itens de Trillipys Sangrentas e elimine $QUEST_END_KILL_COUNT$ $QUEST_END_KILL_NAME$.
PROPQUEST_DUNGEONANDPK_INC_000648,The bottom of the mine,O Fundo da Mina
PROPQUEST_DUNGEONANDPK_INC_000649,"Hello, if you're here it's because you've defeated all the known monsters in the mine. I'm Dekane, the creator of this mine. Now that you've proven yourself, I'll be able to tell you the real problem that lies at the bottom of the mine. In a secret room sleep dragons from ancient times created by Shade ages ago.","Olá, se você está aqui é porque derrotou todos os monstros conhecidos da mina. Sou Dekane, o criador desta mina. Agora que você provou seu valor, poderei lhe contar o verdadeiro problema que está no fundo da mina. Em uma sala secreta, dormem dragões dos tempos antigos criados por Shade há tempos atrás."
PROPQUEST_DUNGEONANDPK_INC_000650,Good luck!,Boa sorte!
PROPQUEST_DUNGEONANDPK_INC_000651,It is true that this is not an easy thing for an adventurer. Come and try your luck again when you are ready.,É verdade que isso não é uma coisa fácil para um aventureiro. Venha e tente a sua sorte novamente quando estiver pronto(a).
PROPQUEST_DUNGEONANDPK_INC_000652,So you really did kill them all... Thank you very much.,Então você realmente matou todos eles... Muito obrigado.
PROPQUEST_DUNGEONANDPK_INC_000654,Collect 30 Blood Trillipy Shells from the Bloody Trillipy and kill 3 Mutant Keakoon Workers.,Colete 30 Conchas de Trillipy do Trillipy Sangrento e mate 3 Trabalhadores Keakoon Mutantes.
PROPQUEST_DUNGEONANDPK_INC_000656,"To defeat them, you'll need a well-armed team. Ah, but there's one detail I forgot to mention. You'll need 1,000,000 Penya to open the door, but for now, collecting 30 Blood Trillipy Shells and defeating 3 Mutant Keakoon Workers will be enough. Are you ready to accept this challenge?","Para derrotá-los, você precisará de uma equipe bem armada. Ah, mas há um detalhe que esqueci de mencionar. Você precisará de 1.000.000 Penya para abrir a porta, mas por agora, coletar 30 Conchas de Trillipy Sangrento e derrotar 3 Trabalhadores Keakoon Mutantes será o suficiente. Você está pronto para aceitar este desafio?"
PROPQUEST_EILLUNQUESTS_INC_000001,Preparation,Preparation
PROPQUEST_EILLUNQUESTS_INC_000002,Prepare yourself... The first boss approaches!,Prepare yourself... The first boss approaches!
PROPQUEST_EILLUNQUESTS_INC_000003,Recover your strength. Next wave incoming!,Recover your strength. Next wave incoming!
PROPQUEST_EILLUNQUESTS_INC_000004,Steel yourself for the second boss battle!,Steel yourself for the second boss battle!
PROPQUEST_EILLUNQUESTS_INC_000005,Brace for impact. The third wave is coming!,Brace for impact. The third wave is coming!
PROPQUEST_EILLUNQUESTS_INC_000006,The third boss emerges. Stay vigilant!,The third boss emerges. Stay vigilant!
PROPQUEST_EILLUNQUESTS_INC_000007,Prepare for the fourth assault!,Prepare for the fourth assault!
PROPQUEST_EILLUNQUESTS_INC_000008,Another boss challenges you. Show your strength!,Another boss challenges you. Show your strength!
PROPQUEST_EILLUNQUESTS_INC_000009,One final wave awaits. Stand ready!,One final wave awaits. Stand ready!
PROPQUEST_EILLUNQUESTS_INC_000010,The ultimate challenge awaits. Fight with all your might!,The ultimate challenge awaits. Fight with all your might!
PROPQUEST_EILLUNQUESTS_INC_000011,"Complete Dungeon ""Rescue [Eillun Farmer] Sprout""","Complete Dungeon ""Rescue [Eillun Farmer] Sprout"""
PROPQUEST_EILLUNQUESTS_INC_000012,"Complete Dungeon ""Rescue [Eillun Farmer] Thorn""","Complete Dungeon ""Rescue [Eillun Farmer] Thorn"""
PROPQUEST_EILLUNQUESTS_INC_000013,"Complete Dungeon ""Defend [Eillun Farmer] Dr. Root""","Complete Dungeon ""Defend [Eillun Farmer] Dr. Root"""
PROPQUEST_EILLUNQUESTS_INC_000014,"Complete Dungeon ""Rescue [Eillun Farmer] Dr. Root""","Complete Dungeon ""Rescue [Eillun Farmer] Dr. Root"""
