Key,English,Portuguese
PROPQUEST_INC_001233,"Look, I know Ganguard's smell bad and all that, so I understand your reservations… but I really need that book.","Olha, eu sei que os Ganguards cheiram mal e tudo mais, então eu entendo seu recuo... mas eu realmente preciso daquele livro."
PROPQUEST_INC_001234,"Travel to the Plain of Bubble, defeat $QUEST_END_KILL_NAME$, and retrieve both the $QUEST_END_ITEM_NAME$ and the $QUEST_END_ITEM_NAME,2$ for Novelist Gergantes in Northern Flarine.","Viaje para a Planície de Bubble, derrote $QUEST_END_KILL_NAME$ e recupere o $QUEST_END_ITEM_NAME$ e o $QUEST_END_ITEM_NAME,2$ para o Novelista Gergantes que está na Zona Norte de Flarine."
PROPQUEST_INC_001236,Legend of Dreadpet <Moot Arvan>,A Lenda de Dreadpet <Moot Arvan>
PROPQUEST_INC_001237,"Pssst, hey you! I am writing a book and I need your help! I've had a little writers block lately and I need a brave adventurer to help me write it!","Ei parceiro(a)! Estou escrevendo mais um livro e preciso da sua ajuda novamente! Preciso de você para desvendar mais uma lenda, assim vou conseguir terminar mais um sucesso."
PROPQUEST_INC_001238,"Have you ever heard of the legend of Moot Arvan? No? A long time ago, there was very a famous adventurer, Moot Arvan. One day, he found an interesting place to adventure...","Vamos lá, agora é a respeito da Lenda de Moot Arvan. Há um tempo havia esse aventureiro, Moot Arvan, ele adorava encontrar coisas raras de civilizações antigas. Certo dia, ele foi se aventurar no meio de um pântano..."
PROPQUEST_INC_001239,"It was a strange, wet marsh. Moot explored the marsh only to become infested with a disease called Unpleasant Fear.","Era um pântano estranho e úmido. Moot foi explorar pântano, pois ele havia escutado que lá poderia encontrar evidências de uma tribo milenar. Após vários dias no local, ele não percebeu que contraiu uma doença misteriosa."
PROPQUEST_INC_001240,"The disease transformed him into a hideous monster known as Mushmoot! There's virtually nothing left of that brave adventurer but bits and pieces, or so they say…","Esta doença o consumia a cada dia até transformá-lo em um grande monstro conhecido como Mushmoot, o Horripilador! Eventualmente, ele perdeu sua consciência e nada mais restou de Moot Arvan."
PROPQUEST_INC_001241,"So, here's where you come in. I need an ending to the story and I'd like to know what's become of Mushmoot. Feel like helping?",Nesse ponto você já deve saber o que desejo. Eu preciso de um desfecho para a história e gostaria de saber o que aconteceu com Mushmoot. Poderia me ajudar?
PROPQUEST_INC_001242,Great! One of those pesky Hadeseors at the Plain of Bubble has stolen one of my reference books! Find and recover the book for me and see if you can locate the Boggy Map while you're there.,Ótimo! Um daqueles Hadeseors irritantes na Planície de Bubble roubou um dos meus livros de referência enquanto eu bebia! Recupere o livro para mim e veja se consegue localizar o Mapa do Pântano enquanto estiver lá.
PROPQUEST_INC_001243,"Don't be a scaredy-cat! Look, I'll even give you 50% of the proceeds from my book sales if you help. Okay?","Não seja medroso(a). Olha, eu lhe darei 50% do lucro das vendas do livro se me ajudar. Beleza?"
PROPQUEST_INC_001244,"Yes, great work! I knew you could do it!","Sim, ótimo trabalho! Eu sabia que voce poderia fazer isso!"
PROPQUEST_INC_001245,"Here, take this. It's Moot's Heart. \n\n*You begin to feel sick…*\n\n Oh shake it off, slacker!","Aqui, pegue isso. É o coração de Moot. \n\n*Você começa a se sentir mal...* \n\n Oh, supera isso!"
PROPQUEST_INC_001246,"Take that heart to the Dreadpet Manager at the Eastern River of Weeping. You'll need to form a party first, it's way too dangerous to go in there alone.","Leve esse coração para o Gestor de Dreadpet no Leste do Rio das Lágrimas. Você precisará formar um grupo primeiro, é muito perigoso entrar lá sozinho. "
PROPQUEST_INC_001247,Ah geez! What are you afraid of? A Hadeseor? Psht! I guess you aren't as brave as I thought you were.,Ai ai! Do que você tem medo? Do Hadeseor? Psht! Acho que você não é tão corajoso quanto eu pensei que fosse.
PROPQUEST_INC_001250,Sad Christmas,Natal Triste
PROPQUEST_INC_001251,Hmm... We are in big trouble now. Do you know what happened? Do you? The stockings are gone. The stockings...,Hmm... Agora estamos realmente encrencados. Você sabe o que aconteceu? Você sabe? As meias se foram. As meias...
PROPQUEST_INC_001252,"Are you asking why I am making a big deal about the stockings? Are you serious? These are not normal stockings, these are the Christmas stockings which have the wishes of children!","Você está perguntando porque eu me preocupo tanto com as meias? Você está falando sério? Não são meias normais, são as meias de Natal que carregam os desejos das crianças!"
PROPQUEST_INC_001253,"A few days ago, every stocking was stolen in Madrigal. I figured out that Masquerpets did it. Now we are in big trouble.","A alguns dias atrás, todas as meias de Madrigal foram roubadas. Imagino que os Masquerpets as roubaram. Agora estamos realmente encrencados."
PROPQUEST_INC_001254,Would you please help me make a Merry Christmas in Madrigal?,"Por favor, você me ajudaria a promover um Feliz Natal em Madrigal?"
PROPQUEST_INC_001255,Thank you. Please hunt every Masquerpet in Madrigal and bring me $QUEST_END_ITEM_COUNT$ stockings. I will definitely reward you.,"Obrigada. Por favor, cace todos os Masquerpet em Madrigal e me traga $QUEST_END_ITEM_COUNT$ meias. Definitivamente o recompensarei."
PROPQUEST_INC_001256,"No, no... This Christmas will be tragic without the stockings... Oh...","Não, não... Este Natal será trágico sem as meias. Oh..."
PROPQUEST_INC_001257,Ha ha ha! I knew you would! Thank you so much! But... We still lack enough stockings... Hmm...,Ha ha ha! Eu sabia que você conseguiria! Muito obrigado! Mas.. Nós ainda não temos meias o suficiente... Hmm...
PROPQUEST_INC_001258,"Hey... I told you I need 500 stockings. I know 500 stockings are a lot, but it is not that difficult to get.","Ei... Eu disse que preciso de 500 meias. Eu sei que 500 meias é bastante, mas não é tão difícil de obter."
PROPQUEST_INC_001259,Please hunt every Masquerpet in Madrigal and bring me $QUEST_END_ITEM_COUNT$ stockings. I will definitely reward you.,"Por favor, cace todos os Masquerpets em Madrigal e me traga $QUEST_END_ITEM_COUNT$ meias. Definitivamente o recompensarei."
PROPQUEST_INC_001261,Christmas Nightmare,Pesadelo de Natal
PROPQUEST_INC_001262,"Hey, you! Yes, you! Come here. Come! Coooome!","Ei, você! Sim, você! Venha aqui. Venha! Veeenha!!!"
PROPQUEST_INC_001263,"You know about the Christmas stockings, right? Well, they disappeared!. Maybe you do not understand, but this is a very big accident. Are you listening?!","Você já sabe a respeito das meias de Natal, não sabe? Bem, elas desapareceram! Talvez você não compreenda, mas isso é uma acidente enorme. Você está ouvindo?!!"
PROPQUEST_INC_001264,"A few days ago, every stocking was stolen in Madrigal. I figured out that the darn Masquerpets did it. Now we are in big trouble. Darn it!","A alguns dias atrás, todas as meias de Madrigal foram roubadas. Imagino que os malditos Masquerpets as roubaram. Agora estamos realmente encrencados. Droga!!!"
PROPQUEST_INC_001265,"You can help me create a Merry Christmas in Madrigal, right?","Você pode me ajudar a promover um Feliz Natal em Madrigal, não pode?"
PROPQUEST_INC_001266,"Good! Go and hunt Masquerpets, and bring me 300 stockings. Yes, I will reward you. Go!","Bom! Vá e cace Masquerpets, e me traga 300 meias. Sim, eu o recompensarei. Vá!!"
PROPQUEST_INC_001267,Hey! Are you going to make this Christmas into a nightmare? Are you crazy?,Ei! Você vai fazer desse Natal um pesadelo? Você está louco?
PROPQUEST_INC_001268,Ha ha ha! Good job! Thank you! But... We still do not have enough stockings...,Ha ha ha! Parabéns! Obrigado! Mas... Nós ainda não temos meias o suficiente...
PROPQUEST_INC_001269,Hey... Are you stupid? Or you cannot count? I told you 300 stockings! 300!,Ei... Você é bobo? Ou não sabe contar? Eu disse 300 meias!! 300!!
PROPQUEST_INC_001270,"Go and hunt Masquerpets, and bring me 300 stockings. Yes, I will reward you. Go!","Vá e cace Masquerpets, e me traga 300 meias. Sim, eu o recompensarei. Vá!!"
PROPQUEST_INC_001272,Desperate Christmas,Natal Desesperado
PROPQUEST_INC_001273,Hey... We are in big trouble now. The stockings... The stockings... Now what should I do? I have to get the stockings back!,"Ei... Agora estamos realmente encrencados. As meias.. As meias... E agora, o que faço? Preciso recuperar as meias!"
PROPQUEST_INC_001274,The stockings have the wishes and dreams of all of the children. But... But...,As meias carregam os desejos e sonhos de todas as crianças. Mas... Mas... 
PROPQUEST_INC_001275,Every stocking was stolen a few days ago in Madrigal. I figured out that Masquerpets did it. Now we are in big trouble.,"A alguns dias atrás, todas as meias de Madrigal foram roubadas. Imagino que os Masquerpets as roubaram. Agora estamos realmente encrencados."
PROPQUEST_INC_001276,Would you please help me create a Merry Christmas in Madrigal?,"Por favor, você me ajudaria a promover um Feliz Natal em Madrigal?"
PROPQUEST_INC_001278,But... This Christmas will be sorrowful without the stockings...,Mas... Este Natal será triste sem as meias...
PROPQUEST_INC_001279,Ho ho ho! I knew you would! Thank you so much! But... We still do not have enough stockings...,Ho ho ho! Eu sabia que você conseguiria! Muito obrigado! Mas... Nós ainda não temos meias o suficiente...
PROPQUEST_INC_001280,I told you we need 100 stockings...,Eu disse que precisamos de 100 meias.
PROPQUEST_INC_001283,Take Ddukguk Back,Traga Ddukguk de volta
PROPQUEST_INC_001284,"Oh my God, I am in big trouble... Psst! Hey, wait! Please listen to me. The biggest holiday in Madrigal, Lunar New Year, is coming soon.","Oh meu Deus, eu estou com grandes problemas... Psiu! Ei, espere! Por favor, me escute. O maior feriado de Madrigal, o Ano Novo Lunar, está chegando em breve."
PROPQUEST_INC_001285,"So Losha made special Ddukguk for the holiday and asked me to keep it. But the Masquerpets heard of it, and...","Então Losha fez Ddukguks especiais para o feriado e me pediu para guardá-lo. Mas os Masquerpets ficaram sabendo, e..."
PROPQUEST_INC_001286,...and they took all of the Ddukguks away. I could not do anything because I was really terrified... Now what should I do? Losha will kick me out if she knows this.,"... e levaram todos os Ddukguks embora. Não pude fazer nada pois fiquei aterrorizado... E agora, o que faço? Losha vai me expulsar se ficar sabendo disso."
PROPQUEST_INC_001287,Would you... please help me? For Lunar New Year? Please?,"Você poderia... me ajudar, por favor? Pelo Ano Novo Lunar? Por favor?"
PROPQUEST_INC_001288,Thank you! Please hunt every Masquerpet you can find in Madrigal and bring me 100 Ddukguks. I will definitely reward you!,"Obrigado! Por favor, cace todos os Masquerpet que encontrar em Madrigal e me traga 100 Ddukguks. Definitivamente o recompensarei!"
PROPQUEST_INC_001289,Are you really going to kick me out? Becoming a cook is my dream. Please help me. I cannot give up now.,"Você realmente vai me expulsar? Meu sonho é me tornar um cozinheiro. Por favor, me ajude. Não posso desistir agora."
PROPQUEST_INC_001290,"Thank you, thank you so much! Here you are. It is my little present.","Obrigado, muito obrigado mesmo! Aqui está. É o meu pequeno presente."
PROPQUEST_INC_001291,Well... I told you I need 100 Ddukguk...,Bem... Eu disse que preciso de 100 Ddukguks.
PROPQUEST_INC_001292,Please hunt every Masquerpet you can find in Madrigal and bring me 100 Ddukguks. I will definitely reward you!,"Por favor, cace todos os Masquerpet que encontrar em Madrigal e me traga 100 Ddukguks. Definitivamente o recompensarei!"
PROPQUEST_INC_001294,Build Love House -Nina-,Construir Casa da Família -Nina-
PROPQUEST_INC_001295,"Hello! I am Nina, the wife of Poul, who is standing over there. Our family wants to move to here because my husband loves this place very much, but...","Olá! Sou Nina, a esposa de Poul, que está bem ali. Nossa família quer se mudar para cá pois meu marido adora este lugar, mas..."
PROPQUEST_INC_001296,...but we do not have money to buy a house. So we decided to build a house by ourselves. However...,... mas nós não temos dinheiro para comprar uma casa. Então decidimos nós mesmos construirmos uma casa. Mas... 
PROPQUEST_INC_001297,"However, people said that we have to hunt Masquerpets if we want to build a house. How can we do that?",Mas as pessoas disseram que nós precisamos caçar Masquerpets se quisermos construir uma casa. Como faríamos isso?
PROPQUEST_INC_001298,Could you please help our family?,"Você poderia ajudar nossa família, por favor?"
PROPQUEST_INC_001299,Thank you! Then please bring me drying Rootioe. You can get them from any Masquerpet as far as I know.,"Obrigada!! Então, por favor, me traga Troncos secos. Pelo que eu sei, você pode obtê-los de qualquer Masquerpet."
PROPQUEST_INC_001300,You are so cruel...,Você é tão cruel...
PROPQUEST_INC_001301,"Thank you, thank you... Thank you very much!","Obrigada, obrigada... Muito obrigada!!"
PROPQUEST_INC_001302,We still are missing some... Please bring me more. Please.,"Ainda precisamos de mais algumas... Por favor, me traga mais. Por favor."
PROPQUEST_INC_001303,Please bring me drying Rootioe. You can get them from any Masquerpet as far as I know.,"Por favor, me traga Troncos secos. Pelo que eu sei, você pode obtê-los de qualquer Masquerpet."
PROPQUEST_INC_001305,Build Love House -ChiChi-,Construir Casa da Família -ChiChi-
PROPQUEST_INC_001306,"Hello! I am ChiChi, the daughter of Poul, who is standing over there. Our family wants to move to here because my daddy loves this place very much, but...","Olá! Sou ChiChi, a filha do Poul, que está bem ali. Nossa família quer se mudar para cá pois meu papai adora este lugar, mas..."
PROPQUEST_INC_001310,Thank you! Then please bring me drying Rootioe. You can get it from any Masquerpet as far as I know.,"Obrigada!! Então, por favor, me traga Rootioe seco. Pelo que eu sei, você pode obtê-las de qualquer Masquerpet."
PROPQUEST_INC_001316,Build Love House -PiPi-,Construir Casa da Família -PiPi-
PROPQUEST_INC_001317,"Hello! I am PiPi, the son of Poul , who is standing over there. Our family wants to move to here because my daddy loves this place very much, but...","Olá! Sou PiPi, o filho do Poul, que está bem ali. Nossa família quer se mudar para cá pois meu papai adora este lugar, mas..."
PROPQUEST_INC_001327,New Puppy Yorrn,O Novo Cãozinho Yorrn
PROPQUEST_INC_001328,"Excuse me, can I talk to you for a moment?","Com licença, você poderia chegar mais perto de mim? Hmm... Bem, acho que talvez você possa me ajudar."
PROPQUEST_INC_001329,"The pretty lady beside me is Losha, my elder sister. I am her younger sister, Loyah.","A bela dama a meu lado é Losha, minha irmã mais velha. E eu sou a irmãzinha querida dela, Loyah. Aliás..."
PROPQUEST_INC_001330,"My sister has a very cute puppy, but unfortunately, he's gone missing! She originally found the puppy up in the mountains.","Minha irmã tem um cãozinho muito fofo, mas infelizmente ele se perdeu. Na verdade, ela o resgatou em uma montanha pois, ..."
PROPQUEST_INC_001331,"When she first saw the puppy, it was cold and starving. So she brought it home and took care of it, but suddenly it disappeared one day.",... ele parecia estar com fome e frio. Então ela o trouxe para casa e passou a tomar conta dele. Mas um dia ele desapareceu de repente. Desde então...
PROPQUEST_INC_001332,"Since then, my sister has been looking everywhere for the puppy. She doesn't eat or drink or sleep. Would you please help my sister find her lost puppy?","... minha irmã não come, nem bebe e o está procurando em toda parte. Você poderia, por favor, ajudar minha irmã a encontrar seu cachorrinho perdido? Por favor?"
PROPQUEST_INC_001333,Great! She found the puppy somewhere in the middle of Leren Mountains where the Grownup Lawolfs live. Maybe the puppy is trying to find it's way home?,"Ótimo! Ela trouxe o cãozinho de algum lugar no meio das Montanhas Leren , onde vivem os Lawolfs Adultos. Acho que talvez você possa encontrá-lo lá."
PROPQUEST_INC_001334,How could you refuse the request from a lady? You have no social manners! Have you no shame?!,Como você pode recusar uma solicitação de uma dama? Parece que você não sabe nada de etiqueta social!
PROPQUEST_INC_001335,"Yorrn! Where did you find him? In the mountains!? I knew it! He was probably trying to find his way home! Welcome back, Yorrn!","Yorrnnnn! Onde você o encontrou? Nas montanhas? Ha ha, eu sabia!! Ele provavelmente estava tentando encontrar o caminho de casa! Bem-vindo de volta, Yorrnzinho!"
PROPQUEST_INC_001336,"Have you found Yorrn? No? Well, please keep looking! I'm worried about my sister!","Você conseguiu achar o Yorrn? Não? Bem, por favor, continue procurando! Estou preocupado com minha irmã!"
PROPQUEST_INC_001337,"Travel to the middle of Leren Mountains, near the Grownup Lawolfs. Find Losha's lost puppy, and return to Loyah.","Ela trouxe o cãozinho de algum lugar no meio das Montanhas Leren, onde vivem os Lawolfs Adultos. Acho que talvez você possa encontrá-lo lá."
PROPQUEST_INC_001339,Trouble-Maker in Pumpkin Village,Criador de Problemas na Vila das Abóboras
PROPQUEST_INC_001340,"Hey there, I have a problem. Can you help me?","Ei... Olá... Se tiver tempo, você pode ouvir minha história? Eu realmente preciso que alguém a ouça."
PROPQUEST_INC_001341,"Actually I have 2 kids, one daughter and one son. My daughter has gone missing!","Eu tenho 2 filhos, uma menina e um menino. Minha filha desapareceu"
PROPQUEST_INC_001342,"This was several years ago with some other missing children... So, my son is the only child I have left. However today... Today he disappeared too!","Há muitos anos, com outras crianças desaparecidas... Então meu filho é a única criança que tenho, mas ele... Hoje ele desapareceu também!! ...."
PROPQUEST_INC_001343,"Both of my kids are now missing. I feel like I can't go on living. Please, will you help me find my son?","Os meus dois filhos estão desaparecidos. Não consigo mais viver... Por favor, por favor me ajude. Por favor!!"
PROPQUEST_INC_001344,You're amazing! My son used to love the Pumpkin Patch. You should start your search there.,"Muito obrigada! Acho que talvez você deva procurar pela Vila das Abóboras, porque meu filho sempre teve curiosidade a respeito daquele lugar."
PROPQUEST_INC_001345,"If you will not help me, then I have no other choice…","Oh, meu Deus... Não consigo mais viver..."
PROPQUEST_INC_001346,"Hey, who are you? What? My mom is worried about me? What else is new…? Ugh, fine. I'll go back and let her know I'm okay.","Hum? Quem é você? O que? Minha mãe mandou você me procurar? Certo, certo. Ela é sempre tão preocupada. Certo, avise para ela que estou bem e voltarei para casa em breve."
PROPQUEST_INC_001347,I am just watching those pumpkin heads. Aren't they cool? I wish I had one!,Só estou vendo aquelas cabeças de abóbora. Não são legais? Eu queria uma para mim...
PROPQUEST_INC_001348,"Travel to Pumpkin Town and search for Mayun, JeongHwa's son.","Viaje para a Vila das Abóboras e procure por Mayun, filho de JeongHwa."
PROPQUEST_INC_001350,Doridori Sushi,Doridori Sushi
PROPQUEST_INC_001351,Finally! The time has come to learn how to make Doridori Sushi. I just need some ingredients!,Ha ha ha.. Finalmente chegou a hora de aprender como fazer Doridori Sushi depois de 15 anos de experiência em fazer sushi.
PROPQUEST_INC_001352,"I'll need to practice the recipe so that I can master it. Oh boy, Doridori Sushi is the best sushi in Madrigal! I can't wait!",Mas preciso praticar sozinho antes de preparar. Então...
PROPQUEST_INC_001353,"Tell you what, if you help me, I will give you some of this fantastic sushi. How's that sound?","Então... Você poderia me ajudar, por favor? Se você me ajudar, eu lhe darei um delicioso sushi. O que você me diz?"
PROPQUEST_INC_001354,"I knew you wouldn't be able to resist! Now, bring me the following materials: 12 Doridoma Keratins and 5 Mushpang Secretion. You can get them from Small Doridomas and Captain Mushpangs.","Eu sabia que você não resistiria! Agora, por favor me traga estes materiais: 12 Queratinas de Doridomas e 5 Secreções de Mushpangs. Você pode obtê-los de Doridomas Pequenas e Mushpang Capitães."
PROPQUEST_INC_001355,You have no idea how delicious my sushi is. Oh well. Your loss!,"Você não faz ideia de como o meu sushi é delicioso. Se você não puder trazer tudo o que eu pedi, você vai se arrepender."
PROPQUEST_INC_001357,"Ah ha! There we go! Your order is ready! I even autographed it in wasabi! Careful, it's SPICY!","Ah ha! Aqui está! Seu pedido está pronto! Eu até autografei com wasabi! Cuidado, é PICANTE!"
PROPQUEST_INC_001358,"I know they can be hard to find, but I'd really like to learn to make it sometime this year. Hurry up, pal!","Eu sei que não é fácil de pegá-los, mas você poderia se apressar? Não tenho muito tempo para praticar."
PROPQUEST_INC_001359,Collect 12 Doridoma Keratins and 5 Mushpang Secretion from Small Doridomas and Captain Mushpangs. Return to Sotta when you have the ingredients.,Colete 12 Queratinas de Doridomas e 5 Secreções de Mushpangs. Você pode obtê-los das Doridomas Pequenas e dos Mushpangs Capitães. Retorne para Sotta quando conseguir os ingredientes.
PROPQUEST_INC_001361,Successor of Hero -Master-,Sucessor do Herói -Mestre-
PROPQUEST_INC_001362,"So you think you're ready to become a Knight? It isn't easy, but since you've made it this far I think you're up to the challenge.","Você deseja ser um sucessor do Herói Knight? Não é uma tarefa fácil. Mas acho que você está preparado, já que veio até aqui."
PROPQUEST_INC_001363,"First, a simple test of your skills in combat to see if you are qualified.","Primeiro, vamos fazer um teste simples para checar se você está qualificado para ser um sucessor. É um teste de habilidade de combate."
PROPQUEST_INC_001364,"Go to KhipRa and hunt down $QUEST_END_KILL_COUNT$ $QUEST_END_KILL_NAME$s. Not the Small ones, or the Giants, just regular $QUEST_END_KILL_NAME$s. That should be easy enough.","Como eu disse, é bem simples. Cace $QUEST_END_KILL_COUNT$ $QUEST_END_KILL_NAME$s em KhipRa, Darkon1. Não os Pequenos Sondadores ou o Gigante, somente os comuns."
PROPQUEST_INC_001365,"Good luck, my friend. I'll be watching.",Eu estarei observando. Boa sorte!
PROPQUEST_INC_001366,Giving up already? But this is the easy part.,Já está desistindo? Mas essa é a parte mais fácil.
PROPQUEST_INC_001367,"Excellent work, Mercenary! Now you're on your way to becoming a Knight.","Hmm... Parabéns, eu sabia que você conseguiria! Agora você está qualificado para ser um sucessor."
PROPQUEST_INC_001368,"To commemorate this day, I have something for you.",Parabéns! Você passou no primeiro teste.
PROPQUEST_INC_001369,"Exactly 20 Drillers, Squire. That's what you'll need to take your first steps to Knighthood.","Exatamente 20 Sondadores. Caso contrário, não posso julgar se você está qualificado. Você tem que cumprir a tarefa se realmente quiser ser um sucessor."
PROPQUEST_INC_001370,"Corel is your master, young Mercenary. I can not help you.","Você já tomou a decisão de ser um sucessor de Blade. Você deve visitar a Corel, não a mim"
PROPQUEST_INC_001371,Hunt Down 20 regular Drillers and return to Karandur in Darken City.,"É muito simples. Cace 20 Sondadores em KhipRa, Darkon 1. Não incomode os Pequenos Sondadores ou o Sondador Gigante, somente os Sondadores."
PROPQUEST_INC_001373,Successor of Hero -Helmet-,Sucessor do Herói -Elmo-
PROPQUEST_INC_001374,This letter of recommendation is proof of your achievements thus far. Guard it as you would your own life.,"Esta é a carta de recomendação que mostra que o mestre o reconhece como um sucessor. Por favor, guarde-a com sua vida. Se você perdê-la, não poderá provar que é reconhecido."
PROPQUEST_INC_001375,"Take it to Hormes, the Knight Sage. He resides at the The Fountain of Dead Person in the Northern Leren Mountains.","Por favor, entregue a carta de recomendação para Hormes, que é o sábio Knight. Ele fica na Fonte das Pessoas Mortas, ao norte, nas Montanhas Leren."
PROPQUEST_INC_001376,"Before you go, though, I want you to find Kindler, a grave-robber. He's hiding out near the Clockworks' Cage, South of Darken City.","Antes de ir, quero que encontre Kindler, um ladrão de túmulos. Ele está escondido perto da Cela de Clockworks, ao sul da cidade de Darken."
PROPQUEST_INC_001377,"I believe he has information on the Golden Helmet of Billaon. Retrieve it by any means, and take it to Hormes along with your letter.",Kidler lhe dará informações a respeito do Elmo Dourado. Obtenha o elmo e entregue para Hormes.
PROPQUEST_INC_001378,May the courage of Billaon be with you always.,Desejo que a coragem de Billaon esteja sempre com você.
PROPQUEST_INC_001379,"You've already come so far, why give up now?","Não se subestime. Você deve ser forte, ou não poderá se tornar um sucessor. Por que desistir agora?"
PROPQUEST_INC_001380,My word! This… this is the Golden Helmet of Billaon! We thought it had been lost forever!,"Hmm? Este, este é o Elmo Dourado de Billaon! Ah, como você o recuperou?! Obrigado! Este é o elmo que Billaon, o herói Knight, usou durante a Guerra do Herói."
