Key,English,Portuguese
PROPQUEST_INC_100035,Deliver the letter to Dior.,Leve a carta para Dior.
PROPQUEST_INC_100036,Take to the Skies!,Vá para os céus!
PROPQUEST_INC_100037,"I knew there was something special about you. After reading this letter it seems Tina has taken a liking to you too! What does the letter say, you ask? That's a secret!","Eu sabia que havia algo especial em você. Depois de ler esta carta, parece que a Tina também gostou de você! O que a carta diz, você pergunta? Isso é segredo!"
PROPQUEST_INC_100038,Congratulations on passing the Initial Test. I'll prepare a reward. It's an experimental fuel that gives your flying device a temporary speed boost!,Parabéns por passar no teste inicial. Irei preparar uma recompensa para você. É um combustível experimental que dá ao seu dispositivo voador um aumento temporário de velocidade!
PROPQUEST_INC_100039,When you have time come speak to me again. I'll prepare the reward for you now.,"Quando tiver tempo, volte e fale comigo novamente. Vou preparar sua recompensa agora."
PROPQUEST_INC_100040,Speak to me when you get a moment. I'll prepare the reward for you.,Fale comigo quando tiver um momento. Vou preparar a recompensa para você.
PROPQUEST_INC_100041,"Your reward is ready! Here you go! Come see me again once you've gained more experience. I'm sure I'll have more ""Tests"" for you! *wink*","Sua recompensa está pronta! Aqui está! Venha me ver novamente quando tiver mais experiência. Tenho certeza que terei mais ""Testes"" para você! *piscadela*"
PROPQUEST_INC_100042,Speak with Dior to claim your reward.,Fale com a Dior para obter sua recompensa.
PROPQUEST_INC_100043,Returning Mission,Missão de Retorno
PROPQUEST_INC_110001,Menacing Phantom,Fantasma Ameaçador
PROPQUEST_INC_110002,"The final task awaits. Please eliminate Serus Uriel. If we don't eliminate her now while she's weakened, Flaris will be in grave danger.","A tarefa final aguarda. Por favor, elimine Serus Uriel. Se não a eliminarmos agora, enquanto ela está enfraquecida, Flaris estará em grande perigo."
PROPQUEST_INC_110003,"Use the key I gave you to enter her lair. Please be careful, the monsters inside are on whole other level compared to the Guardians. It would be wise to form a party before entering her chamber.","Use a chave que lhe dei para entrar no covil dela. Por favor, tenha cuidado, os monstros lá dentro estão em um nível totalmente diferente em comparação com os Guardiões. Seria sensato formar um grupo antes de adentrar em sua câmara."
PROPQUEST_INC_110004,There is no time. Please rethink this through...,"Não há tempo a perder. Por favor, repense..."
PROPQUEST_INC_110005,"You've returned! Flaris can be at peace once again. Thank you, adventurer. Please take this as a reward. You have my gratitude.","Você retornou! Flaris pode ficar em paz mais uma vez. Obrigado, aventureiro. Por favor, tome isso como uma recompensa. Você tem minha gratidão."
PROPQUEST_INC_110006,"The main thing is you are still alive. Take time to recover, and try again! You can do this!",O importante é que você ainda está vivo(a). Tire um tempo para se recuperar e tente novamente! Você consegue fazer isso!
PROPQUEST_INC_110007,Defeat 3 Worm Veduques and eliminate Serus Uriel. Use the Mars Dungeon key to enter her chamber.,Derrote 3 Veduques Serpentinas e elimine Serus Uriel. Use a chave da Masmorra Mars para entrar em sua câmara.
PROPQUEST_INC_110009,Azria,Azria
PROPQUEST_INC_110010,Welcome to Azria!,❄ Bem-vindo(a) a Azria! ❄
PROPQUEST_INC_110011,"Welcome to Azria, one of the coldest places in Madrigal!","Seja bem-vindo(a) a Azria, um dos lugares mais congelantes de Madrigal!"
PROPQUEST_INC_110012,This town is a haven in this dangerous place. Masquerpets have overrun the entire continent and made much of this land uninhabitable.,Este virajero é um refúgio neste lugar perigoso. Os Masquerpets invadiram todo o continente e tornaram grande parte desta terra inabitável.
PROPQUEST_INC_110013,We see you have come a long way to get here. I bet it was a very dangerous journey! You must be very brave.,Vemos que você percorreu um longo caminho para chegar até aqui. Aposto que foi uma viagem muito perigosa! Você deve ser muito corajoso(a).
PROPQUEST_INC_110014,"Feel free to stay as long as you need to. Go and visit Gigaka, our protector. He will help you stay safe.","Fique à vontade para ficar o tempo que precisar. Vá visitar Gigaka, nosso protetor. Ele pode te auxiliar com sua segurança."
PROPQUEST_INC_110015,...,...
PROPQUEST_INC_110016,Welcome to Azria! (2),❄ Bem-vindo(a) a Azria! ❄ (2)
PROPQUEST_INC_110017,Azria is a dangerous place. You are lucky you made it here and lived.,Azria é um lugar perigoso. Você tem sorte de ter chegado com vida.
PROPQUEST_INC_110018,I help protect this small town. Dangerous Masquerpets are everywhere.,"Eu ajudo a proteger este pequeno vilarejo. Muitos aventureiros como você vêm a este lugar para ficar mais fortes, o vilarejo auxilia e se beneficia dessa interação."
PROPQUEST_INC_110019,"I could use some help fighting them off. If you are interested, feel free to drop by and lend me your assistance.","Masquerpets perigosos estão por toda parte e toda ajuda é necessária para lutar contra eles. Se você estiver interessado, sinta-se à vontade para passar por aqui e me emprestar sua força."
PROPQUEST_INC_110020,Stay within this town and you will be safe from harm. Go and visit Mawrang. He is the oldest and wisest of us all. He will help you survive out in the cold.,"Este vilarejo será seu ponto de segurança! Neste continente as temperaturas podem chegar em até -20°C em alguns lugares. Visite Mawrang, ele é o mais velho e o mais sábio de todos nós. Ele pode te ajudar a sobreviver neste frio."
PROPQUEST_INC_110021,Go and visit Mawrang. He is the oldest and wisest of us all. He will help you survive out in the cold.,Vá e visite Mawrang. Ele é o mais velho e o mais sábio de todos nós. Ele o ajudará a sobreviver no frio.
PROPQUEST_INC_110022,"Welcome, brave warrior. I hope this town serves as your safe haven during your perilous journey here.","Bem-vindo, bravo guerreiro. Espero que este vilarejo sirva como seu porto seguro durante sua perigosa jornada aqui."
PROPQUEST_INC_110023,This town could really use your help. We are surrounded in every corner of this continent. ,Este vilarejo precisa muito da sua ajuda. Estamos cercados em todos os cantos deste continente.
PROPQUEST_INC_110024,"Our people have a lot of hope, but I fear the threat grows stronger and stronger every day.","Nosso povo tem muita esperança, mas temo que a ameaça fique cada vez mais forte a cada dia."
PROPQUEST_INC_110025,We thank you for your help. I hope our hospitality suffices for your needs.,Agradecemos sua ajuda. Espero que nossa hospitalidade seja suficiente para suas necessidades.
PROPQUEST_INC_110026,Old Machinery,Maquinário Antigo
PROPQUEST_INC_110027,"So you want to help me fight off masquerpets, huh? Good.","Então você irá me ajudar a lutar contra masquerpets, hein? Ótimo."
PROPQUEST_INC_110028,The entrance to Azria was once an industrious place. It is now overrun by ancient machines. Help me bring down their numbers so other travelers may enter this place more safely.,A entrada para Azria já foi um lugar muito industrializado. Agora está cheio de máquinas antigas que ganharam vida com o poder de Shade. Ajude-me a diminuir o número delas para que outros viajantes possam entrar neste lugar com mais segurança.
PROPQUEST_INC_110029,Will you help me?,Você vai me ajudar?
PROPQUEST_INC_110030,Good. Get going then. The fighting never stops.,Bom. Vá em frente então. A luta nunca para.
PROPQUEST_INC_110031,Come back when you think you are ready.,Volte quando achar que está pronto(a).
PROPQUEST_INC_110032,It appears your efforts were a success. Thank you.,Parece que seus esforços foram um sucesso. Obrigado.
PROPQUEST_INC_110033,"Not enough monsters have been defeated, unfortunately. You must go back and fight.","Não foram derrotados monstros suficientes, infelizmente. Você deve voltar e lutar."
PROPQUEST_INC_110034,Squash the Sasquatch!,Pau no Gato!
PROPQUEST_INC_110035,"We meet again, traveler. We need more help. Rumor has it that the Yetti are becoming more aggressive towards humans. We can't allow this to continue happening.","Nos encontramos de novo, viajante. Precisamos de mais ajuda. Há rumores de que os Yetti estão se tornando mais agressivos com os humanos. Não podemos permitir que isso continue acontecendo."
PROPQUEST_INC_110036,"Will you lend me a hand once more, traveler?","Você pode me dar uma mão mais uma vez, viajante?"
PROPQUEST_INC_110037,Please defeat 70 Yetti and 55 Mutant Yetti and return to me as soon as you're finished.,"Por favor, derrote 70 Yettis e 55 Yettis Mutantes e retorne em segurança assim que terminar."
PROPQUEST_INC_110038,Town Fortification,Fortificação do Vilarejo
PROPQUEST_INC_110039,It seems as though the masquerpets are a greater threat than I thought. We will need to fortify our town as soon as possible.,Parece que os masquerpets são uma ameaça maior do que eu pensava. Precisamos fortalecer nosso vilarejo o mais rápido possível.
PROPQUEST_INC_110040,Bring us some wood and stone. We can make good use of it and reinforce our buildings and fences.,Traga-nos um pouco de madeira e pedra. Podemos fazer bom uso dela e reforçar nossas casas e cercas.
PROPQUEST_INC_110041,Please bring back 20 Wood & 20 Stone. You can obtain the Wood from most kinds of Yetti and Stone from most kinds of Augu.,"Por favor, traga 20 Madeiras e 20 Pedras ao vilarejo. Você pode obter a Madeira da maioria dos tipos de Yettis e a Pedra da maioria dos tipos de Augus."
PROPQUEST_INC_110042,"That will not be enough, sadly!","Isso não será suficiente, infelizmente!"
PROPQUEST_INC_110043,Thank you so much! We will put these materials to good use.,Muito obrigado! Faremos bom uso desses materiais.
PROPQUEST_INC_110044,"Now our town is stronger than ever! Unfortunately, we are still lacking a lot of resources.","Agora nossa cidade está mais forte do que nunca! Infelizmente, ainda nos faltam muitos recursos."
PROPQUEST_INC_110045,"Azria used to have a field of crystals that we would use for energy and magic, but these have been devoured by a crazed Augu that has gone absolutely mad.","Azria costumava ter um campo de cristais que usaríamos para energia e magia, mas eles foram devorados por um Augu furioso que enlouqueceu completamente."
PROPQUEST_INC_110046,The Glacial Augu is now overpowered from all of this crystal essence and has become nearly unstoppable. Can you help us defeat it and retrieve its crystal essence?,O Augu Glacial agora é dominado por toda essa essência de cristal e se tornou quase imparável. Você pode nos ajudar a derrotá-lo e recuperar sua essência de cristal?
PROPQUEST_INC_110047,Good luck!,Boa sorte!
PROPQUEST_INC_110048,I understand. It's a difficult task. I will wait for you to get stronger.,Eu entendo. É uma tarefa difícil. Vou esperar você ficar mais forte.
PROPQUEST_INC_110049,The Frosty Beast,A Besta Congelante
PROPQUEST_INC_110050,Amazing! And you did that all by yourself I bet!,"Incrível! E você fez isso sozinho, aposto! Está se tornando mais forte, posso ver isso."
PROPQUEST_INC_110051,Keep trying! I believe in you!,Continue tentando! Eu acredito em você!
PROPQUEST_INC_110052,"Now that we have all of this crystal essence, we can enforce our town and create a magical barrier that no monster, Violet or not, can ever break through.","Agora que temos toda essa essência de cristal, podemos reforçar nossa cidade e criar uma barreira mágica que nenhum monstro, Violeta ou não, poderá quebrar."
PROPQUEST_INC_110053,We thank you for all of your help! Stay safe out there.,Agradecemos por toda a sua ajuda! Não abaixe sua guarda lá fora.
PROPQUEST_INC_110054,Lost Souls,Almas Perdidas
PROPQUEST_INC_110055,"While we may be safe for now thanks to your help, the armies of Shade are advancing.","Embora possamos estar seguros por enquanto graças à sua ajuda, os exércitos de Shade estão avançando."
PROPQUEST_INC_110056,Shade is summoning the very dead to fight against us. Ghosts of the forgotten rulers have completely taken over the old ruins of Azria.,Shade está convocando os mortos para lutar contra nós. Fantasmas dos governantes esquecidos tomaram conta das antigas ruínas de Azria.
PROPQUEST_INC_110057,Bring Mawrang some of their remains so they can be studied. Maybe we can learn something.,Traga a Mawrang alguns de seus restos mortais para que possam ser estudados. Talvez possamos aprender alguma coisa.
PROPQUEST_INC_110058,Hm... yes... That is interesting.,Hm... sim... Isso é interessante.
PROPQUEST_INC_110059,"That may not be enough, hm.","Isso pode não ser suficiente, hm."
PROPQUEST_INC_110060,Overlord,O Soberano
PROPQUEST_INC_110061,There is very dark and evil power behind these masquerpets. I fear my suspicions are correct.,Há um poder muito sombrio e maligno por trás desses masquerpets. Temo que minhas suspeitas estejam corretas.
PROPQUEST_INC_110062,Some of these masquerpets are being empowered by giant variants. This gives them enough power to break through our barrier!,Alguns desses mascarpets estão sendo fortalecidos por variantes gigantes. Isso lhes dá poder suficiente para romper nossa barreira!
PROPQUEST_INC_110063,We must defeat these giants at once!,Devemos derrotar esses gigantes de uma vez!
PROPQUEST_INC_110064,Hurry! We do not have much time left.,Depressa! Não nos resta muito tempo.
PROPQUEST_INC_110065,Very unfortunate...,Realmente... É uma pena...
PROPQUEST_INC_110066,That was a close call. Thank you.,Isso foi por pouco. Obrigado.
PROPQUEST_INC_110067,We must defeat more than that.,Devemos derrotar mais do que isso.
PROPQUEST_INC_110068,"Our barrier is safe for now, but there appears to be another army approaching much closer now. This one is a far graver threat than any we have ever faced.","Nossa barreira está segura por enquanto, mas parece haver outro exército se aproximando muito mais perto agora. Esta é uma ameaça muito mais grave do que qualquer outra que já enfrentamos."
PROPQUEST_INC_110069,We must prepare for this battle. Speak to Auxilior as soon as possible.,Devemos nos preparar para esta batalha. Fale com Auxilior o mais rápido possível.
PROPQUEST_INC_110070,There is no time to waste. We must strengthen our magic barrier and gather materials. Slay some Augu and gather what little Crystal Essence they may have shared from the Glacial Augu.,Não há tempo a perder. Devemos fortalecer nossa barreira mágica e reunir materiais. Mate alguns Augus e reúna um pouco da Essência de Cristal que eles possam ter recebido do Augu Glacial.
PROPQUEST_INC_110071,"Once you do, bring us a hammer from a Lord Yetti. This is a formidable weapon that we can use to defend ourselves.","Once you do, bring us a hammer from a Lord Yetti. This is a formidable weapon that we can use to defend ourselves."
PROPQUEST_INC_110072,Prepare for Battle! (1),Prepare-se para a Batalha! (1)
PROPQUEST_INC_110073,Let's go then.,Vamos então.
PROPQUEST_INC_110074,It's time to face off against the Mammoths. The most fearsome and terrible creature I have ever laid my eyes upon in this place.,É hora de enfrentar os Mamutes. A criatura mais temível e terrível que já vi neste lugar.
PROPQUEST_INC_110075,This will not be an easy battle. May Rhisis be with you.,Esta não será uma batalha fácil. Que Rhisis esteja com você.
PROPQUEST_INC_110076,"Kill 100 Cannibal Mammoths and last but not least, the Lord Mammoth. ","Kill 100 Cannibal Mammoths and last but not least, the Lord Mammoth. "
PROPQUEST_INC_110077,You are truly a great warrior and an even greater friend. We owe our lives to you.,Você é realmente um grande guerreiro e um amigo ainda maior. Devemos nossas vidas a você.
PROPQUEST_INC_110078,We must battle on. I believe in you.,Devemos batalhar. Eu acredito em você.
PROPQUEST_INC_110079,"We are safe now. I know this may not be much, but take this as a sign of our appreciation. You will always be remembered here.","Estamos seguros agora. Sei que pode não ser muito, mas tome isso como um sinal de nosso apreço. Você sempre será lembrado aqui."
PROPQUEST_INC_110080,Prepare for Battle! (2),Prepare-se para a Batalha! (2)
PROPQUEST_INC_110081,Slay Augu and gather Crystal Essence. Also obtain a hammer from a Lord Yetti.,Slay Augu and gather Crystal Essence. Also obtain a hammer from a Lord Yetti.
PROPQUEST_INC_002010,Raising Pets 1 (Egg -> F Tier),Criando um Pet 1 (Ovo ⇢ Grau D)
PROPQUEST_INC_002011,"Nice egg, stranger. I'm sure you're wondering what kind of pet you'll get from it. Well, don't get too far ahead of yourself now. I can't guarantee you're going to be able to hatch it.","Belo ovo. Estou certo de que você está se perguntando que tipo de Pet nascerá dele. Bem, não fique agitado. Não posso garantir que você tem a habilidade para chocá-lo"
PROPQUEST_INC_002012,"However, if you really take care of the egg there shouldn't be a problem. All you need to do is get the egg's experience (EXP) to 99.99% and then bring it back to me. Think you can do that?","Entretanto, se você cuidar bem do ovo, não deverá haver problemas. Tudo o que você precisa fazer é aumentar a Experiência do ovo até 99.99%, e então o traga para mim. Você pode fazer isso?"
PROPQUEST_INC_002013,"Sounds good! Alright, listen. In order to bring your egg's experience to full, you're going to need to feed it while it's summoned. Find yourself some Pet Candy (F) and get started!","Ótimo! Certo, ouça. A fim de trazer a experiência do seu ovo ao máximo, você precisará alimentá-lo enquanto ele é convocado. Encontre alguns Doces para Pets (F) e comece!"
PROPQUEST_INC_002014,"Well that's a shame. I can't say I'm surprised, though. From the looks of you, you probably couldn't even keep a cactus alive.","Bem, isso é uma pena. Você tem certeza? Ter um Pet será uma grande vantagem."
PROPQUEST_INC_002015,"Great job with the egg, stranger! Tell you what, I'll take over from here. It's hatching time!",Você fez um ótimo trabalho cuidando do seu Ovo. Eu assumo a partir daqui. É hora de chocar!
PROPQUEST_INC_002016,You're going to need to get your egg's experience to 99.99% in order for me to hatch it for you. Feel free to stop by again once you've done this!,Você vai precisar elevar a experiência do seu Ovo para 99.99% para que eu o choque para você. Sinta-se à vontade para parar novamente depois de fazer isso!
PROPQUEST_INC_002017,"The Pet Tamer has asked you to feed your egg some Pet Candy until it reaches 99.99% EXP. Once you've done that, return to him and he will hatch it for you!","O Domador pediu para você alimentar seu Ovo com Doce para Pet até ele atingir 99.99% de experiência. Depois de fazer isso, volte para ele e ele chocará para você!"
PROPQUEST_INC_002019,Raising Pets 2 (F Tier -> E Tier),Criando um Pet 2 (Grau D ⇢ Grau C)
PROPQUEST_INC_002020,"Now that you're pet has been hatched, it will increase specific character statistics (Stat Points) depending on the type of pet you have summoned. Every pet type affects a specific character statistic.","Agora que seu pet chocou, ele aumentará as estatísticas específicas do personagem (Pontos de Atributos), dependendo do tipo de animal de estimação que você convocou. Cada tipo de pet afeta uma estatística de personagem específica."
PROPQUEST_INC_002021,"Feed your pet the appropriate Pet Candy and it will gain experience. If you bring your pet's experience to 99.99% again, I'll upgrade it! How does that sound?","Alimente seu pet com o Doce apropriado e ele ganhará experiência. Se você elevar a experiência do seu pet para 99,99% novamente, eu irei atualizar o Grau de força dele! O que acha disso?"
PROPQUEST_INC_002022,"If your pet's energy runs out, it can't help you. When it's energy gets low, you better feed it to keep the bonuses! Now, go and spend some time with your pet! Come back when you've gained enough experience.","Se a energia do seu pet acabar, ele não poderá ajudá-lo. Quando a energia fica baixa, é melhor alimentá-lo para manter os bônus! Agora, vá se aventurar com seu amiguinho! Volte quando tiver adquirido experiência suficiente."
PROPQUEST_INC_002023,"Really? You're not interested in advancing your pet's abilities? Fine, have it your way. What a shame…","Se você não está realmente satisfeito com a força do seu Pet, porquê não elevá-lo de nível? Ou você está satisfeito com ele?"
PROPQUEST_INC_002024,"Great job with your pet, my friend! I'll take it from here!","Você fez um ótimo trabalho com seu Pet, amigo(a). Deixe-me atualizar o Grau dele para você."
PROPQUEST_INC_002025,You need to spend more time with your pet. It hasn't acquired enough experience to be upgraded yet. Stop back by when his experience reaches 99.99%!,"Você precisa passar mais tempo com seu Pet. A experiência dele não está alta o suficiente para que eu eleve seu Grau. Volte quando a experiência dele atingir 99,99%!"
PROPQUEST_INC_002026,Bring your pet's experience to 99.99% and the Pet Tamer will upgrade it for you!,"Aumente a experiência de seu Pet até 99,99% e o domador irá promovê-lo!"
PROPQUEST_INC_002028,Raising Pets 3 (E Tier -> D Tier),Criando um Pet 3 (Grau C ⇢ Grau B)
PROPQUEST_INC_002029,"The higher the level granted for a particular tier (F, E, D, C, B, A or S), the higher the affected character statistic will be. The level granted is always random. Cool huh?","Seu Pet é bonitinho, mas você consegue perceber que ele está ficando mais forte? Quanto maior o nível concedido para um grau específico (F, E, D, C, B, A ou S), maior será o atributo do personagem afetado. O nível concedido é sempre aleatório. Legal né?"
PROPQUEST_INC_002030,E Tier Pets such as this one have 2 levels available (1 - 2) and you achieved a random level during the last upgrade. Will you see me when your pet reaches 99.99% experience again?,"Pets de Grau E como este têm 2 níveis disponíveis (1 - 2) e você alcançou um nível aleatório durante a última promoção. Você deve me visitar novamente quando seu pet atingir 99,99% de experiência novamente, beleza?"
PROPQUEST_INC_002031,"Great! I'll see you when you get back. Good luck, and don't forget to feed your pet!",Excelente! Vejo você quando voltar. Boa sorte e não se esqueça de alimentar seu pet!
PROPQUEST_INC_002032,"Don't give up now, you're doing such a great job!","Não desista agora, você está fazendo um ótimo trabalho!"
PROPQUEST_INC_002033,"The two of you are becoming stronger together, and it looks like you guys have become pretty good friends in the process. Excellent! I will upgrade your pet to D tier now!",Vocês dois estão se fortalecendo juntos. Excelente! Agora elevarei o seu Pet para o grau B!
PROPQUEST_INC_002034,Stop back by when your pet reaches 99.99% experience.,Você ainda não passou tempo o suficiente com o seu Pet. Continue treinando e volte quando estiver pronto.
PROPQUEST_INC_002037,Raising Pets 4 (D Tier -> C Tier),Criando um Pet 4 (Grau B ⇢ Grau A)
PROPQUEST_INC_002038,"Excellent job raising your pet so far, my friend. You two certainly look happy together!",É bom vê-lo novamente! Nossa! Seu Pet parece bem forte agora. Vocês certamente parecem felizes juntos!
PROPQUEST_INC_002039,"I'm sure you've noticed by now that the higher the level granted for a particular tier, the higher the benefit to your Stats.","Você e seu Pet passaram por várias aventuras juntos. Tenho certeza que você já percebeu que quanto maior o nível concedido para um determinado grau, maior o benefício para seus atributos."
PROPQUEST_INC_002040,"No pain, no gain. I'm sure you know the drill by now. Bring the experience of your pet to 99.99% and bring it back to me. I will upgrade it when your done.","Para ficar forte, é preciso suar a camisa. A essa altura, tenho certeza que você já conhece o treinamento. Aumente a Experiência do seu Pet até 99,99% e traga-o de volta para mim. Avaliarei o nível dele quando você tiver terminado."
PROPQUEST_INC_002042,"The two of you are becoming stronger together, and it looks like you guys have become pretty good friends in the process. Excellent! I will upgrade your pet to C tier now!","Vocês dois estão se tornando mais fortes juntos, e parece que vocês se tornaram bons amigos no processo. Excelente! Vou promover seu pet para o grau C agora!"
PROPQUEST_INC_002043,Not quite there… your pet needs more experience. I'm sure you already knew that.,Ainda não... seu Pet precisa de mais experiência. Estou certo de que você sabia disso.
PROPQUEST_INC_002046,Raising Pets 5 (C Tier -> B Tier),Criando um Pet 5 (Grau A ⇢ Grau S)
PROPQUEST_INC_002047,I can see that you and your pet have been through a great deal together. You're almost there!,Vejo que você e seu Pet passaram por muita coisa juntos. Deixe-me fazer algo para ajudá-los.
PROPQUEST_INC_002048,"I'll upgrade your pet to *S level* using magic handed down through my family. All you have to do is get the experience of your pet to 99.99%. You've done it before, will you do it the one last time?","Elevarei o seu Pet para o grau S usando a magia transmitida pela minha família. Tudo o que você precisa fazer é aumentar a Experiência do seu Pet para 99,99%. Você já fez isso antes. Não faria uma última vez?"
PROPQUEST_INC_002049,I knew you would. It looks like both you and your pet are ready to begin.,Eu sabia que você faria. Parece que você e seu Pet estão prontos para começar.
PROPQUEST_INC_002050,Does this mean you are giving up on your pet?,Isso significa que você está desistindo de seu Pet?
