Key,English,Italian
NPC_000315,Good bye. Be careful not to succumb to the oppressive heat.,Good bye. Be careful not to succumb to the oppressive heat.
NPC_000316,"Do you have anything to ask at #b#cffff0000Office#nc#nb?Then you should visit me, Olien.","Do you have anything to ask at #b#cffff0000Office#nc#nb?Then you should visit me, Olien."
NPC_000317,Is there anything you can do? Oh ho ho!,Is there anything you can do? Oh ho ho!
NPC_000318,Is there something you want to know? I will probably give you the most simple answer so you may just want to think about it on your own. Okay?,Is there something you want to know? I will probably give you the most simple answer so you may just want to think about it on your own. Okay?
NPC_000319,My name is Olien Hengart. I am in charge of managing the Office here in Darken city.,My name is Olien Hengart. I am in charge of managing the Office here in Darken city.
NPC_000320,"Farewell, adventurer.","Farewell, adventurer."
NPC_000321,"Offerep, please strengthen this world with your strong spirit.","Offerep, please strengthen this world with your strong spirit."
NPC_000322,They will lose everything they love. They will get angry. And they will stand up.,They will lose everything they love. They will get angry. And they will stand up.
NPC_000323,"My name is Pereb Endrile, and I am one the 8 priests of Offerep the Psykeeper hero. I am delivering the spirit of Offerep to his future successor.","My name is Pereb Endrile, and I am one the 8 priests of Offerep the Psykeeper hero. I am delivering the spirit of Offerep to his future successor."
NPC_000324,The spirit of Offerep will strengthen you.,The spirit of Offerep will strengthen you.
NPC_000325,Hey! Hey! I have something good Just take a look!,Hey! Hey! I have something good Just take a look!
NPC_000326,"So, what are you going to do for me? Hmmm?","So, what are you going to do for me? Hmmm?"
NPC_000327,The world has become so dangerous. It was not like this when I was young. Damn! This is why we need shields. Why not buy one?,The world has become so dangerous. It was not like this when I was young. Damn! This is why we need shields. Why not buy one?
NPC_000328,"Actually I have sold lots of different things in my life, but now I am selling the shields here in Erons Factory. Nice to meet you, my name is Phacham Dudury.","Actually I have sold lots of different things in my life, but now I am selling the shields here in Erons Factory. Nice to meet you, my name is Phacham Dudury."
NPC_000329,Bye! Visit me when you come here again! Ha ha ha!,Bye! Visit me when you come here again! Ha ha ha!
NPC_000330,Arise now.. from the darkness. You now bear the shining name - the title of Acrobat!,Arise now.. from the darkness. You now bear the shining name - the title of Acrobat!
NPC_000331,Here you are. Time to fulfill your duty.,Here you are. Time to fulfill your duty.
NPC_000332,Everything is the Acrobat. The Acrobat is everything. Take a moment to ponder what I have said.,Everything is the Acrobat. The Acrobat is everything. Take a moment to ponder what I have said.
NPC_000333,"My name is Pyre and I am the Acrobat Master. Nice to meet you. Ha ha ha I am in charge of helping the vagrants, who want to, become an Acrobat.","My name is Pyre and I am the Acrobat Master. Nice to meet you. Ha ha ha I am in charge of helping the vagrants, who want to, become an Acrobat."
NPC_000334,Good bye. Never forget the way of the Acrobat. Ha ha ha,Good bye. Never forget the way of the Acrobat. Ha ha ha
NPC_000335,"No one can stop you from jumping into it, even though you know that it is extremely hot.","No one can stop you from jumping into it, even though you know that it is extremely hot."
NPC_000336,Cell,Cell
NPC_000337,What? What do you want?,What? What do you want?
NPC_000338,I know you were here before. I believe you have the ability to overcome the dangers.,I know you were here before. I believe you have the ability to overcome the dangers.
NPC_000339,Speaking to me is already dangerous as it is. What do you want?,Speaking to me is already dangerous as it is. What do you want?
NPC_000340,Everything is the same. Or is there something special about you? Ha ha Everything is the same.,Everything is the same. Or is there something special about you? Ha ha Everything is the same.
NPC_000341,"You MUST be crazy if you want to know about the mine behind me! If you really wish to enter the mine, talk to Cell. He is somewhere in Darkon.","You MUST be crazy if you want to know about the mine behind me! If you really wish to enter the mine, talk to Cell. He is somewhere in Darkon."
NPC_000342,..,..
NPC_000343,Oh Cell! He is really a bother. I have written this message for him. Please deliver it to him.,Oh Cell! He is really a bother. I have written this message for him. Please deliver it to him.
NPC_000344,"Do you want to get the best weapon in Madrigal? Then come here, you will not regret it.","Do you want to get the best weapon in Madrigal? Then come here, you will not regret it."
NPC_000345,"Come on, choose one. Which one do you want?","Come on, choose one. Which one do you want?"
NPC_000346,"Even though I am very young, many people say that I am the best weapon manufacturer in all of Madrigal.","Even though I am very young, many people say that I am the best weapon manufacturer in all of Madrigal."
NPC_000347,"My name is Remine Crowd, and I run the Weapon Shop here in Darken.","My name is Remine Crowd, and I run the Weapon Shop here in Darken."
NPC_000348,Please visit me again!,Please visit me again!
NPC_000349,"Roentel, the seed you sowed in this world will be harvested soundly.","Roentel, the seed you sowed in this world will be harvested soundly."
NPC_000350,Everything began with them and everything will end with them.,Everything began with them and everything will end with them.
NPC_000351,"My name is Ride Ropeaedilo, and I am the Billposter Master.","My name is Ride Ropeaedilo, and I am the Billposter Master."
NPC_000352,I hope the courage of Roentel will be delivered to you.,I hope the courage of Roentel will be delivered to you.
NPC_000353,"You, who wants to follow the Ringmaster hero Aenn. Do you believe in the will of the hero?","You, who wants to follow the Ringmaster hero Aenn. Do you believe in the will of the hero?"
NPC_000354,The world will be divided into two factions. Those who follow the heroes and those that follow those who the heroes face.,The world will be divided into two factions. Those who follow the heroes and those that follow those who the heroes face.
NPC_000355,"My name is Romvoette Guardian I am protecting the will of Aenn, the Ringmaster hero.","My name is Romvoette Guardian I am protecting the will of Aenn, the Ringmaster hero."
NPC_000356,The teardrops of Aenn will protect you.,The teardrops of Aenn will protect you.
NPC_000357,The best armors are here. I am Rocky the Armor artist.,The best armors are here. I am Rocky the Armor artist.
NPC_000358,Hey! Can you do anything about this?,Hey! Can you do anything about this?
NPC_000359,You have a good eye for great shields. And these are the best.,You have a good eye for great shields. And these are the best.
NPC_000360,My name is Rocky Forward. I am the Armor Artist that runs this Armor shop! Ha ha ha!,My name is Rocky Forward. I am the Armor Artist that runs this Armor shop! Ha ha ha!
NPC_000361,Hope to see you soon alive! Ha ha ha!,Hope to see you soon alive! Ha ha ha!
NPC_000362,"Oh Hynan, I will follow your great will.","Oh Hynan, I will follow your great will."
NPC_000363,"When night falls and daylight disappears, the heroes will rise.","When night falls and daylight disappears, the heroes will rise."
NPC_000364,I am honoring the Ranger hero Hynan as one of the 8 Priests of Altar. I am in charge of passing on the will of the Ranger to you.,I am honoring the Ranger hero Hynan as one of the 8 Priests of Altar. I am in charge of passing on the will of the Ranger to you.
NPC_000365,May the blessing of Hynan be with you always.,May the blessing of Hynan be with you always.
NPC_000366,"You, who want to follow the Blade hero Heren, are you ready to follow the hero?","You, who want to follow the Blade hero Heren, are you ready to follow the hero?"
NPC_000367,The Clowns will have their amusement. And their amusement will destroy the world.,The Clowns will have their amusement. And their amusement will destroy the world.
NPC_000368,"My name is Sencyrit Guardian. I am protecting the will of Heren, who is the Blade hero.","My name is Sencyrit Guardian. I am protecting the will of Heren, who is the Blade hero."
NPC_000369,Heren will bless you forever.,Heren will bless you forever.
NPC_000370,"You, who want to follow the Psykeeper hero Offerep, do you honor the will of hero?","You, who want to follow the Psykeeper hero Offerep, do you honor the will of hero?"
NPC_000371,Everything will end like it began.,Everything will end like it began.
NPC_000372,"My name is Shyniff Guardian. I am protecting the will of Offerep, the Psykeeper hero.","My name is Shyniff Guardian. I am protecting the will of Offerep, the Psykeeper hero."
NPC_000373,The spirit of Offerep will strengthen your soul.,The spirit of Offerep will strengthen your soul.
NPC_000374,Everything you want is here in the Weapon Shop of Stima!,Everything you want is here in the Weapon Shop of Stima!
NPC_000375,What would you do for me?,What would you do for me?
NPC_000376,"Being a travelling salesman was too hard so I settled here. My shop is still small, but I have a good feeling about this place.","Being a travelling salesman was too hard so I settled here. My shop is still small, but I have a good feeling about this place."
NPC_000377,My name is Stima Ogonel. I travel from place to place selling weapons. Nice to meet you.,My name is Stima Ogonel. I travel from place to place selling weapons. Nice to meet you.
NPC_000378,It was very nice to meet you. I hope I can see you again.,It was very nice to meet you. I hope I can see you again.
NPC_000379,Are you ready?,Are you ready?
NPC_000380,It is your duty!,It is your duty!
NPC_000381,I am a proud training instructor of Madrigal!,I am a proud training instructor of Madrigal!
NPC_000382,I am here to show vagrants the way.,I am here to show vagrants the way.
NPC_000383,Attention! Salute!,Attention! Salute!
NPC_000389,"You, who want to become the successor of the Elementor hero Lillip, do you believe in the will of the hero?","You, who want to become the successor of the Elementor hero Lillip, do you believe in the will of the hero?"
NPC_000390,You will be one of the 8 that watch the stars for a sign of their arrival.,You will be one of the 8 that watch the stars for a sign of their arrival.
NPC_000391,"My name is Wendien Guardian. I am protecting the will of Lillip, the Elementor hero.","My name is Wendien Guardian. I am protecting the will of Lillip, the Elementor hero."
NPC_000392,You will be enlightened with the wisdom of Lillip.,You will be enlightened with the wisdom of Lillip.
NPC_000393,You will be enlightened with the wisdom of Lillip.,You will be enlightened with the wisdom of Lillip.
NPC_000394,"A piece of advice? A Mercenary's weapon is their livelihood. You must dedicate your life to the blade, and in turn, it will protect you. ","A piece of advice? A Mercenary's weapon is their livelihood. You must dedicate your life to the blade, and in turn, it will protect you. "
NPC_000395,"Hello, I'm Andy Kimu, the Mercenary Master of Flarine. The pay is good, but they make me wear this ridiculous looking robe. It's so itchy! I stroke my beard all day just to keep my mind off of it.","Hello, I'm Andy Kimu, the Mercenary Master of Flarine. The pay is good, but they make me wear this ridiculous looking robe. It's so itchy! I stroke my beard all day just to keep my mind off of it."
NPC_000396,"Rhisis will be with you, always, young one.","Rhisis will be with you, always, young one."
NPC_000397,Hmm Aha! Why not ask the vagrants? Maybe they can handle this.,Hmm Aha! Why not ask the vagrants? Maybe they can handle this.
NPC_000398,Merry Christmas! I hope everything goes well this time!,Merry Christmas! I hope everything goes well this time!
NPC_000399,My name is Saint Aramy and I am one of the Santa's in the Madrigal Christmas Society. Nice to meet you,My name is Saint Aramy and I am one of the Santa's in the Madrigal Christmas Society. Nice to meet you
NPC_000400,Hey! Merry Christmas!,Hey! Merry Christmas!
NPC_000401,Hmm It is very hard to track Noie's Planet in the Amedus galaxy. Maybe I have to use the chaos theory.,Hmm It is very hard to track Noie's Planet in the Amedus galaxy. Maybe I have to use the chaos theory.
NPC_000402,"*Hmmm... carry the two, divide by zero, and subtract the square root of fourte... Wait a minute. Divide by zero? That's impossible! This would be so much easier if I had more than just this flimsy abacus.","*Hmmm... carry the two, divide by zero, and subtract the square root of fourte... Wait a minute. Divide by zero? That's impossible! This would be so much easier if I had more than just this flimsy abacus."
NPC_000403,"Hi there! My name is Ata Milleniut and I am learning Astronomy from Noie, my mentor. Hey, do you think you could analyze this fractal curve?","Hi there! My name is Ata Milleniut and I am learning Astronomy from Noie, my mentor. Hey, do you think you could analyze this fractal curve?"
NPC_000404,Argh! Where was I? Distractions...,Argh! Where was I? Distractions...
NPC_000405,Brothers! What should I do? Huh? Christmas.. Christmas will be Ruined!,Brothers! What should I do? Huh? Christmas.. Christmas will be Ruined!
NPC_000406,I hope you have a wonderful Christmas!,I hope you have a wonderful Christmas!
NPC_000407,My name is Saint Atto and I am one of the Santa's in the Madrigal Christmas Society. Nice to meet you,My name is Saint Atto and I am one of the Santa's in the Madrigal Christmas Society. Nice to meet you
NPC_000408,Merry Christmas! Merry Christmas!,Merry Christmas! Merry Christmas!
NPC_000409,"The perfect shields of the Bobo family are only here, in the Shield Shop of Boboku!","The perfect shields of the Bobo family are only here, in the Shield Shop of Boboku!"
NPC_000410,What should I ask you to do?,What should I ask you to do?
NPC_000411,"You won't find a better armor selection in all of Flaris, I'll guarantee you that! ","You won't find a better armor selection in all of Flaris, I'll guarantee you that! "
NPC_000412,"Who am I? You must be joking. I'm only the most famous armorer in Flarine! I'm Boboko Bobo and I run the Bobo family Armor Shop for new Mercenaries, Acrobats and Assists.","Who am I? You must be joking. I'm only the most famous armorer in Flarine! I'm Boboko Bobo and I run the Bobo family Armor Shop for new Mercenaries, Acrobats and Assists."
NPC_000413,Tell your friends buy Bobo Family Equipment!,Tell your friends buy Bobo Family Equipment!
NPC_000414,"Your weapon is looking a little dull there, friend. Thank Rhisis for you, I buy and sell weapons!","Your weapon is looking a little dull there, friend. Thank Rhisis for you, I buy and sell weapons!"
NPC_000415,Here you are. Please solve this as soon as possible.,Here you are. Please solve this as soon as possible.
NPC_000416,"*sighs* Oh, sorry! I was daydreaming about Julia over there. She's so amazing! Hey, do you think a girl like her and a guy like me could ever be? What? How could she resist me?!","*sighs* Oh, sorry! I was daydreaming about Julia over there. She's so amazing! Hey, do you think a girl like her and a guy like me could ever be? What? How could she resist me?!"
NPC_000417,"Greetings from the Bobo Family, stranger! I am Boboku Bobo. I run the Weapon Shop here in Flarine. Have a look around and don't forget to visit my brother's shops!","Greetings from the Bobo Family, stranger! I am Boboku Bobo. I run the Weapon Shop here in Flarine. Have a look around and don't forget to visit my brother's shops!"
NPC_000418,Thanks for stopping by! Tell Julia I said hello!,Thanks for stopping by! Tell Julia I said hello!
NPC_000419,"Do not worry, where there is a will, there is a way.","Do not worry, where there is a will, there is a way."
NPC_000420,Have you been a very good boy this year? Then you should be rewarded with a big present Ha ha ha,Have you been a very good boy this year? Then you should be rewarded with a big present Ha ha ha
NPC_000421,My name is Saint Buruto and I am one of the Santa's in the Madrigal Christmas Society. Nice to meet you,My name is Saint Buruto and I am one of the Santa's in the Madrigal Christmas Society. Nice to meet you
NPC_000422,Ha ha ha! Merry Christmas!,Ha ha ha! Merry Christmas!
NPC_000423,"Mommy, I am hungry.","Mommy, I am hungry."
NPC_000424,"I moved here with my father I do not have citizenship yet, but I will very soon.","I moved here with my father I do not have citizenship yet, but I will very soon."
NPC_000425,"My name is ChiChi Horis, and this is my father Paul Horis.","My name is ChiChi Horis, and this is my father Paul Horis."
NPC_000426,Good bye,Good bye
NPC_000427,The new year has come!,The new year has come!
NPC_000428,"How strange, I cannot remember the Happy New Year song.","How strange, I cannot remember the Happy New Year song."
NPC_000429,Happy new year!,Happy new year!
NPC_000430,New year has come!,New year has come!
NPC_000431,You will be happy with the leader of the chorus. That is me! My name is Monaco.,You will be happy with the leader of the chorus. That is me! My name is Monaco.
NPC_000432,New year has come!,New year has come!
NPC_000433,How strange I do not remember the Happy New Year song.,How strange I do not remember the Happy New Year song.
NPC_000434,New year has come!,New year has come!
NPC_000435,"How strange, I do not remember the Happy New Year song.","How strange, I do not remember the Happy New Year song."
NPC_000436,"Trust in Aenn, and your path shall be lit with the light of a thousand candles.","Trust in Aenn, and your path shall be lit with the light of a thousand candles."
NPC_000437,"The Heroes sacrificed themselves to defeat Shade, but she will one day return. We must prepare.","The Heroes sacrificed themselves to defeat Shade, but she will one day return. We must prepare."
NPC_000438,"My name is Clamb Cobonet, the Ringmaster Wise Man. I am here to preserve the legacy of Aenn, the Ringmaster Hero and to light the path for those that wish to follow in Aenn's footsteps. Have faith, young one, Aenn watches over you.","My name is Clamb Cobonet, the Ringmaster Wise Man. I am here to preserve the legacy of Aenn, the Ringmaster Hero and to light the path for those that wish to follow in Aenn's footsteps. Have faith, young one, Aenn watches over you."
NPC_000439,"Follow the path of Aenn, and you will never be forgotten.","Follow the path of Aenn, and you will never be forgotten."
NPC_000440,Bubble watches over all aspiring heroes. ,Bubble watches over all aspiring heroes. 
NPC_000441,The shields of the Heroes have defended Madrigal from the wrath of Shade. We are forever grateful for their bravery and wish to preserve their memory for all time.,The shields of the Heroes have defended Madrigal from the wrath of Shade. We are forever grateful for their bravery and wish to preserve their memory for all time.
NPC_000442,"My name is Cuarine Coexar and I am the Psykeeper Wise Man. I preserve the history of the Heroes and provide guidance for those wishing to follow the path Offerep, the Psykeeper Hero.","My name is Cuarine Coexar and I am the Psykeeper Wise Man. I preserve the history of the Heroes and provide guidance for those wishing to follow the path Offerep, the Psykeeper Hero."
NPC_000443,"Follow the path of the Heroes, and you will never lose your way.","Follow the path of the Heroes, and you will never lose your way."
NPC_000444,A strange energy emanates from this fountain. What is it?,A strange energy emanates from this fountain. What is it?
NPC_000445,"We lie in wait, preparing for the worst, and hoping for a future to come when the heroes will arise once more.","We lie in wait, preparing for the worst, and hoping for a future to come when the heroes will arise once more."
NPC_000446,"My name is Cuzrill Rembright and I am the Elementor Wise Man. I preserve the history of the Heroes and provide guidance for those wishing to follow the path Lillip, the Elementor Hero.","My name is Cuzrill Rembright and I am the Elementor Wise Man. I preserve the history of the Heroes and provide guidance for those wishing to follow the path Lillip, the Elementor Hero."
NPC_000447,"Trust in the legacy of the Heroes, adventurer. For it is all that can save us now.","Trust in the legacy of the Heroes, adventurer. For it is all that can save us now."
NPC_000448,Welcome to #b#cff0000ffDior Station#nc#nb! You can find #b#cffff0000flying information#nc#nb here.,Welcome to #b#cff0000ffDior Station#nc#nb! You can find #b#cffff0000flying information#nc#nb here.
NPC_000449,"Please, if you can help me, I will be in your debt.","Please, if you can help me, I will be in your debt."
NPC_000450,My family has managed the Flarine Station for generations. I am proud to continue that tradition. ,My family has managed the Flarine Station for generations. I am proud to continue that tradition. 
NPC_000451,"My name is Dior Christin. I've lived in Flarine all my life and I love this place. Look at me, I can't stop bouncing! Anyway, I manage the station here so let me know if you have any questions! ","My name is Dior Christin. I've lived in Flarine all my life and I love this place. Look at me, I can't stop bouncing! Anyway, I manage the station here so let me know if you have any questions! "
NPC_000452,"1. First, you'll need to buy a broom or a board and be at least level 20 in order to fly\n 2. Next, double-click the board or broom in your inventory or simply move it to a hot key to climb aboard.","1. First, you'll need to buy a broom or a board and be at least level 20 in order to fly\n 2. Next, double-click the board or broom in your inventory or simply move it to a hot key to climb aboard."
NPC_000453,3. Press the Space Bar to accelerate your flying vehicle. Press the Space Bar key again while moving to stop. Think of the accelerator like a toggle button for *Go* and *Stop*.,3. Press the Space Bar to accelerate your flying vehicle. Press the Space Bar key again while moving to stop. Think of the accelerator like a toggle button for *Go* and *Stop*.
NPC_000454,"4. To navigate, you can simply hold the Right Mouse Button down and angle the camera in the direction that you want to go.\n Alternatively, you can also use the W, A, S and D controls to turn.","4. To navigate, you can simply hold the Right Mouse Button down and angle the camera in the direction that you want to go.\n Alternatively, you can also use the W, A, S and D controls to turn."
NPC_000455,"5. Additionally, you can simply tap the Right Mouse Button twice to lock the camera to the mouse pointer. This allows you to navigate without holding down the right mouse button. Clicking twice again will turn off this effect.","5. Additionally, you can simply tap the Right Mouse Button twice to lock the camera to the mouse pointer. This allows you to navigate without holding down the right mouse button. Clicking twice again will turn off this effect."
NPC_000456,6. Anyone can fly in Madrigal. You simply have to acquire a flying vehicle!\n 7. There are numerous makes and models of flying vehicles. Trying shopping around in player shops or click the Use Premium Item Shop icon next to the Start Button.,6. Anyone can fly in Madrigal. You simply have to acquire a flying vehicle!\n 7. There are numerous makes and models of flying vehicles. Trying shopping around in player shops or click the Use Premium Item Shop icon next to the Start Button.
NPC_000457,"I hope the information I gave you was helpful. You're on your own now, aviator! See you in the clouds!","I hope the information I gave you was helpful. You're on your own now, aviator! See you in the clouds!"
NPC_000458,"1. Occasionally, you will run into some pesky masquerpets while flying. You will see a red box surrounding them.","1. Occasionally, you will run into some pesky masquerpets while flying. You will see a red box surrounding them."
NPC_000459,"2. You can target these creatures with the Left Mouse Button. If you lose sight of them while flying, a green arrow appears on the edge of the screen to indicate which direction you need to turn. ","2. You can target these creatures with the Left Mouse Button. If you lose sight of them while flying, a green arrow appears on the edge of the screen to indicate which direction you need to turn. "
NPC_000460,"3. To attack the creature, simply get as close as you can and press the Left Mouse Button or the Insert Key.\n 4. If you want to follow the monster automatically, press the Z Key.","3. To attack the creature, simply get as close as you can and press the Left Mouse Button or the Insert Key.\n 4. If you want to follow the monster automatically, press the Z Key."
NPC_000461,5. Magicians and Acrobats can shoot from range while in the air. Mercenaries and Assists must rely on melee attacks. You can also use your skills!,5. Magicians and Acrobats can shoot from range while in the air. Mercenaries and Assists must rely on melee attacks. You can also use your skills!
NPC_000462,"6. When you destroy a flying masquerpet, any dropped loot will be placed into your inventory automatically. If there is no room in your inventory, the loot is lost, so be careful!","6. When you destroy a flying masquerpet, any dropped loot will be placed into your inventory automatically. If there is no room in your inventory, the loot is lost, so be careful!"
