Key,English,Italian
NPC_000719,Please visit whenever you need a special bowl.,Please visit whenever you need a special bowl.
NPC_000720,Shields that have both strength and beauty can be found here in my Shield Shop!,Shields that have both strength and beauty can be found here in my Shield Shop!
NPC_000721,What can you do for me?,What can you do for me?
NPC_000722,"It seems like Bulrox does not like me. Is it bad to make shields beautiful? I think there is nothing wrong with beauty, am I right?","It seems like Bulrox does not like me. Is it bad to make shields beautiful? I think there is nothing wrong with beauty, am I right?"
NPC_000723,My name is Bozman Hangteiler and I run the Shield Shop in Saint City.,My name is Bozman Hangteiler and I run the Shield Shop in Saint City.
NPC_000724,Thank you for visiting me. See you next time!,Thank you for visiting me. See you next time!
NPC_000725,"I will let you watch the best play, performed by Pepoview","I will let you watch the best play, performed by Pepoview"
NPC_000726,I really like stories about heroes. So I am collecting books about them. Do you know the Book of Hero Combat? The book is really great!,I really like stories about heroes. So I am collecting books about them. Do you know the Book of Hero Combat? The book is really great!
NPC_000727,"Pepoview is the best known troupe in Madrigal! I am Brodeay, one of the leaders. Nice to meet you.","Pepoview is the best known troupe in Madrigal! I am Brodeay, one of the leaders. Nice to meet you."
NPC_000728,"Our troupe is always the best! If you come to one of our shows, I will let you watch for free.","Our troupe is always the best! If you come to one of our shows, I will let you watch for free."
NPC_000729,Come and see what superior weapon crafting is like at Weapon Shop of Bulrox!,Come and see what superior weapon crafting is like at Weapon Shop of Bulrox!
NPC_000730,What can you do for me?,What can you do for me?
NPC_000731,"Bill? It seems like he is seeing Tina secretly. Well, it does not matter to me because I like her. She is such a kind and polite girl! The real problem is that fat and obstinate woman! Darn!","Bill? It seems like he is seeing Tina secretly. Well, it does not matter to me because I like her. She is such a kind and polite girl! The real problem is that fat and obstinate woman! Darn!"
NPC_000732,"My name is Bulrox SHynante and I run the Weapon Shop in Saint City. Bill is my best pupil. He is very, very smart Hahaha","My name is Bulrox SHynante and I run the Weapon Shop in Saint City. Bill is my best pupil. He is very, very smart Hahaha"
NPC_000733,Good bye. There is nothing you cannot defeat with my weapons!,Good bye. There is nothing you cannot defeat with my weapons!
NPC_000734,Shields for sale! Please form a single line.,Shields for sale! Please form a single line.
NPC_000735,You are in the right place if you are looking for a good shield. We only sell the highest quality ones.,You are in the right place if you are looking for a good shield. We only sell the highest quality ones.
NPC_000736,My name is Colack I opened this shop when Bozman started selling armor for Acrobats.,My name is Colack I opened this shop when Bozman started selling armor for Acrobats.
NPC_000737,Please visit me again!,Please visit me again!
NPC_000738,"Saint City, the most beautiful place in Madrigal! The ecology here is the blessing of God itself!!","Saint City, the most beautiful place in Madrigal! The ecology here is the blessing of God itself!!"
NPC_000739,Please solve these as soon as possible.,Please solve these as soon as possible.
NPC_000740,"There are various Masquerpets here in Saint City, so I always have lots to do Ha ha ha","There are various Masquerpets here in Saint City, so I always have lots to do Ha ha ha"
NPC_000741,My name is Dr. Estern I am studying the ecology of Madrigal with my 2 brothers.,My name is Dr. Estern I am studying the ecology of Madrigal with my 2 brothers.
NPC_000742,Please enjoy the beauty and mystery of nature.,Please enjoy the beauty and mystery of nature.
NPC_000743,Ha ha ha The history of Madrigal is really mysterious. Do you agree? Ha ha ha,Ha ha ha The history of Madrigal is really mysterious. Do you agree? Ha ha ha
NPC_000744,"History should not be hidden at all, whether it is unpleasant or not.","History should not be hidden at all, whether it is unpleasant or not."
NPC_000745,My name is Gothante Destratin and I am the chairman of the Madrigal Historical Society. You can just call me Gothante.,My name is Gothante Destratin and I am the chairman of the Madrigal Historical Society. You can just call me Gothante.
NPC_000746,"You have to know the history no matter what, right? Ha ha ha","You have to know the history no matter what, right? Ha ha ha"
NPC_000747,"Everyone who wants to be a Magician, please come to me! My name is Hee and I will show you how to be the best Magician.","Everyone who wants to be a Magician, please come to me! My name is Hee and I will show you how to be the best Magician."
NPC_000748,"Being a Magician is the greatest job ever. Magicians are always smarter and more powerful. You agree with me, right?","Being a Magician is the greatest job ever. Magicians are always smarter and more powerful. You agree with me, right?"
NPC_000749,"I am Master Hee Lyu, and I am a Job Master. I am in charge of finding new Magicians, but this job is very boring.","I am Master Hee Lyu, and I am a Job Master. I am in charge of finding new Magicians, but this job is very boring."
NPC_000750,The light of the Magicians will protect you for all time.,The light of the Magicians will protect you for all time.
NPC_000751,Welcome to Saint City. Saint Hall is our most beautiful structure. Enjoy the architecture!,Welcome to Saint City. Saint Hall is our most beautiful structure. Enjoy the architecture!
NPC_000752,"Congratulations, your are now the illustrious leader of your very own guild!","Congratulations, your are now the illustrious leader of your very own guild!"
NPC_000753,"Uh-oh, there seems to be a problem. Are you sure you are the party leader, have 3 party members, and have waited more than 2 days since leaving your last guild? ","Uh-oh, there seems to be a problem. Are you sure you are the party leader, have 3 party members, and have waited more than 2 days since leaving your last guild? "
NPC_000754,"Saint Hall is a very important structure. It is the Main Office and the symbol of Saint City. It was built long ago, and was the very first structure in our fair city. Cool, huh?","Saint Hall is a very important structure. It is the Main Office and the symbol of Saint City. It was built long ago, and was the very first structure in our fair city. Cool, huh?"
NPC_000755,"You do not have 3,000,000 Penya. The tax for creating a new guild is 3,000,000 Penya. Please return to me when you have the money.","You do not have 3,000,000 Penya. The tax for creating a new guild is 3,000,000 Penya. Please return to me when you have the money."
NPC_000756,My name is Helena Obette and I am the Assistant Manager of the Office of Saint City. How can I help you today?,My name is Helena Obette and I am the Assistant Manager of the Office of Saint City. How can I help you today?
NPC_000757,Thanks for stopping by! Enjoy your stay in Saint City!,Thanks for stopping by! Enjoy your stay in Saint City!
NPC_000758,Such a beautiful day! It's a shame to have to work!,Such a beautiful day! It's a shame to have to work!
NPC_000759,"If you come across any rare and precious artifacts in your travels, I can take a look at it and appraise it for you. Just remember good 'ol Helgar!","If you come across any rare and precious artifacts in your travels, I can take a look at it and appraise it for you. Just remember good 'ol Helgar!"
NPC_000760,"My name is Helgar and I'm a connoisseur of rare and precious artifacts. I used to be an archeologist, but then I found out that appraising artifacts for certain stinky rich people is a much better gig. It certainly pays the bills! Hahaha! ","My name is Helgar and I'm a connoisseur of rare and precious artifacts. I used to be an archeologist, but then I found out that appraising artifacts for certain stinky rich people is a much better gig. It certainly pays the bills! Hahaha! "
NPC_000761,Safe travels! Stop by if you run across any rare artifacts!,Safe travels! Stop by if you run across any rare artifacts!
NPC_000762,Gah! An Aibatt's genetic structure is so perplexing! It's like... winged-cyclops DNA!,Gah! An Aibatt's genetic structure is so perplexing! It's like... winged-cyclops DNA!
NPC_000763,"The Madrigal Laboratory is here inside Saint Hall. It is the biggest science institute in all of Madrigal. The flying boards and brooms that we all use were developed here! Pretty cool, huh?","The Madrigal Laboratory is here inside Saint Hall. It is the biggest science institute in all of Madrigal. The flying boards and brooms that we all use were developed here! Pretty cool, huh?"
NPC_000764,"My name is Heltung Mondugane and I am the Chief Researcher of Project 2 here at the Madrigal Laboratory. I would show you around the lab, but we are running some Top Secret experiments at the moment.","My name is Heltung Mondugane and I am the Chief Researcher of Project 2 here at the Madrigal Laboratory. I would show you around the lab, but we are running some Top Secret experiments at the moment."
NPC_000765,"Ciao! Hey, if you come across any new species of Masquerpet, let me know!","Ciao! Hey, if you come across any new species of Masquerpet, let me know!"
NPC_000766,My name is Herth Emaldhan and I am a guide in Saint City.,My name is Herth Emaldhan and I am a guide in Saint City.
NPC_000767,My name is Janne Orgriman and I am a guide in Saint City.,My name is Janne Orgriman and I am a guide in Saint City.
NPC_000768,"Please find my child! Please, Please,","Please find my child! Please, Please,"
NPC_000769,My baby was so cute I can still hear her voice.,My baby was so cute I can still hear her voice.
NPC_000770,My name is JeongHwa Song I moved here to Saint City a few years ago.,My name is JeongHwa Song I moved here to Saint City a few years ago.
NPC_000771,The name of my daughter is Jingyoung. Please let me know if you find her.,The name of my daughter is Jingyoung. Please let me know if you find her.
NPC_000772,Healthy body for healthy mind! Here are some delicious foods made by Karin! They are good for your health!,Healthy body for healthy mind! Here are some delicious foods made by Karin! They are good for your health!
NPC_000773,What can you do for me?,What can you do for me?
NPC_000774,"I do not like Bulrox, and I do not like Bill. How could my daughter like that kind of.. Ugh! It is making me crazy!","I do not like Bulrox, and I do not like Bill. How could my daughter like that kind of.. Ugh! It is making me crazy!"
NPC_000775,"My name is Karin Sharafobhan and I run the Food Shop here in Saint City. My daughter, Tina, is the beauty of Saint City.","My name is Karin Sharafobhan and I run the Food Shop here in Saint City. My daughter, Tina, is the beauty of Saint City."
NPC_000776,Good bye! Enjoy healthy food all the time!,Good bye! Enjoy healthy food all the time!
NPC_000777,My name is Kimberley Prosis and I am a guide here in Saint City And Jeff in Flarine is my husband. Maybe you have met him.,My name is Kimberley Prosis and I am a guide here in Saint City And Jeff in Flarine is my husband. Maybe you have met him.
NPC_000778,We offer quests put out by the citizens of Saint City. These quests are for anyone who is level 27 or higher.,We offer quests put out by the citizens of Saint City. These quests are for anyone who is level 27 or higher.
NPC_000779,Welcome! My name is Lancomi and I am the head of the quest center in Saint City. We collect quests from the citizens and then list them here for you.,Welcome! My name is Lancomi and I am the head of the quest center in Saint City. We collect quests from the citizens and then list them here for you.
NPC_000780,My name is Leann Hentte and I am a guide here in Saint City.,My name is Leann Hentte and I am a guide here in Saint City.
NPC_000781,My name is Saint Pang. I am the second child of the Pang family. We have been managing the Lodelight for generations.,My name is Saint Pang. I am the second child of the Pang family. We have been managing the Lodelight for generations.
NPC_000782,Honor the will of Rhisis! Show the anger of Rhisis! Be the curse of Rhisis!,Honor the will of Rhisis! Show the anger of Rhisis! Be the curse of Rhisis!
NPC_000783,Being a Magician requires strong spirit. You cannot be a real Magician if you do not train your spirit well.,Being a Magician requires strong spirit. You cannot be a real Magician if you do not train your spirit well.
NPC_000784,I am Sergeant Lopaze Jenip of the Madrigal Job Training Center I will help you to become the best Magician.,I am Sergeant Lopaze Jenip of the Madrigal Job Training Center I will help you to become the best Magician.
NPC_000785,Strong spirit! This is the symbol of the Magician. Please do not forget that.,Strong spirit! This is the symbol of the Magician. Please do not forget that.
NPC_000786,"Do you want to use great and powerful magic? Then you should visit me, Martin!","Do you want to use great and powerful magic? Then you should visit me, Martin!"
NPC_000787,"Here, there are lots of things to ask you Ha ha ha","Here, there are lots of things to ask you Ha ha ha"
NPC_000788,"I heard that Mule got into trouble In terms of magic skill, Mule was much better than me. What a pity, I think Marche is having a hard time because of the incident.","I heard that Mule got into trouble In terms of magic skill, Mule was much better than me. What a pity, I think Marche is having a hard time because of the incident."
NPC_000789,My name is Martin Scornsiege and I run the Magic Shop in Saint City I am also the chairman of the Society for the Study of Magic Ha ha ha,My name is Martin Scornsiege and I run the Magic Shop in Saint City I am also the chairman of the Society for the Study of Magic Ha ha ha
NPC_000790,Good bye I hope your path will be lit by magical power.,Good bye I hope your path will be lit by magical power.
NPC_000791,"Oh, cool! Wow! I really want to have one!","Oh, cool! Wow! I really want to have one!"
NPC_000792,"Hehehe I like special things that nobody else has and pretty girls, too! Hehehe","Hehehe I like special things that nobody else has and pretty girls, too! Hehehe"
NPC_000793,"Hey, there! I am Mayun Song People are always saying I am impolite but this is just my style, man! Whatever..","Hey, there! I am Mayun Song People are always saying I am impolite but this is just my style, man! Whatever.."
NPC_000794,See ya!,See ya!
NPC_000795,Welcome to the Saint City Station! We provide detailed and safe flying services!,Welcome to the Saint City Station! We provide detailed and safe flying services!
NPC_000796,"Our blood will soak the ground, and our shouts will echo across the skies. Then everything shall fall to their will.","Our blood will soak the ground, and our shouts will echo across the skies. Then everything shall fall to their will."
NPC_000797,"My name is Parine Hoavent and I am the scion of Lillip. At the moment, I am learning how to manage the Station from Tina.","My name is Parine Hoavent and I am the scion of Lillip. At the moment, I am learning how to manage the Station from Tina."
NPC_000798,We offer special services for our customers here at Saint City Station!,We offer special services for our customers here at Saint City Station!
NPC_000799,It is strange. It is weird. Hmm,It is strange. It is weird. Hmm
NPC_000800,"Oh! I was thinking so deeply that I did not know you were there. Yes, it is nice to meet you.","Oh! I was thinking so deeply that I did not know you were there. Yes, it is nice to meet you."
NPC_000801,My name is Porgo Berldent and I am the mayor of the Society for Studying Disappearances in Saint City Ha ha ha,My name is Porgo Berldent and I am the mayor of the Society for Studying Disappearances in Saint City Ha ha ha
NPC_000802,Would you work for our society? It is okay if you do not want to.,Would you work for our society? It is okay if you do not want to.
NPC_000803,Hello! Hehehe,Hello! Hehehe
NPC_000804,There are so many rare and precious things in the world I will never die until I collect all of them. Never!,There are so many rare and precious things in the world I will never die until I collect all of them. Never!
NPC_000805,I am collecting everything rare and precious in the world. Some people call me the Strange Collector.,I am collecting everything rare and precious in the world. Some people call me the Strange Collector.
NPC_000806,Good bye! Please find me if you have anything rare and precious!,Good bye! Please find me if you have anything rare and precious!
NPC_000807,"Oh! Please be careful, this is a very important one! It is an ancient document!!","Oh! Please be careful, this is a very important one! It is an ancient document!!"
NPC_000808,"The ancient documents should be treated very carefully, because they are very old and fragile.","The ancient documents should be treated very carefully, because they are very old and fragile."
NPC_000809,My name is Rovanett Ganelis I am in charge of keeping the ancient documents here at the public library in Saint City.,My name is Rovanett Ganelis I am in charge of keeping the ancient documents here at the public library in Saint City.
NPC_000810,Please visit again whenever you need to see any of the documents.,Please visit again whenever you need to see any of the documents.
NPC_000811,"Everyone in Saint City, are you happy? I am doing the best I can.","Everyone in Saint City, are you happy? I am doing the best I can."
NPC_000812,I am making a tour to hear the opinions of people in Saint City. May I help you?,I am making a tour to hear the opinions of people in Saint City. May I help you?
NPC_000813,I am the mayor of Saint City. I am in charge of pretty much everything here.,I am the mayor of Saint City. I am in charge of pretty much everything here.
NPC_000814,For Saint City!,For Saint City!
NPC_000815,All the information you need about flying is here at the Station.,All the information you need about flying is here at the Station.
NPC_000816,I would like to ask you to do something for me.,I would like to ask you to do something for me.
NPC_000817,"Bill and I love each other very much, but my mother is not getting along with him. So we are seeing each other secretly.","Bill and I love each other very much, but my mother is not getting along with him. So we are seeing each other secretly."
NPC_000818,My name is Tina Sharafobhan and I manage the Station in Saint City. The woman who runs the Food Shop is my mother.,My name is Tina Sharafobhan and I manage the Station in Saint City. The woman who runs the Food Shop is my mother.
NPC_000819,I hope you enjoy your flying!,I hope you enjoy your flying!
NPC_000820,"You know, they say acting is 'reacting'. Not sure why I need to dig a hole, though.","You know, they say acting is 'reacting'. Not sure why I need to dig a hole, though."
NPC_000821,My hands are covered with blisters! Anyone have any gloves?,My hands are covered with blisters! Anyone have any gloves?
NPC_000822,Who ever thought that trying to dig through solid stone was a good idea should be shot.,Who ever thought that trying to dig through solid stone was a good idea should be shot.
NPC_000823,"We're rehearsing for our play, 'Romao and Juliat'. What do you think about my acting? Do you like it?","We're rehearsing for our play, 'Romao and Juliat'. What do you think about my acting? Do you like it?"
NPC_000824,"Greetings, theatre patron! We are all members of the Pepoview Troupe! We are renowned throughout Madrigal for our brilliant performances. I'm sorry to cut this short, but I must get back to rehearsal. Bye! ","Greetings, theatre patron! We are all members of the Pepoview Troupe! We are renowned throughout Madrigal for our brilliant performances. I'm sorry to cut this short, but I must get back to rehearsal. Bye! "
NPC_000825,On with the show!,On with the show!
NPC_000826,"Oh, Juliat. You are as beautiful as a wet dog.","Oh, Juliat. You are as beautiful as a wet dog."
NPC_000827,"Juliat, I beg you, close your window. You're scaring the children!","Juliat, I beg you, close your window. You're scaring the children!"
NPC_000828,"Juliat, there's someone else. I'm leaving you for your brother!","Juliat, there's someone else. I'm leaving you for your brother!"
NPC_000829,"Our love is like a splinter. Unwanted, sharp, and painful!","Our love is like a splinter. Unwanted, sharp, and painful!"
NPC_000830,"We're rehearsing for our play, 'Romao and Juliat'. What do you think about my acting? Do you like it?","We're rehearsing for our play, 'Romao and Juliat'. What do you think about my acting? Do you like it?"
NPC_000831,"Oh, happy dagger! Goodbye Romao!","Oh, happy dagger! Goodbye Romao!"
NPC_000832,"My window will be open for you, forever.","My window will be open for you, forever."
NPC_000833,"Romao, I will always love you. Please come back! What about our buffs?!","Romao, I will always love you. Please come back! What about our buffs?!"
NPC_000834,Have at thee! Ha!,Have at thee! Ha!
NPC_000835,"Our feud runs deep, Romao! You cannot have my sister!","Our feud runs deep, Romao! You cannot have my sister!"
NPC_000836,"Parting is such sweet... Erhm, line please?","Parting is such sweet... Erhm, line please?"
NPC_000837,"Juliat, he doesn't want you anymore. On the bright side, you get to live!","Juliat, he doesn't want you anymore. On the bright side, you get to live!"
NPC_000838,"I really need to finish these accounting numbers for the troupe. Man, I sure do hate math.","I really need to finish these accounting numbers for the troupe. Man, I sure do hate math."
NPC_000839,"Oh, Iblis above! We have so much to do before our next performance. Will we be ready?","Oh, Iblis above! We have so much to do before our next performance. Will we be ready?"
NPC_000840,Where's my daughter? Has anyone seen her?,Where's my daughter? Has anyone seen her?
NPC_000841,Pepoview! Pepoview! I love the cheer of the crowd after a good performance.,Pepoview! Pepoview! I love the cheer of the crowd after a good performance.
NPC_000842,Would you do me a favor?,Would you do me a favor?
NPC_000843,The whole world has been plunged into confusion and the only thing we can hear is groaning.,The whole world has been plunged into confusion and the only thing we can hear is groaning.
NPC_000844,Are you ready to carry this burden for your whole life? Do you have the confidence to be a Magician?,Are you ready to carry this burden for your whole life? Do you have the confidence to be a Magician?
NPC_000845,It depends on you whatever you choose. But there will be less of a struggle if you listen to your feelings.,It depends on you whatever you choose. But there will be less of a struggle if you listen to your feelings.
NPC_000846,I am Major Wingyei Spero of the Madrigal Job Training Center. You are in the right place if you want to feel the strong magic power of a Magician.,I am Major Wingyei Spero of the Madrigal Job Training Center. You are in the right place if you want to feel the strong magic power of a Magician.
NPC_000847,Believe in your own will!,Believe in your own will!
NPC_000848,"Do you want to use splendid magic? Then you should visit the Magic Shop that I, Haven, own!","Do you want to use splendid magic? Then you should visit the Magic Shop that I, Haven, own!"
NPC_000849,"Whatever you choose, you should follow through.","Whatever you choose, you should follow through."
NPC_000850,"To be honest I like Achaben. But I am not sure if he will accept me, because I am older than him.","To be honest I like Achaben. But I am not sure if he will accept me, because I am older than him."
NPC_000851,My name is Haven Bgeoner. I run the Magic Shop here in Darken.,My name is Haven Bgeoner. I run the Magic Shop here in Darken.
NPC_000852,Take care,Take care
NPC_000853,Here are various goods crafted by nomads! Come to the General Shop!,Here are various goods crafted by nomads! Come to the General Shop!
NPC_000854,What will you do for me?,What will you do for me?
NPC_000855,"We are just nomad merchants, but we, the Khan Union, are well known for our various products in Madrigal.","We are just nomad merchants, but we, the Khan Union, are well known for our various products in Madrigal."
NPC_000856,My name is Tandy Khan and I am selling various goods.,My name is Tandy Khan and I am selling various goods.
NPC_000857,Enjoy your flight!,Enjoy your flight!
NPC_000858,I will do my best for the happiness of the people in Darkon! Please trust me.,I will do my best for the happiness of the people in Darkon! Please trust me.
NPC_000859,What can you do for me?,What can you do for me?
NPC_000860,I am making the rounds in order to hear the opinions of people in Darken. May I help you?,I am making the rounds in order to hear the opinions of people in Darken. May I help you?
NPC_000861,I am the Mayor of Darken City.,I am the Mayor of Darken City.
NPC_000862,For Darken!,For Darken!
NPC_000863,"Hmm It seems that you are not the party leader, or you have less than 3 party members. Also, it may not have been more than 2 days since you left your old guild.","Hmm It seems that you are not the party leader, or you have less than 3 party members. Also, it may not have been more than 2 days since you left your old guild."
NPC_000864,"Are you ready to create your new guild? If you are not, please go I am very busy right now.","Are you ready to create your new guild? If you are not, please go I am very busy right now."
NPC_CREATEGUILD,Create Guild,Create Guild
NPC_KEEPGOING,Keep Going,Keep Going
NPC_000868,Leave my sight if you lack the necessary skills to succeed!,Leave my sight if you lack the necessary skills to succeed!
